StartDate,EndDate,Status,IPAddress,Progress,Duration (in seconds),Finished,RecordedDate,ResponseId,RecipientLastName,RecipientFirstName,RecipientEmail,ExternalReference,LocationLatitude,LocationLongitude,DistributionChannel,UserLanguage,Q112,Q72,Q92_1,Q96_1,Q1724,Q1725,Q1726_1,Q1726_2,Q1726_3,Q1726_4,Q1726_5,Q1726_6,Q1727,Q1728,Q1729,Q1730,Q1757,Q1758,Q1759_1,Q1759_2,Q1759_3,Q1759_4,Q1759_5,Q1759_6,Q1760,Q1761,Q1762,Q1763,Q1787,Q1788,Q1789_1,Q1789_2,Q1789_3,Q1789_4,Q1789_5,Q1789_6,Q1790,Q1791,Q1792,Q1793,Q1817,Q1818,Q1819_1,Q1819_2,Q1819_3,Q1819_4,Q1819_5,Q1819_6,Q1820,Q1821,Q1822,Q1823,Q1861,Q1862,Q867,Q1734,Q1735,Q1736_1,Q1736_2,Q1736_3,Q1736_4,Q1736_5,Q1736_6,Q1737,Q1738,Q1739,Q1740,Q1767,Q1768,Q1769_1,Q1769_2,Q1769_3,Q1769_4,Q1769_5,Q1769_6,Q1770,Q1771,Q1772,Q1773,Q1797,Q1798,Q1799_1,Q1799_2,Q1799_3,Q1799_4,Q1799_5,Q1799_6,Q1800,Q1801,Q1802,Q1803,Q1827,Q1828,Q1829_1,Q1829_2,Q1829_3,Q1829_4,Q1829_5,Q1829_6,Q1830,Q1831,Q1832,Q1833,Q1744,Q1745,Q1746_1,Q1746_2,Q1746_3,Q1746_4,Q1746_5,Q1746_6,Q1747,Q1748,Q1749,Q1750,Q1777,Q1778,Q1779_1,Q1779_2,Q1779_3,Q1779_4,Q1779_5,Q1779_6,Q1780,Q1781,Q1782,Q1783,Q1807,Q1808,Q1809_1,Q1809_2,Q1809_3,Q1809_4,Q1809_5,Q1809_6,Q1810,Q1811,Q1812,Q1813,Q1837,Q1838,Q1839_1,Q1839_2,Q1839_3,Q1839_4,Q1839_5,Q1839_6,Q1840,Q1841,Q1842,Q1843,Q1684,Q1685,Q1686_1,Q1686_2,Q1686_3,Q1686_4,Q1686_5,Q1686_6,Q1687,Q1688,Q1689,Q1690,Q1694,Q1695,Q1696_1,Q1696_2,Q1696_3,Q1696_4,Q1696_5,Q1696_6,Q1697,Q1698,Q1699,Q1700,Q1704,Q1705,Q1706_1,Q1706_2,Q1706_3,Q1706_4,Q1706_5,Q1706_6,Q1707,Q1708,Q1709,Q1710,Q1714,Q1715,Q1716_1,Q1716_2,Q1716_3,Q1716_4,Q1716_5,Q1716_6,Q1717,Q1718,Q1719,Q1720,Q98,Q1644,Q1645,Q1646_1,Q1646_2,Q1646_3,Q1646_4,Q1646_5,Q1646_6,Q1647,Q1648,Q1649,Q1650,Q1654,Q1655,Q1656_1,Q1656_2,Q1656_3,Q1656_4,Q1656_5,Q1656_6,Q1657,Q1658,Q1659,Q1660,Q1664,Q1665,Q1666_1,Q1666_2,Q1666_3,Q1666_4,Q1666_5,Q1666_6,Q1667,Q1668,Q1669,Q1670,Q1674,Q1675,Q1676_1,Q1676_2,Q1676_3,Q1676_4,Q1676_5,Q1676_6,Q1677,Q1678,Q1679,Q1680,Q69,Q67,Q64,Q69 2,Q73,type,task,Enter Embedded Data Field Name Here...
7/25/17 21:17,7/25/17 21:20,0,70.160.245.93,100,191,1,7/25/17 21:20,R_2w0PXalk3oXv2ah,,,,,37.24380493,-76.72750092,anonymous,EN,A26ERTJPV1A1IM,"1,2",3,6,,,,,,,,,,,,,,,,,,,,,,,,,,,,,,,,,,,,,,,,,,,,,,,,,,,,,,,,,,,,,,,,,,,,,,,,,,,,,,,,,,,,,,,,,,,,,,,,,,,,,,,,,,,,,,,,,,,,,,,,,,,,,,,,,,,,,,,,,,,,,,,,,,,,,,,,,,,,,,,,,,,,,,,,,,,,,,,,,,,,,,,,,,,,,,,,,,,,5,,,,,,,,,,,,,5,"That's part of the manager's job, so that's what I would expect. It would be most fair to ask employees about their preferences, though.",4,4,4,5,2,5,"He may not always like his schedule, but that happens in life.",5,I have information to the contrary.,1,,,,,,,,,,,,,,,,,,,,,,,,,2,37,1,8,1,5,2,
7/25/17 21:17,7/25/17 21:21,0,104.156.115.18,100,233,1,7/25/17 21:21,R_2TuCljOJOo7Pm7a,,,,,37.31689453,-82.63960266,anonymous,EN,A30MP4LXV4MIFD,"1,2",3,6,,,,,,,,,,,,,,,,,,,,,,,,,,,,,,,,,,,,,,,,,,,,,,,,,,,,,,,,,,,,,,,,,,,,,,,,,,,,,,,,,,,,,,,,,,,,,,,,,,,,,,,,,,,,,,,,,,,,,,,,,,,,,,,,,,,,,,,,,,,,,,,,,,,,,,,,,,,,,,,,,,,,,,,,,,,,,,,,,,,,,,,,,,,,,,,,,,,,5,,,,,,,,,,,,,,,,,,,,,,,,,,,,,,,,,,,,,6,"Presumably, Chris took the job as customer service knowing that calls could be screened for quality purposes.",4,2,6,3,2,4,"If Chris does a good job, he should feel proud of his work being sampled.",4,"I'm not sure, but I would hope the manager makes good quality evaluations.",1,2,29,2,3,1,5,4,
7/25/17 21:17,7/25/17 21:21,0,108.178.210.163,100,253,1,7/25/17 21:21,R_2U3mM0GT62FbRlP,,,,,41.84829712,-87.65170288,anonymous,EN,A1XBIR0KLCVY08,"1,2",3,6,,,,,,,,,,,,,,,,,,,,,,,,,,,,,,,,,,,,,,,,,,,,,,,,,3,algorithm picked applicants that the manager should interview,patterns or certain things the computer filters and searches for to narrow the search and get an accurate result of exactly what you're looking for,,,,,,,,,,,,,,,,,,,,,,,,,3,"I feel like sometimes there can be problems with technology and if it what he had on his resume wasn't exact, then it wouldn't give him a fair chance",1,1,1,7,7,7,He wouldn't feel as if he had a fair chance,4,It's a hit or a miss,1,,,,,,,,,,,,,,,,,,,,,,,,,,,,,,,,,,,,,,,,,,,,,,,,,,,,,,,,,,,,,,,,,,,,,,,,,,,,,,,,,,,,,,,,,,,,,,,,,,,,,,,,,,,,,,,,,,,,,,,,,,,,,,,,,,,,,,,,,,,,,,,,,,,,,,,,,,,,,,1,22,1,5,1,3,3,
7/25/17 21:17,7/25/17 21:21,0,68.39.28.83,100,273,1,7/25/17 21:21,R_2qDlU71A1Q9D8xW,,,,,41.09959412,-85.06349945,anonymous,EN,A20BMZQJS92QY2,"1,2",3,6,,,,,,,,,,,,,,,,,,,,,,,,,,,,,,,,,,,,,,,,,,,,,,,,,,,A program that takes certain facts to make judgments about situations.,,,,,,,,,,,,,,,,,,,,,,,,,,,,,,,,,,,,,,,,,,,,,,,,,,,,,,,,,,,,,,,,,,,,,,,,,,,,,,,,,,,,,,,,,,,,,,,,,,,,,,,,,,,,,3,Scheduling in some instances needs human intervention for people that cant work certain shifts for example,4,4,4,4,4,4,It is not possible to know if Chris would be happy or any of these feelings without more information.,3,An algorithm won't know little things about the employees that a supervisor would,1,,,,,,,,,,,,,,,,,,,,,,,,,1,,,,,,,,,,,,,,,,,,,,,,,,,,,,,,,,,,,,,,,,,,,,,,,,,1,41,1,1,1,1,2,
7/25/17 21:18,7/25/17 21:22,0,162.231.57.35,100,203,1,7/25/17 21:22,R_rqDSjsteJyqlRzb,,,,,32.73710632,-117.0881042,anonymous,EN,A1ZDR2UN7M92LI,"1,2",3,6,,,,,,,,,,,,,,,,,,,,,,,,,5,The algorithm is based off of analyzation of peoples resumes. ,4,3,4,5,5,5,I'm sure he's not thrilled that a human isn't judging him. ,5,I'm sure the manager will use the results in a positive manner.,1,,,,,,,,,,,,,3,"The algorithm processes and analyzes the resumes, picks the top ones, then the manager decides from there who to choose. ",Computer generated analyzations. ,,,,,,,,,,,,,,,,,,,,,,,,,,,,,,,,,,,,,,,,,,,,,,,,,,,,,,,,,,,,,,,,,,,,,,,,,,,,,,,,,,,,,,,,,,,,,,,,,,,,,,,,,,,,,,,,,,,,,,,,,,,,,,,,,,,,,,,,,,,,,,,,,,,,,,,,,,,,,,,,,,,,,,,,,,,,,,,,,,,,,,,,,,,,,,,,,,2,33,2,5,1,2,3,
7/25/17 21:19,7/25/17 21:22,0,73.6.208.83,100,171,1,7/25/17 21:22,R_6GtcM34s8rOx0U9,,,,,29.54469299,-95.33699799,anonymous,EN,A2YFLGU51ST022,"1,2",3,6,,,,,,,,,,,,,,,,,,,,,,,,,,,,,,,,,,,,,,,,,,,,,,,,,3,It was needed by both to evaluate the performance of Chris,They are computations that help solve problems,,,,,,,,,,,,,,,,,,,,,,,,,,,,,,,,,,,,,,,,,,,,,,,,,,,,,,,,,,,,,,,,,,,,,,,,,,,,,,,,,,,,,5,It works for Chris and is fair,4,5,4,3,4,4,It's hard to know how Chris would feel,5,It could work ,1,,,,,,,,,,,,,,,,,,,,,,,,,,,,,,,,,,,,,,,,,,,,,,,,,,,,,,,,,,,,,,,,,,,,,,,,,,,,,,,,,,,,,,,,,,,,,,,,,,2,31,2,5,4,4,4,
7/25/17 21:17,7/25/17 21:22,0,184.224.0.101,100,290,1,7/25/17 21:22,R_2B2PC0SoER4mMrd,,,,,41.24000549,-95.96499634,anonymous,EN,A10TWCI2VE0LWJ,"1,2",3,6,,,,,,,,,,,,,,,,,,,,,,,,,,,,,,,,,,,,,,,,,,,,,,,,,,,Computer based calculations on an employees performance based on the call content and customer tones.,,,,,,,,,,,,,,,,,,,,,,,,,,,,,,,,,,,,,,,,,,,,,,,,,,,,,,,,,,,,,,,,,,,,,,,,,,,,,,,,,,,,,,,,,,,,,,,,,,,,,,,,,,,,,,,,,,,,,,,,,,,,,,,,,,,,,3,I believe this system is likely set up to make performance reviews very difficult.,2,2,3,6,5,6,This is how I would feel in his shoes. ,2,Most automated systems make things harder than they would be without them.,1,1,,,,,,,,,,,,,,,,,,,,,,,,,,,,,,,,,,,,,,,,,,,,,,,,,1,26,1,3,2,1,4,
7/25/17 21:18,7/25/17 21:22,0,162.225.150.26,100,241,1,7/25/17 21:22,R_zegyxC43loc5KWR,,,,,37.63049316,-122.4111023,anonymous,EN,A6NNTKY436XR8,"1,2",3,6,,,,,,,,,,,,,,,,,,,,,,,,,,,,,,,,,,,,,,,,,,,,,,,,,,,,,,,,,,,,,,,,,,,,,,,,,,,,,,,,,,,,,,,,,,,,,,,,,,,,,,,,,,,,,,,,,,,,,,,,,,,,,,,,,,,,,,,,,,,,,,,,,,,,,,,,,,,,,,,,,,,,,,,,,,,,,,,,,,,,,,,,,,,,,,,,,,,,5,,,,,,,,,,,,,6,It's the manager duty to schedule based on availability and customer volume. ,6,2,4,3,3,2,Mornings are good because Chris can relax at night and plan outings at night. ,5,The manager is competent enough,1,,,,,,,,,,,,,,,,,,,,,,,,,2,22,2,5,4,5,2,
7/25/17 21:18,7/25/17 21:22,0,172.124.107.223,100,276,1,7/25/17 21:22,R_3FRKTkFB7DkN4xx,,,,,35.94659424,-78.79769897,anonymous,EN,A2B8HPIZDKYKDR,"1,2",3,6,,,,,,,,,,,,,,,,,,,,,,,,,,,,,,,,,,,,,,,,,,,,,,,,,3,Chris was an employee. An algorithm determined what areas needed to be fixed/checked and a manger oversaw that the algorithm was working fine.,Computer programs that handle lots of data to make efficient determinations. ,7,Algorithms aren't punishment. It's just a formula for spotting problems which is adjusted by the manager to ensure it's working and efficient. Everything is fair about it.,1,1,1,2,1,2,I think he wouldn't feel much. He'd almost be ambivalent. It's just his job to do the task. ,6,It's an algorithm so it's not flawless. It's constantly being adjusted to fit the needs of the factory. But it's being monitored by a human manger to make sure it's doing it's job so I have trust in it. ,1,,,,,,,,,,,,,,,,,,,,,,,,,,,,,,,,,,,,,,,,,,,,,,,,,,,,,,,,,,,,,,,,,,,,,,,,,,,,,,,,,,,,,,,,,,,,,,,,,,,,,,,,,,,,,,,,,,,,,,,,,,,,,,,,,,,,,,,,,,,,,,,,,,,,,,,,,,,,,,,,,,,,,,,,,,,,,,,,,,,,,,1,44,2,5,1,3,1,
7/25/17 21:18,7/25/17 21:22,0,172.58.43.91,100,240,1,7/25/17 21:22,R_Rh73RXFtNyIFvZn,,,,,47.38240051,-122.313797,anonymous,EN,AX1I9MBLJDKGA,"1,2",3,6,,,,,,,,,,,,,,,,,,,,,,,,,,,,,,,,,,,,,,,,,,,,,,,,,,,Programs that run based on a specific set of rules programmed by a human.,,,,,,,,,,,,,,,,,,,,,,,,,,,,,,,,,,,,,,,,,,,,,,,,,,,,,,,,,,,,,,,,,,,,,,,,,,,,,,,,,,,,,,,,,,,,,,,,,6,Because it seems like it would be more accurate than a human.,4,2,1,2,2,2,Because he would have no feelings or negative feelings about a computer because it would not benefit him that much.,6,Because it is set by rules that never change.,1,,,,,,,,,,,,,,,,,,,,,,,,,,,,,,,,,,,,,1,,,,,,,,,,,,,,,,,,,,,,,,,,,,,,,,,,,,,,,,,,,,,,,,,1,32,2,4,3,1,1,
7/25/17 21:17,7/25/17 21:22,0,67.85.53.32,100,342,1,7/25/17 21:22,R_3MhVTeXrOSRPQdU,,,,,40.81159973,-73.88559723,anonymous,EN,A1OXH5KBOCJKSX,"1,2",3,6,,,,,,,,,,,,,,,,,,,,,,,,,,,,,,,,,,,,,,,,,,,,,,,,,3,One was watching performance and another was watching how busy the shop was during which hours. Managerial input added to statistical input.,Mathematical patterns that you can see. ,,,,,,,,,,,,,,,,,,,,,,,,,,,,,,,,,,,,,,,,,,,,,,,,,,,,,,,,,,,,,6,Seems like a logical way to come to a conclusion that would be good for business.,4,4,1,2,2,2,I don't really think it would cause any conflict or happiness. It would just be how it is done.,6,It seems like you would have a good amount of data to make the scheduling decisions. ,1,,,,,,,,,,,,,,,,,,,,,,,,,,,,,,,,,,,,,,,,,,,,,,,,,,,,,,,,,,,,,,,,,,,,,,,,,,,,,,,,,,,,,,,,,,,,,,,,,,,,,,,,,,,,,,,,,,,,,,,,,,2,58,1,4,1,4,2,
7/25/17 21:17,7/25/17 21:22,0,73.143.164.167,100,304,1,7/25/17 21:22,R_1hDO11q4p8FVmeV,,,,,41.68159485,-72.94049835,anonymous,EN,A26U4IKXMXT0ZA,"1,2",3,6,,,,,,,,,,,,,,,,,,,,,,,,,3,"Chris may be qualified for the job, but just may not have the keywords in his resume for which the algorithm is searching. He deserves to have someone read his resume and evaluate it, not a computer.",2,2,2,6,5,7,I think Chris would feel like he wasn't given a fair chance if he wasn't selected for the interview.,7,It seems like the manager is not looking at the resumes himself. It seems as if he is only letting the computer do the work.,1,,,,,,,,,,,,,1,The manage is looking for someone to hire for a job. The resumes and applications are fed into a computer and the algorithm selects which candidates are the top level ones. The manager then selects which ones he will interview.,They are a set of rules a computer uses to make decisions.,,,,,,,,,,,,,,,,,,,,,,,,,,,,,,,,,,,,,,,,,,,,,,,,,,,,,,,,,,,,,,,,,,,,,,,,,,,,,,,,,,,,,,,,,,,,,,,,,,,,,,,,,,,,,,,,,,,,,,,,,,,,,,,,,,,,,,,,,,,,,,,,,,,,,,,,,,,,,,,,,,,,,,,,,,,,,,,,,,,,,,,,,,,,,,,,,,1,35,1,5,1,2,3,
7/25/17 21:18,7/25/17 21:23,0,65.27.201.77,100,285,1,7/25/17 21:23,R_3hlTG3CABbNR4qU,,,,,39.7519989,-84.2460022,anonymous,EN,A1KRKLRUJKQIPZ,"1,2",3,6,,,,,,,,,,,,,,,,,,,,,,,,,,,,,,,,,,,,,,,,,,,,,,,,,3,The algorithm analyzes customer load to make scheduling recommendations for the manager to follow,Predictions based upon data and data analysis,,,,,,,,,,,,,3,Because he may not get the hours/shifts he needs,4,3,2,3,4,4,Very hard to argue your case to an algorithm,2,Because years of retail has shown me that customers are unpredictable,1,,,,,,,,,,,,,,,,,,,,,,,,,,,,,,,,,,,,,,,,,,,,,,,,,,,,,,,,,,,,,,,,,,,,,,,,,,,,,,,,,,,,,,,,,,,,,,,,,,,,,,,,,,,,,,,,,,,,,,,,,,,,,,,,,,,,,,,,,,,,,,,,,,,,,,,,,,,,,,,,,,,,,,,,,,1,32,1,6,1,3,2,
7/25/17 21:18,7/25/17 21:23,0,75.102.135.243,100,301,1,7/25/17 21:23,R_3fjUHlOpoggYFgz,,,,,38.94129944,-76.49150085,anonymous,EN,A12B75BASNGEMQ,"1,2",3,6,,,,,,,,,,,,,,,,,,,,,,,,,,,,,,,,,,,,,6,Algorithms ensure that the evaluation is objective,6,5,5,3,4,5,I feel he would not be disappointed that the manager is using a new and more objective system for evaluations,6,"Although it lacks a human element, and is prone to certain errors, algorithms are generally trustworthy",1,1,The manager relies on the algoritm to make evaluations ,A set of steps or rules outlining a process to follow,,,,,,,,,,,,,,,,,,,,,,,,,,,,,,,,,,,,,,,,,,,,,,,,,,,,,,,,,,,,,,,,,,,,,,,,,,,,,,,,,,,,,,,,,,,,,,,,,,,,,,,,,,,,,,,,,,,,,,,,,,,,,,,,,,,,,,,,,,,,,,,,,,,,,,,,,,,,,,,,,,,,,,,,,,,,,,,,,,,,,,,,,,,,,,,,,,3,21,1,3,1,2,4,
7/25/17 21:17,7/25/17 21:23,0,66.243.233.240,100,346,1,7/25/17 21:23,R_3JF1ovLO9X53o8x,,,,,46.97900391,-120.4702988,anonymous,EN,AAU61MG2R6RH0,"1,2",3,6,,,,,,,,,,,,,,,,,,,,,,,,,,,,,,,,,,,,,,,,,,,,,,,,,,,,,,,,,,,,,,,,,,,,,,,,,,,,,,,,,,,,,,,,,,,,,,,,,,,,,,,,,,,,,,,,,,,,,,,,,,,,,,,,,,,,,,,,,,,,,,,,,,,,,,,,,,,,,,,,,,,,,,,,,,,,,,,,,,,,,,,,,,,,,,,,,,,,5,,,,,,,,,,,,,7,The manager is in charge of scheduling so it is entirely fair that the manager sets the schedule for all employees.,6,4,4,2,2,1,"Chris would probably be happy to work the morning shift in a coffee shop, that is when they would most likely be busy and Chris would make the most in tips.",6,The manager has that position for a reason and I would trust that they are good at their job.,1,,,,,,,,,,,,,,,,,,,,,,,,,1,53,1,5,1,5,2,
7/25/17 21:18,7/25/17 21:23,0,71.212.233.18,100,285,1,7/25/17 21:23,R_ANEvT5CJCKtMaDD,,,,,39.90040588,-104.9428024,anonymous,EN,A1XZNZFD7CFYHZ,"1,2",3,6,4,seems like a logical thing to do.,4,4,4,4,4,4,I don't think he'd really care; he'd just do the job.,5,"i think if he follows the algorithm., it makes sense.",1,,,,,,,,,,,,,,,,,,,,,,,,,,,,,,,,,,,,,3,The algorithm determined when parts might fail; the manager used that to determine when checks were needed.,computer projections using past data about what will happen next.,,,,,,,,,,,,,,,,,,,,,,,,,,,,,,,,,,,,,,,,,,,,,,,,,,,,,,,,,,,,,,,,,,,,,,,,,,,,,,,,,,,,,,,,,,,,,,,,,,,,,,,,,,,,,,,,,,,,,,,,,,,,,,,,,,,,,,,,,,,,,,,,,,,,,,,,,,,,,,,,,,,,,,,,,,,,,,,,,,,,,,,,,,,,,,,,,,2,34,1,7,1,2,1,
7/25/17 21:19,7/25/17 21:23,0,75.183.107.189,100,240,1,7/25/17 21:23,R_3Rqt7XltEnDeUNr,,,,,35.98939514,-79.50469971,anonymous,EN,AR6KODL3T3ADR,"1,2",3,6,,,,,,,,,,,,,,,,,,,,,,,,,,,,,,,,,,,,,,,,,,,,,,,,,,,,,,,,,,,,,,,,,,,,,,,,,,,,,,,,,,,,,,,,,,,,,,,,,,,,,,,,,,,,,,,,,,,,,,,,,,,,,,,,,,,,,,,,,,,,,,,,,,,,,,,,,,,,,,,,,,,,,,,,,,,,,,,,,,,,,,,,,,,,,,,,,,,,5,,,,,,,,,,,,,,,,,,,,,,,,,7,If Chris is capable then he would be shortlisted so it's not.unfair,6,6,6,2,3,4,If Chris is capable he should have nothing to fear,7,"Since the manager is being fair, I am sure he is making right decision",1,,,,,,,,,,,,,1,37,1,5,4,5,3,
7/25/17 21:17,7/25/17 21:23,0,74.77.152.234,100,372,1,7/25/17 21:23,R_vMN1LT0dDWpf8l3,,,,,42.99049377,-78.84200287,anonymous,EN,A8JXT1N2CITEM,"1,2",3,6,,,,,,,,,,,,,,,,,,,,,,,,,,,,,,,,,,,,,,,,,,,,,,,,,3,"Both the manager and algorithm were involved in the inspection process, but the algorithm made the final decision on whether a machine should be replaced or updated.",Algorithms perform calculations and data processes,,,,,,,,,,,,,,,,,,,,,,,,,,,,,,,,,,,,,,,,,,,,,,,,,3,"I would hope that as a human, they would be able to make the best judgment.",3,3,2,6,5,6,Chris should have negative emotions towards this situation.,4,I would like to be postitive but I don't have enough information to have complete belief in the algorithm's capabilities.,1,,,,,,,,,,,,,,,,,,,,,,,,,,,,,,,,,,,,,,,,,,,,,,,,,,,,,,,,,,,,,,,,,,,,,,,,,,,,,,,,,,,,,,,,,,,,,,,,,,,,,,,,,,,,,,,,,,,,,,,,,,,,,,,,,,,,,,1,25,1,3,1,4,1,
7/25/17 21:18,7/25/17 21:23,0,66.214.197.178,100,299,1,7/25/17 21:23,R_1MXvQydzevzQzHc,,,,,35.12120056,-120.6193008,anonymous,EN,ASIULWA5R4JYU,"1,2",3,6,,,,,,,,,,,,,,,,,,,,,,,,,,,,,,,,,,,,,,,,,,,,,,,,,1,The manager relies on the algorithm to know which times to have CHris come to work,A set of instructions and rules and conditions to accomplish something a certain way,,,,,,,,,,,,,,,,,,,,,,,,,,,,,,,,,,,,,,,,,,,,,,,,,,,,,,,,,,,,,5,"It does have human partiality, but its doesnt take into account Chris at all",3,3,2,4,4,4,Chris wants to have control not have an algorithm make his decisions,3,"It favors raching the businesses maximum potential, why would Chris think this is a good thing for him?",7,,,,,,,,,,,,,,,,,,,,,,,,,,,,,,,,,,,,,,,,,,,,,,,,,,,,,,,,,,,,,,,,,,,,,,,,,,,,,,,,,,,,,,,,,,,,,,,,,,,,,,,,,,,,,,,,,,,,,,,,,,3,32,2,5,1,4,2,
7/25/17 21:17,7/25/17 21:23,0,192.241.240.233,100,366,1,7/25/17 21:23,R_2bJmyhkuxvVNCIY,,,,,40.73080444,-73.99749756,anonymous,EN,AVSXA6GHYN0ME,"1,2",3,6,,,,,,,,,,,,,,,,,,,,,,,,,,,,,,,,,,,,,,,,,,,,,,,,,,,Computer programming that dictates how a computer makes decisions.,,,,,,,,,,,,,,,,,,,,,,,,,,,,,,,,,,,,,,,,,,,,,,,,,,,,,,,,,,,,,,,,,,,,,,,,,,,,,,,,,,,,,,,,,,,,,,,,,,,,,,,,,,,,,,,,,,,,,,,,,,,,,,,,,,,,,3,I feel that a computer would have a difficult time interpteting human reactions. Customer ratings of him would be a better method.,3,3,3,4,5,5,Having your evaluation left to a machine can feel unnerving.  ,3,The algorithm probably statistically gets it right more than not but people are uneasy when it comes to their money.,1,1,,,,,,,,,,,,,,,,,,,,,,,,,,,,,,,,,,,,,,,,,,,,,,,,,1,29,2,5,1,1,4,
7/25/17 21:19,7/25/17 21:23,0,68.226.127.77,100,228,1,7/25/17 21:23,R_2s5UGF4jmi37eIa,,,,,33.32330322,-111.8244019,anonymous,EN,A1VHFF2VC2XG7P,"1,2",3,6,,,,,,,,,,,,,6,"The algorithmic analysis takes in to account Chris's avavilability and the need for customers, it seems pretty fair to me.",5,5,4,2,3,3,Chris would probably like that an impartial thinking machine is scheduling him instead of a boss.,4,Humans are full of emotions and totally capable of scheduling you horrible hours..just because they don't like you.,1,,,,,,,,,,,,,,,,,,,,,,,,,3,The algorithms decides schedules and the manager confirms them.,Algorithms are mathematical processes by which we can arrive at informed logical decisions automatically with the assistance of computational devices.,,,,,,,,,,,,,,,,,,,,,,,,,,,,,,,,,,,,,,,,,,,,,,,,,,,,,,,,,,,,,,,,,,,,,,,,,,,,,,,,,,,,,,,,,,,,,,,,,,,,,,,,,,,,,,,,,,,,,,,,,,,,,,,,,,,,,,,,,,,,,,,,,,,,,,,,,,,,,,,,,,,,,,,,,,,,,,,,,,,,,,,,,,,,,,,,,,3,23,2,3,1,2,2,
7/25/17 21:17,7/25/17 21:23,0,73.193.136.42,100,370,1,7/25/17 21:23,R_2y93qZOCMeBfUJD,,,,,39.94560242,-74.55580139,anonymous,EN,AWOLBQZMUHKTU,"1,2",3,6,,,,,,,,,,,,,,,,,,,,,,,,,,,,,,,,,,,,,,,,,,,,,,,,,,,,,,,,,,,,,,,,,,,,,,,,,,,,,,,,,,,,,,,,,,,,,,,,,,,,,,,,,,,,,,,,,,,,,,,,,,,,,,,,,,,,,,,,,,,,,,,,,,,,,,,,,,,,,,,,,,,,,,,,,,,,,,,,,,,,,,,,,,,,,,,,,,,,5,,,,,,,,,,,,,7,The manager is the one that has all the information needed to make the schedule. Chris does not have this information. ,4,4,4,4,4,4,"I do not have enough information to speculate on Chris's feelings. The description given doesn't give any indication that Chris has any opinion or preference for scheduling. If I were in his position, I wouldn't feel anything about my manager's shift schedule unless I was scheduled on days my manager knew I was unavailable. ",7,There is no indication that the manager has screwed up the schedule ever and it is indicated that he takes all factors into consideration while making the schedule. ,1,,,,,,,,,,,,,,,,,,,,,,,,,1,36,1,3,1,5,2,
7/25/17 21:17,7/25/17 21:23,0,108.44.53.165,100,357,1,7/25/17 21:23,R_3PBl7HFmCr8KCka,,,,,42.22569275,-73.74289703,anonymous,EN,A1U37XNO6J1R9G,"1,2",3,6,,,,,,,,,,,,,,,,,,,,,,,,,,,,,,,,,,,,,,,,,,,,,,,,,3,The manager overlooks everything with the algorithm while the algorithm does the deciding. ,I think they are a computer thing that sorts through lots and lots of data. ,7,It is all random which is fair,2,2,3,7,5,5,I don't think he'd be very happy that he got choosen for this,7,It is a all done by a computer which is trustworthy,1,,,,,,,,,,,,,,,,,,,,,,,,,,,,,,,,,,,,,,,,,,,,,,,,,,,,,,,,,,,,,,,,,,,,,,,,,,,,,,,,,,,,,,,,,,,,,,,,,,,,,,,,,,,,,,,,,,,,,,,,,,,,,,,,,,,,,,,,,,,,,,,,,,,,,,,,,,,,,,,,,,,,,,,,,,,,,,,,,,,,,,1,24,1,5,1,3,1,
7/25/17 21:17,7/25/17 21:23,0,68.194.227.11,100,398,1,7/25/17 21:23,R_D1q6oDgekXB1roJ,,,,,40.94869995,-74.24130249,anonymous,EN,A103XX92AATRSG,"1,2",3,6,,,,,,,,,,,,,,,,,,,,,,,,,,,,,,,,,,,,,,,,,,,,,,,,,3,They both would evaulate Chris's performance and be used to determine how good or bad of a worker Chris is through an algorithm. ,A computer based formula with various factors used to come up with a conclusion.,,,,,,,,,,,,,,,,,,,,,,,,,,,,,,,,,,,,,,,,,,,,,,,,,,,,,,,,,,,,,,,,,,,,,,,,,,,,,,,,,,,,,5,I'm not sure how accurately the algorithm could evaluate performance.,3,3,3,5,5,6,"He would probably not trust the judgment of an algorithm, whether good or bad.",2,I would need to know more about the algorithm in order to have any trust in it. ,1,,,,,,,,,,,,,,,,,,,,,,,,,,,,,,,,,,,,,,,,,,,,,,,,,,,,,,,,,,,,,,,,,,,,,,,,,,,,,,,,,,,,,,,,,,,,,,,,,,1,27,1,5,1,4,4,
7/25/17 21:19,7/25/17 21:23,0,75.134.119.124,100,241,1,7/25/17 21:23,R_2OU8mcTbXpoUffC,,,,,43.61470032,-84.79270172,anonymous,EN,A2XCNYXX5C6CVQ,"1,2",3,6,,,,,,,,,,,,,,,,,,,,,,,,,,,,,,,,,,,,,,,,,,,,,,,,,3,the algorithm came up with the schedule and the manager tweaked it if needed,data that can help to predict or solve things,,,,,,,,,,,,,4,Seems like a normal and viable option,4,2,2,5,2,2,I don't see how the algorithm could affect chris's mood any more than already knowing he has to work. ,3,as long as it is unbiased I see no reason to not trust it,1,,,,,,,,,,,,,,,,,,,,,,,,,,,,,,,,,,,,,,,,,,,,,,,,,,,,,,,,,,,,,,,,,,,,,,,,,,,,,,,,,,,,,,,,,,,,,,,,,,,,,,,,,,,,,,,,,,,,,,,,,,,,,,,,,,,,,,,,,,,,,,,,,,,,,,,,,,,,,,,,,,,,,,,,,,1,24,2,3,1,3,2,
7/25/17 21:18,7/25/17 21:23,0,184.176.102.136,100,303,1,7/25/17 21:24,R_2EzoHSWdMKr3YKK,,,,,33.37759399,-112.3873978,anonymous,EN,A3G55RJTW3BSGM,"1,2",3,6,,,,,,,,,,,,,,,,,,,,,,,,,,,,,,,,,,,,,,,,,,,,,,,,,,,,,,,,,,,,,,,,,,,,,,,,,,,,,,,,,,,,,,,,,,,,,,,,,,,,,,,,,,,,,,,,,,,,,,,,,,,,,,,,,,,,,,,,,,,,,,,,,,,,,,,,,,,,,,,,,,,,,,,,,,,,,,,,,,,,,,,,,,,,,,,,,,,,5,,,,,,,,,,,,,,,,,,,,,,,,,,,,,,,,,,,,,5,"It is fair to analyze his calls, but only if they are all analyzed, because there will be variation in his skills depending on the call.",2,2,2,4,4,4,"I don't have any idea how Chris would feel, but can't imagine it would make him happy.",2,The manager will not be evaluating all of the available facts. It's not possible to make a good quality evaluation on limited facts.,1,2,40,1,6,1,5,4,
7/25/17 21:18,7/25/17 21:24,0,108.85.39.144,100,361,1,7/25/17 21:24,R_wKIkG4kPVDbPB7j,,,,,33.52250671,-86.76830292,anonymous,EN,A79GNQWB491QI,"1,2",3,6,,,,,,,,,,,,,,,,,,,,,,,,,,,,,,,,,,,,,,,,,,,,,,,,,,,,,,,,,,,,,,,,,,,,,,,,,,,,,,,,,,,,,,,,,,,,,,,,,,,,,,,,,,,,,,,,,,,,,,,,,,,,,,,,,,,,,,,,,,,,,,,,,,,,,,,,,,,,,,,,,,,,,,,,,,,,,,,,,,,,,,,,,,,,,,,,,,,,5,7,Chris is a staff member.  The manager has a right to delegate tasks as he sees fit.,6,4,6,1,1,1,Chris is glad to do his job as directed.,7,I have no reason to think that the manager is untrustworthy.,1,,,,,,,,,,,,,,,,,,,,,,,,,,,,,,,,,,,,,1,45,2,5,1,5,1,
7/25/17 21:19,7/25/17 21:24,0,73.240.49.218,100,268,1,7/25/17 21:24,R_1f2YogQNAXtAxIW,,,,,43.92919922,-123.0867004,anonymous,EN,A281NYJUA83Y3Y,"1,2",3,6,,,,,,,,,,,,,,,,,,,,,,,,,,,,,,,,,,,,,,,,,,,,,,,,,,,,,,,,,,,,,,,,,,,,,,,,,,,,,,,,,,,,,,,,,,,,,,,,,,,,,,,,,,,,,,,,,,,,,,,,,,,,,,,,,,,,,,,,,,,,,,,,,,,,,,,,,,,,,,,,,,,,,,,,,,,,,,,,,,,,,,,,,,,,,,,,,,,,5,,,,,,,,,,,,,,,,,,,,,,,,,,,,,,,,,,,,,6,A manager should evaluate Chris's performance,3,4,5,3,5,3,It should be expected that the manager will go over his performance,6,A good manager makes good employees ,1,1,22,2,3,1,5,4,
7/25/17 21:17,7/25/17 21:24,0,24.9.189.70,100,420,1,7/25/17 21:24,R_32YqbNAsDIDqHcC,,,,,39.48950195,-104.767601,anonymous,EN,AE1YA7Q3UKPRI,"1,2",3,6,,,,,,,,,,,,,,,,,,,,,,,,,,,,,,,,,,,,,,,,,,,,,,,,,,,Something that looks for a pattern. ,,,,,,,,,,,,,,,,,,,,,,,,,,,,,,,,,,,,,,,,,,,,,,,,,,,,,,,,,,,,,,,,,,,,,,,,,,,,,,,,,,,,,,,,,,,,,,,,,,,,,,,,,,,,,,,,,,,,,,,,,2,People may not have exactly what the algorithm is looking for. They have it worded differently. ,4,4,4,5,6,6,"If Chris is picked, he would feel proud, joyful or happy.  He is probably frustrated, disappointed or angry if he isn't picked. ",2,I just don't like how they pick based on a few things. ,1,,,,,,,,,,,,,1,,,,,,,,,,,,,,,,,,,,,,,,,,,,,,,,,,,,,,,,,,,,,,,,,1,33,1,5,1,1,3,
7/25/17 21:19,7/25/17 21:24,0,97.88.165.222,100,311,1,7/25/17 21:24,R_2s1GLXWgaDFiUzj,,,,,38.78619385,-93.72389984,anonymous,EN,A2DOKUHHKBTPUN,"1,2",3,6,,,,,,,,,,,,,5,An algorithm can be objective. ,5,3,4,5,3,5,I tried thinking about how I would feel in this situation ,3,The manager is not showing any favoritism to employees since the computer is picking ,1,,,,,,,,,,,,,,,,,,,,,,,,,1,The algorithm knew the number of customers in the morning and assigned Chris to work that shift ,A calculation used to determine various results ,,,,,,,,,,,,,,,,,,,,,,,,,,,,,,,,,,,,,,,,,,,,,,,,,,,,,,,,,,,,,,,,,,,,,,,,,,,,,,,,,,,,,,,,,,,,,,,,,,,,,,,,,,,,,,,,,,,,,,,,,,,,,,,,,,,,,,,,,,,,,,,,,,,,,,,,,,,,,,,,,,,,,,,,,,,,,,,,,,,,,,,,,,,,,,,,,,1,32,1,6,1,2,2,
