8/2/17 12:21,8/2/17 12:33,0,174.111.61.7,100,716,1,8/2/17 12:33,R_2xyZXjF5t7Roubo,,,,,36.11720276,-80.07649994,anonymous,EN,A258DUZQTRIEK0,"1,2",3,6,,,,,,,,,,,,,,,,,,,,,,,,,,,,,,,,,,,,,,,,,,,,,,,,,3,"The manager analyzes personal statements and resumes, while the algorithm analyzes thousands of statements and resumes to select the top applicants.",Algorithms are the process of solving problem-based operations from calculations.,,,,,,,,,,,,,,,,,,,,,,,,,,,,,,,,,,,,,,,,,,,,,,,,,,,,,,,,,,,,,,,,,,,,,,,,,5,It is more fair for the algorithm to select the top applicants based on their overall views and calculations from the analyses.,3,3,2,6,5,5,"Chris would feel more disappointment and anger because an algorithmic machine would be doing a job that is too hard for him, and is accomplishing more.",7,I trust the algorithm to make good quality decisions upon selecting top job applicants extremely because of how it processes the calculations and analyzes overall.,1,,,,,,,,,,,,,,,,,,,,,,,,,,,,,,,,,,,,,,,,,,,,,,,,,,,,,,,,,,,,,,,,,,,,,,,,,,,,,,,,,,,,,,,,,,,,,,,,,,,,,,,,,,,,,,1,46,1,5,1,4,3,
8/2/17 12:20,8/2/17 12:35,0,73.231.151.202,100,873,1,8/2/17 12:35,R_yBGETk68jvwCjGF,,,,,37.6703949,-121.9374008,anonymous,EN,A1Z3X76CPRU9OT,"1,2",3,6,,,,,,,,,,,,,,,,,,,,,,,,,,,,,,,,,,,,,,,,,,,,,,,,,3,"The manager analyzed the customer calls.  The algorithm analyzed the customer comments.  The algorithm made the final performance evaluation, based on the manager's analysis and it's own analysis of the comments.",Certain ways to solve a problem.,,,,,,,,,,,,,,,,,,,,,,,,,,,,,,,,,,,,,,,,,,,,,,,,,,,,,,,,,,,,,,,,,,,,,,,,,,,,,,,,,,,,,5,"The call recordings, analyzed by the manager, is the most important part.  I think its fair that there is still human involvement other than the algorithm.",4,4,4,3,3,3,"An algorithm could be more accurate than a person, but I don't think he'd be happy or joyful.",4,It depends on if the algorithm has made good evaluations of other people in the past.,1,,,,,,,,,,,,,,,,,,,,,,,,,,,,,,,,,,,,,,,,,,,,,,,,,,,,,,,,,,,,,,,,,,,,,,,,,,,,,,,,,,,,,,,,,,,,,,,,,,2,39,2,5,4,4,4,
8/2/17 12:35,8/2/17 12:39,0,73.56.173.218,100,227,1,8/2/17 12:39,R_3EG7IrQI8xnCbl6,,,,,25.9828949,-80.27940369,anonymous,EN,AHGQYVNSF17E0,"1,2",3,6,,,,,,,,,,,,,,,,,,,,,,,,,,,,,,,,,,,,,,,,,,,,,,,,,,,Equations to determine outcomes.,,,,,,,,,,,,,,,,,,,,,,,,,,,,,,,,,,,,,,,,,,,,,,,,,,,,,,,,,,,,,,,,,,,,,,,,,,,,,,,,,,,,,,,,,,,,,,,,,5,It is looking at average wear and tear so I would see it as a guideline.,3,1,1,2,2,5,It does not feel personal but it can be useful.,4,I should be able to trust it can calcyulate moderate wear and tear.,1,,,,,,,,,,,,,,,,,,,,,,,,,,,,,,,,,,,,,1,,,,,,,,,,,,,,,,,,,,,,,,,,,,,,,,,,,,,,,,,,,,,,,,,1,29,1,5,3,1,1,
8/2/17 12:33,8/2/17 12:39,0,73.198.104.130,100,323,1,8/2/17 12:39,R_rlq9ucS8lwDN1tv,,,,,39.99429321,-74.79180145,anonymous,EN,A2MWAXV1YRK5GH,"1,2",3,6,,,,,,,,,,,,,,,,,,,,,,,,,,,,,,,,,,,,,,,,,,,,,,,,,,,,,,,,,,,,,,,,,,,,,,,,,,,,,,,,,,,,,,,,,,,,,,,,,,,,,,,,,,,,,,,,,,,,,,,,,,,,,,,,,,,,,,,,,,,,,,,,,,,,,,,,,,,,,,,,,,,,,,,,,,,,,,,,,,,,,,,,,,,,,,,,,,,,5,,,,,,,,,,,,,6,"I think that if Chris has told the manager he is available mornings, then it is fair to schedule him for mornings. It said he analyzes availabilities.",6,6,6,1,1,1,"I think Chris said he was available mornings and the manager has given him mornings, so I assume he is very happy.",6,"He takes the time to analyze availability, so I would trust him to make good decisions.",1,,,,,,,,,,,,,,,,,,,,,,,,,1,66,1,6,1,5,2,
8/2/17 12:25,8/2/17 12:40,0,47.16.144.62,100,852,1,8/2/17 12:40,R_2VCNxiNbFhUKN2B,,,,,41.83940125,-73.12550354,anonymous,EN,A1FDEB5RQJMM9Z,"1,2",3,6,,,,,,,,,,,,,,,,,,,,,,,,,,,,,,,,,,,,,,,,,,,,,,,,,3,"The algorithm is the one that analyzes the components of the factory and the history of how each one has either worn or broken. It is also the one that assigns the employees to check or update specific components to prevent failure.The manager is the one who monitors, and also adjusts, how the algorithms sees certain criteria in order to make it's decisions.",A computerized process that the computer follows in order to calculate and reach determinations.,6,"The algorithm is monitored and adjusted by the manager. Therefore, in terms of jub responsibilities, the algorithm assigning is the same as the manager assigning. As the manager is above Chris, and the one who would give him his duties, so is the algorithm above Chris, as the tool is under the oversight of the manager. It should be considered no different than the manager handing out the duties himself. Further, the algorithm removes most human componentry and bias (except for the managerial adjustmensts) and has claculating abilities far beyond that of humans, and therefore can have a much higher accuracy and assessment of the parts that need servicing. So, it can only be concluded that this arrangement is fair.",6,4,5,2,2,2,"I believe Chirs would be happy about his work, that he was being directed towards a place that made a difference, instead of just ""spinning his wheels"". Also, he would be proud of his work, knowing that his work was in important places, and kept everything going. I do not think he would be frustrated or angry at all, knowing he was efficiently providing work. Likewise, there would be no disappointment, knowing his work was directed at integral locations.",6,"I would trust the algorithm, as it would have higher accuracy, and better abilities to assess the situations than a humna. As it can more accurately determine which areas may need servicing, it should be trusted more.",1,,,,,,,,,,,,,,,,,,,,,,,,,,,,,,,,,,,,,,,,,,,,,,,,,,,,,,,,,,,,,,,,,,,,,,,,,,,,,,,,,,,,,,,,,,,,,,,,,,,,,,,,,,,,,,,,,,,,,,,,,,,,,,,,,,,,,,,,,,,,,,,,,,,,,,,,,,,,,,,,,,,,,,,,,,,,,,,,,,,,,,2,40,2,3,1,3,1,
8/2/17 12:36,8/2/17 12:41,0,71.217.72.55,100,317,1,8/2/17 12:41,R_12SwX5NUTyUGBNk,,,,,47.68469238,-122.3847961,anonymous,EN,A1FVXS8IM5QYO8,"1,2",3,6,,,,,,,,,,,,,,,,,,,,,,,,,,,,,,,,,,,,,,,,,,,,,,,,,,,,,,,,,,,,,,,,,,,,,,,,,,,,,,,,,,,,,,,,,,,,,,,,,,,,,,,,,,,,,,,,,,,,,,,,,,,,,,,,,,,,,,,,,,,,,,,,,,,,,,,,,,,,,,,,,,,,,,,,,,,,,,,,,,,,,,,,,,,,,,,,,,,,5,,,,,,,,,,,,,,,,,,,,,,,,,,,,,,,,,,,,,7,"It is fair to evaluate customer service performance as it reflects on the company, either positively or negatively. People in customer service should always be polite and helpful.",6,4,6,2,2,2,"I'm sure that if Chris is doing a good job, he/she wouldn't mind being evaluated.",6,"It is the manager's job to make a good evaluation, so I trust them to do a good job.",1,1,51,1,3,1,5,4,
8/2/17 12:43,8/2/17 12:48,0,98.215.61.179,100,315,1,8/2/17 12:48,R_2VQQ6jr4xgvtkNb,,,,,40.52819824,-88.98010254,anonymous,EN,A3FJWFCS4WM9ER,"1,2",3,6,,,,,,,,,,,,,,,,,,,,,,,,,,,,,,,,,,,,,,,,,,,,,,,,,3,The manager programmed the algorithm,computer programs,,,,,,,,,,,,,,,,,,,,,,,,,3,It doesn't factor all variables,4,4,3,4,4,5,If the algorithm didn't choose him it would be frustrating,3,I don't think a computer can make this decision.,1,,,,,,,,,,,,,,,,,,,,,,,,,,,,,,,,,,,,,,,,,,,,,,,,,,,,,,,,,,,,,,,,,,,,,,,,,,,,,,,,,,,,,,,,,,,,,,,,,,,,,,,,,,,,,,,,,,,,,,,,,,,,,,,,,,,,,,,,,,,,,,,,,,,,,,,,,,,,,,1,36,1,4,1,3,3,
8/2/17 12:37,8/2/17 12:49,0,198.37.208.80,100,737,1,8/2/17 12:49,R_xrujjdBUWngZ42d,,,,,37.76660156,-84.30310059,anonymous,EN,A3PPDYVZ2LQZ1E,"1,2",3,6,,,,,,,,,,,,,,,,,,,,,,,,,7,To be able to weed out those that do not fit what the company is looking for. If one does not have what they are looking for then it is just a waste of every ones time.,7,7,7,6,3,5,He would be thrilled if it is him that is chosen.,7,The manager knows what he is looking for in his employees.,1,,,,,,,,,,,,,3,the algoithm's role is to determine who is fit for the job by the rules and outlines placed by the manager. The managers job is to pick the top choices and bring those in for sit down real interviews.,A set of rules and outlines put on a computer program kinda of like a test. To see how well one does at something.,,,,,,,,,,,,,,,,,,,,,,,,,,,,,,,,,,,,,,,,,,,,,,,,,,,,,,,,,,,,,,,,,,,,,,,,,,,,,,,,,,,,,,,,,,,,,,,,,,,,,,,,,,,,,,,,,,,,,,,,,,,,,,,,,,,,,,,,,,,,,,,,,,,,,,,,,,,,,,,,,,,,,,,,,,,,,,,,,,,,,,,,,,,,,,,,,,1,32,1,3,1,2,3,
8/2/17 12:44,8/2/17 12:51,0,99.121.204.166,100,438,1,8/2/17 12:51,R_1Ictm36RyLgX7Fu,,,,,38.66810608,-121.3735962,anonymous,EN,A1BNGJBEWJS8WE,"1,2",3,6,,,,,,,,,,,,,,,,,,,,,,,,,,,,,,,,,,,,,,,,,,,,,,,,,3,To see how important each part of the machinery is and what needs to be done to it at this time,it is like a set of rules or steps to solve a problem,,,,,,,,,,,,,,,,,,,,,,,,,,,,,,,,,,,,,,,,,,,,,,,,,7,"If he works there he needs to do whatever they assign him to do,",5,5,4,4,2,2,he should not have negative feeling as this is part of his job!,5,That is like being double checked,1,,,,,,,,,,,,,,,,,,,,,,,,,,,,,,,,,,,,,,,,,,,,,,,,,,,,,,,,,,,,,,,,,,,,,,,,,,,,,,,,,,,,,,,,,,,,,,,,,,,,,,,,,,,,,,,,,,,,,,,,,,,,,,,,,,,,,,1,68,1,2,1,4,1,
8/2/17 12:49,8/2/17 12:52,0,67.163.25.118,100,214,1,8/2/17 12:52,R_3MKmTeA8yNb8zKO,,,,,41.90379333,-87.67569733,anonymous,EN,A13LCDN3VKR6E2,"1,2",3,6,,,,,,,,,,,,,,,,,,,,,,,,,,,,,,,,,,,,,,,,,,,,,,,,,,,,,,,,,,,,,,,,,,,,,,,,,,,,,,,,,,,,,,,,,,,,,,,,,,,,,,,,,,,,,,,,,,,,,,,,,,,,,,,,,,,,,,,,,,,,,,,,,,,,,,,,,,,,,,,,,,,,,,,,,,,,,,,,,,,,,,,,,,,,,,,,,,,,5,,,,,,,,,,,,,,,,,,,,,,,,,6,the manager looked at the resumes and statements,4,4,4,4,2,4,I'm not sure if he got an interview,5,Sometimes a resume doesn't convey enough,1,,,,,,,,,,,,,2,33,1,5,1,5,3,
8/2/17 12:50,8/2/17 12:54,0,47.201.205.198,100,185,1,8/2/17 12:54,R_2YFg7WbGFkwh4AK,,,,,28.3578949,-82.61730194,anonymous,EN,A107RJSS561Y7R,"1,2",3,6,6,Seems logical to me,4,4,4,4,4,4,I dont think chris should really feel anything about it.,5,the manager is probably less reliable than the computer ,1,,,,,,,,,,,,,,,,,,,,,,,,,,,,,,,,,,,,,3,the manager checked over the data resulted from the algorithm and decided on a course of action,a specific way/s to conduct an operation ,,,,,,,,,,,,,,,,,,,,,,,,,,,,,,,,,,,,,,,,,,,,,,,,,,,,,,,,,,,,,,,,,,,,,,,,,,,,,,,,,,,,,,,,,,,,,,,,,,,,,,,,,,,,,,,,,,,,,,,,,,,,,,,,,,,,,,,,,,,,,,,,,,,,,,,,,,,,,,,,,,,,,,,,,,,,,,,,,,,,,,,,,,,,,,,,,,1,30,2,2,1,2,1,