8/2/17 12:14,8/2/17 12:23,0,108.89.2.25,100,535,1,8/2/17 12:23,R_28HFFGmmSB6QsEZ,,,,,29.06970215,-81.27110291,anonymous,EN,ANUMUVIZQTIXH,"1,2",3,6,,,,,,,,,,,,,,,,,,,,,,,,,,,,,,,,,,,,,1,because the computer could be wrong.,1,2,2,2,2,2,i think he would rather his manager judge him,1,I think he should sit in on calls and judge for himself.,1,3,the algorithm makes a judgment and the manager reads and makes his judgment based on the algorithm,I think it's just computers trying to doing math to solve problems,,,,,,,,,,,,,,,,,,,,,,,,,,,,,,,,,,,,,,,,,,,,,,,,,,,,,,,,,,,,,,,,,,,,,,,,,,,,,,,,,,,,,,,,,,,,,,,,,,,,,,,,,,,,,,,,,,,,,,,,,,,,,,,,,,,,,,,,,,,,,,,,,,,,,,,,,,,,,,,,,,,,,,,,,,,,,,,,,,,,,,,,,,,,,,,,,,1,31,2,2,2,2,4,
8/2/17 12:14,8/2/17 12:23,0,1.23.74.100,100,536,1,8/2/17 12:23,R_22unNXpD1fhJV9g,,,,,13.08329773,80.28329468,anonymous,EN,A15YUZ5RUNA6FI,"1,2",3,6,,,,,,,,,,,,,,,,,,,,,,,,,,,,,,,,,,,,,,,,,,,,,,,,,3,"First the algorithm monitors the performance of employees, record, analyze it and finally makes a decision and submits to the manager. The manager then decides the last whether to follow the algorithm or otherwise.",I think it will compare with the pre-programmed data.,,,,,,,,,,,,,,,,,,,,,,,,,,,,,,,,,,,,,6,The algorithm would have pre-programmed to ascertain well.,5,4,5,3,3,3,It is clear that the algorithm will perform well. Otherwise what is the need for the call center company to put it to monitor it's employees' performance?,6,"If a company spends for some device / setup, it will be tested repeatedly before putting it to function. So, it should perform well.",1,,,,,,,,,,,,,,,,,,,,,,,,,,,,,,,,,,,,,,,,,,,,,,,,,,,,,,,,,,,,,,,,,,,,,,,,,,,,,,,,,,,,,,,,,,,,,,,,,,,,,,,,,,,,,,,,,,,,,,,,,,,,,,,,,,,,,,,,,,,,,,,,,,2,31,2,5,4,3,4,
8/2/17 12:15,8/2/17 12:24,0,99.190.112.31,100,484,1,8/2/17 12:24,R_1BXEt9j1GQszuJI,,,,,34.2868042,-118.6139984,anonymous,EN,A2TWNZAXELMZXX,"1,2",3,6,,,,,,,,,,,,,,,,,,,,,,,,,,,,,,,,,,,,,,,,,,,,,,,,,,,Rules a computer follows to solve problems.,,,,,,,,,,,,,,,,,,,,,,,,,,,,,,,,,,,,,,,,,,,,,,,,,,,,,,,,,,,,,,,,,,,,,,,,,,,,,,,,,,,,,,,,,,,,,,,,,5,The algorithm is doing the analyzing and assigning. Chris follows orders,5,3,4,3,2,3,Chris knows what his job entails and puts for effort to do a good job.,6,The algorithm had to have gone through rigorous testing before it was given the asignment,1,,,,,,,,,,,,,,,,,,,,,,,,,,,,,,,,,,,,,1,,,,,,,,,,,,,,,,,,,,,,,,,,,,,,,,,,,,,,,,,,,,,,,,,1,65,1,3,2,1,1,
8/2/17 12:17,8/2/17 12:24,0,24.180.132.226,100,390,1,8/2/17 12:24,R_1q2iEXpGqsqD23S,,,,,43.11880493,-85.49430084,anonymous,EN,A2XIYK3272U6BV,"1,2",3,6,,,,,,,,,,,,,,,,,,,,,,,,,,,,,,,,,,,,,,,,,,,,,,,,,3,"The algorithm weeded out applicants, the manager interviewed the rest.",algorithms are a set of code or instructions for a process,,,,,,,,,,,,,,,,,,,,,,,,,,,,,,,,,,,,,,,,,,,,,,,,,,,,,,,,,,,,,,,,,,,,,,,,,5,"If the algorithim is used to help slim down the amount of applicants, then I feel like it is fair if it is accurate. That way the top applicants can get a personal interview.",2,2,2,5,5,6,I would feel like he would be frustrated that it wasn't done reviewed by a person,4,It can be tweaked to be fair to weed out a lot of the applicants.,1,,,,,,,,,,,,,,,,,,,,,,,,,,,,,,,,,,,,,,,,,,,,,,,,,,,,,,,,,,,,,,,,,,,,,,,,,,,,,,,,,,,,,,,,,,,,,,,,,,,,,,,,,,,,,,3,27,2,5,1,4,3,
8/2/17 12:15,8/2/17 12:24,0,108.214.2.186,100,546,1,8/2/17 12:24,R_31Mc3A7OgFrTcxw,,,,,41.40440369,-81.55639648,anonymous,EN,A1IIF95II8FISQ,"1,2",3,6,,,,,,,,,,,,,,,,,,,,,,,,,2,"Some candidate may have an advantage if their resume or personal statement coincide with that algorithm. Yet, this may not be the best candidate for the job.",2,2,4,6,4,6,"If Chris is not chosen, then all of the effort he put into writing his resume and statement will make him feel discouraged.",1,The manager is determining his decision based upon the algorithm. He is not trusting his judgment and experience as a manager to make a wise decision.,1,,,,,,,,,,,,,3,"The algorithm was responsible for choosing the top candidates for the position. After the top candidates were chosen, the manager had to decide who was the best fit for the position. ",Algorithms are preset words or numbers that are critical in determining the best outcome for a situation. ,,,,,,,,,,,,,,,,,,,,,,,,,,,,,,,,,,,,,,,,,,,,,,,,,,,,,,,,,,,,,,,,,,,,,,,,,,,,,,,,,,,,,,,,,,,,,,,,,,,,,,,,,,,,,,,,,,,,,,,,,,,,,,,,,,,,,,,,,,,,,,,,,,,,,,,,,,,,,,,,,,,,,,,,,,,,,,,,,,,,,,,,,,,,,,,,,,1,35,1,5,2,2,3,
8/2/17 12:15,8/2/17 12:24,0,174.101.228.127,100,513,1,8/2/17 12:24,R_3QJoWCaxr0xAEUg,,,,,39.07699585,-84.17690277,anonymous,EN,A2RX5TPPAHYN8K,"1,2",3,6,,,,,,,,,,,,,,,,,,,,,,,,,,,,,,,,,,,,,6,"Should be fine if Chris follows the rules, So its fair.",4,4,4,2,2,2,Chis should feel fine if he's doing his job per standard procedures. ,6,"The manager should follow the rules, so I trust him",1,3,The algorithm checks that the worker is following procedures and the manager verify's the results. ,computer programs the follow design criteria and calculate results.,,,,,,,,,,,,,,,,,,,,,,,,,,,,,,,,,,,,,,,,,,,,,,,,,,,,,,,,,,,,,,,,,,,,,,,,,,,,,,,,,,,,,,,,,,,,,,,,,,,,,,,,,,,,,,,,,,,,,,,,,,,,,,,,,,,,,,,,,,,,,,,,,,,,,,,,,,,,,,,,,,,,,,,,,,,,,,,,,,,,,,,,,,,,,,,,,,2,60,2,4,1,2,4,
8/2/17 12:18,8/2/17 12:24,0,97.120.158.119,100,336,1,8/2/17 12:24,R_2QfboIDY5AsmN1H,,,,,45.52949524,-122.6432037,anonymous,EN,A2NL38BFEE3BVY,"1,2",3,6,,,,,,,,,,,,,,,,,,,,,,,,,,,,,,,,,,,,,,,,,,,,,,,,,,,a line of reasoning with parameters dictated by its designers,,,,,,,,,,,,,,,,,,,,,,,,,,,,,,,,,,,,,,,,,,,,,,,,,,,,,,,,,,,,,,,,,,,,,,,,,,,,,,,,,,,,,,,,,,,,,,,,,,,,,,,,,,,,,,,,,,,,,,,,,4,Chris was selected (or not) using the same standards that were applied to others however without knowing the details of the algorithm one cannot know whether it was fair in that regard,4,4,1,5,1,5,Chris would be happy for the chance but also worried that the algorithm was unfair,4,I don't know the details but would presume some thought and effort was put into the algorithm's design,1,,,,,,,,,,,,,1,,,,,,,,,,,,,,,,,,,,,,,,,,,,,,,,,,,,,,,,,,,,,,,,,2,52,2,3,4,1,3,
8/2/17 12:15,8/2/17 12:24,0,68.118.70.252,100,513,1,8/2/17 12:24,R_2OUSDnUT9GNADTY,,,,,43.21650696,-123.3417053,anonymous,EN,A1C4FCGHKOGJM6,"1,2",3,6,,,,,,,,,,,,,,,,,,,,,,,,,,,,,,,,,,,,,,,,,,,,,,,,,3,the manager read the personal statements and the algorithm looked at the resume ,computer programs that check the compatibility of things,,,,,,,,,,,,,,,,,,,,,,,,,,,,,,,,,,,,,,,,,,,,,,,,,,,,,,,,,,,,,,,,,,,,,,,,,6,Both his resume and personal statement are being reviewed so his application will be seen by the algorithm and the manager,5,4,4,2,2,2,He should be happy that both the manager and the algorithm will see his application,5,if both are looking they should see who is most qualified,1,,,,,,,,,,,,,,,,,,,,,,,,,,,,,,,,,,,,,,,,,,,,,,,,,,,,,,,,,,,,,,,,,,,,,,,,,,,,,,,,,,,,,,,,,,,,,,,,,,,,,,,,,,,,,,1,30,1,2,1,4,3,
8/2/17 12:20,8/2/17 12:24,0,67.198.36.244,100,287,1,8/2/17 12:24,R_1g0CLi12xYDM4G8,,,,,27.68510437,-97.40029907,anonymous,EN,AAON9MI7I8JU8,"1,2",3,6,,,,,,,,,,,,,,,,,,,,,,,,,,,,,,,,,,,,,,,,,,,,,,,,,,,A set of rules that a program follows to perform calculations.,,,,,,,,,,,,,,,,,,,,,,,,,,,,,,,,,,,,,,,,,,,,,,,,,,,,,,,,,,,,,,,,,,,,,,,,,,,,,,,,,,,,,,,,,,,,,,,,,,,,,,,,,,,,,6,"The algorithm used information already available to schedule a worker, if the mornings were in his availability then it was fair.",5,4,5,2,2,2,I don't think he would feel anything negative about being scheduled during the times he labeled available.,5,The algorithm is able to analyze many different types of data to optimize the situation.,1,,,,,,,,,,,,,,,,,,,,,,,,,1,,,,,,,,,,,,,,,,,,,,,,,,,,,,,,,,,,,,,,,,,,,,,,,,,2,25,2,3,3,1,2,
8/2/17 12:17,8/2/17 12:25,0,76.122.98.105,100,465,1,8/2/17 12:25,R_bCooRKE9xSDLrRn,,,,,33.86390686,-84.1242981,anonymous,EN,A1RUTFUTSJD9B3,"1,2",3,6,,,,,,,,,,,,,,,,,,,,,,,,,,,,,,,,,,,,,,,,,,,,,,,,,,,,,,,,,,,,,,,,,,,,,,,,,,,,,,,,,,,,,,,,,,,,,,,,,,,,,,,,,,,,,,,,,,,,,,,,,,,,,,,,,,,,,,,,,,,,,,,,,,,,,,,,,,,,,,,,,,,,,,,,,,,,,,,,,,,,,,,,,,,,,,,,,,,,5,,,,,,,,,,,,,4,"He's the boss, so he get to make up the schedules",5,4,5,4,4,4,"This is a coffee shop, most people need their coffee in the morning.",4,He made a schedule to max out his business,1,,,,,,,,,,,,,,,,,,,,,,,,,1,23,2,3,1,5,2,
8/2/17 12:19,8/2/17 12:25,0,142.0.193.222,100,374,1,8/2/17 12:26,R_2xRYUmEsw7gmurE,,,,,32.78250122,-96.8207016,anonymous,EN,A2GBV3YLSRW4SH,"1,2",3,6,,,,,,,,,,,,,,,,,,,,,,,,,,,,,,,,,,,,,,,,,,,,,,,,,,,,,,,,,,,,,,,,,,,,,,,,,,,,,,,,,,,,,,,,,,,,,,,,,,,,,,,,,,,,,,,,,,,,,,,,,,,,,,,,,,,,,,,,,,,,,,,,,,,,,,,,,,,,,,,,,,,,,,,,,,,,,,,,,,,,,,,,,,,,,,,,,,,,5,6,I don't see any problem in this little scenario. A manager assigns a duty to an employee. Sounds fair to me.,3,3,4,4,4,4,"In most cases, people are not Joyful or Happy about any task at their job.",4,"He's a manager, he must be doing something right to become a manager.",1,,,,,,,,,,,,,,,,,,,,,,,,,,,,,,,,,,,,,2,35,2,4,1,5,1,
8/2/17 12:19,8/2/17 12:26,0,75.99.158.2,100,386,1,8/2/17 12:26,R_1OBsChZRlKVCsvD,,,,,40.91679382,-74.63700104,anonymous,EN,A39ROW50DWRRKT,"1,2",3,6,,,,,,,,,,,,,,,,,,,,,,,,,,,,,,,,,,,,,,,,,,,,,,,,,3,the manager inputted Chris' answer forth e algorithm to determinet he candidates fit.,"A pre-defiend set of rules to that if it is met, proceeds to the next step of instructions.",,,,,,,,,,,,,,,,,,,,,,,,,4,I wouldn't fully trust an algorithm to determine whether or not a person is a good fit for an organization.  too many variables to really create something for,3,2,1,6,5,5,Letting an algorithm determine if he is a good fit versus the judgement of a person can be annoying and feels like you're losing out.,2,"Without any experience and prior proof of it working, it's hard to determine if the algorithm is even a good one to begin with. ",1,,,,,,,,,,,,,,,,,,,,,,,,,,,,,,,,,,,,,,,,,,,,,,,,,,,,,,,,,,,,,,,,,,,,,,,,,,,,,,,,,,,,,,,,,,,,,,,,,,,,,,,,,,,,,,,,,,,,,,,,,,,,,,,,,,,,,,,,,,,,,,,,,,,,,,,,,,,,,,2,34,2,3,4,3,3,
8/2/17 12:20,8/2/17 12:26,0,67.166.202.223,100,359,1,8/2/17 12:26,R_9B3WcNdk67TqQGl,,,,,34.26620483,-85.11589813,anonymous,EN,A3Q92WMGIHEPSD,"1,2",3,6,,,,,,,,,,,,,,,,,,,,,,,,,,,,,,,,,,,,,,,,,,,,,,,,,,,Steps a computer takes to solve a problem,,,,,,,,,,,,,,,,,,,,,,,,,,,,,,,,,,,,,,,,,,,,,,,,,,,,,,,,,,,,,,,,,,,,,,,,,,,,,,,,,,,,,,,,,,,,,,,,,,,,,,,,,,,,,,,,,,,,,,,,,,,,,,,,,,,,,5,It depends on how well the algorithm does its job. I'm doubtfull it handles edge cases that would require a judicious human to evaluate correctly.,2,2,2,6,6,6,I think most people's experience with automated systems that involve complicated human interaction are not good.,3,I think it is a complicated problem that would require advanced AI to solve and I don't think there is a solution.,1,1,,,,,,,,,,,,,,,,,,,,,,,,,,,,,,,,,,,,,,,,,,,,,,,,,4,38,2,5,1,1,4,
8/2/17 12:16,8/2/17 12:26,0,67.44.208.201,100,646,1,8/2/17 12:26,R_3ISjbm8DcCwMMOq,,,,,36.16589355,-86.78440094,anonymous,EN,A2OYOA5MAKMFHG,"1,2",3,6,,,,,,,,,,,,,,,,,,,,,,,,,,,,,,,,,,,,,,,,,,,,,,,,,3,The algorithm is guided by the manager to judge the employee's performance. ,Algorithms are computer programs that simulate human thought processes by using a set of factors to create parameters for performance.,,,,,,,,,,,,,,,,,,,,,,,,,,,,,,,,,,,,,3,"Computers don't understand possible human mistakes, slip-ups, or pauses. If the manager relies too heavily to a strict algorithm to judge performance, Chris will receive a poor review for a job well done.  ",2,1,1,7,5,6,"The manager is relying on the computer to judge his performance, which may be well done but misunderstood. ",3,Employee evaluation should be a well rounded process and consist of many dynamic factors that a computer might not be able to track.,1,,,,,,,,,,,,,,,,,,,,,,,,,,,,,,,,,,,,,,,,,,,,,,,,,,,,,,,,,,,,,,,,,,,,,,,,,,,,,,,,,,,,,,,,,,,,,,,,,,,,,,,,,,,,,,,,,,,,,,,,,,,,,,,,,,,,,,,,,,,,,,,,,,2,26,1,3,1,3,4,
8/2/17 12:15,8/2/17 12:27,0,45.23.48.240,100,752,1,8/2/17 12:27,R_2bkiUx30PTeKEyB,,,,,38.54200745,-89.99189758,anonymous,EN,A20FYUFRCZRW5O,"1,2",3,6,,,,,,,,,,,,,,,,,,,,,,,,,,,,,,,,,,,,,,,,,,,,,,,,,3,The manager first monitors the algorithm and then he will do the on site job interview.  The algorithm looks at all the applicants online and then selects who will be picked for the onsite interview. ,"Algorithms are a way to find certain features.  You tell the computer what you are looking and the algorithm selects only those items/people.  Instead of looking at every single one yourself.  It's basically like doing a filter on excel but way more advanced, if that makes sense. ",,,,,,,,,,,,,,,,,,,,,,,,,6,I believe it's fair since the algorithm is the same for every applicant. ,4,4,5,2,2,2,"I believe Chirs wouldn't feel any negative emotions about the process and would neither be happy at the same time.  He would just think its fair, possible a little proud that a company has such an advanced algorithm ",5,"I trust the algorithm completely, but having a manager monitoring it would require more than one person doing the job.  This way they can evaluate each other and keep them honest.  But in general I trust it. ",1,,,,,,,,,,,,,,,,,,,,,,,,,,,,,,,,,,,,,,,,,,,,,,,,,,,,,,,,,,,,,,,,,,,,,,,,,,,,,,,,,,,,,,,,,,,,,,,,,,,,,,,,,,,,,,,,,,,,,,,,,,,,,,,,,,,,,,,,,,,,,,,,,,,,,,,,,,,,,,1,23,2,3,1,3,3,
8/2/17 12:19,8/2/17 12:28,0,69.131.15.100,100,509,1,8/2/17 12:28,R_T1IruYRbz8DCHSh,,,,,30.79849243,-81.72070313,anonymous,EN,A2BVUVKIS50IR8,"1,2",3,6,,,,,,,,,,,,,,,,,,,,,,,,,,,,,,,,,,,,,,,,,,,,,,,,,3,"Both of them decide what tasks Chris should do for maintenance, and then the algorithm takes that information and makes a final decision.",Computer programs that study patterns and learn to apply the patterns in the future to decide what information is most important.,,,,,,,,,,,,,,,,,,,,,,,,,,,,,,,,,,,,,,,,,,,,,,,,,7,"The manager can better make a decision based on experience, and the algorithm can better make a decision based on statistics. That means the decision is based on equal parts feelings and logic. You can't get any fairer than that.",6,5,6,2,2,2,"Chris would feel pride in his work no matter who is assigning it, or he would not bother to do his job. He probably doesn't feel frustrated most of the time, because so many checks are made with both a human brain and a computer brain deciding what to do. Joyful is a strong word, so he may feel it slightly, but he probably does feel happy because he knows he is doing the right task. Most of the time Chris is unlikely to feel angry and disappointed, because every assurance has been made that he is doing the proper work.",7,The algorithm has so much information to go on that I have extreme trust that it will analyze the situation correctly and make the best decision.,1,,,,,,,,,,,,,,,,,,,,,,,,,,,,,,,,,,,,,,,,,,,,,,,,,,,,,,,,,,,,,,,,,,,,,,,,,,,,,,,,,,,,,,,,,,,,,,,,,,,,,,,,,,,,,,,,,,,,,,,,,,,,,,,,,,,,,,1,42,1,5,1,4,1,
8/2/17 12:21,8/2/17 12:28,0,99.30.122.48,100,431,1,8/2/17 12:28,R_1HicrGv7oS8HgBW,,,,,33.80419922,-83.88929749,anonymous,EN,A2H3FS3XLH81O1,"1,2",3,6,,,,,,,,,,,,,,,,,,,,,,,,,,,,,,,,,,,,,,,,,,,,,,,,,3,"the alogrithm is adjusted and monitored by the manager, but then the algorithm makes a final decision on his performance.",Mathatmatical equations to determine actions,,,,,,,,,,,,,,,,,,,,,,,,,,,,,,,,,,,,,6,An algorithim can be impartial.,4,4,4,5,5,5,I think that he would fear being judged by an algorithm versus his manager. ,5,Managers can probably take more things into consideration but they are also not as accurate.,1,,,,,,,,,,,,,,,,,,,,,,,,,,,,,,,,,,,,,,,,,,,,,,,,,,,,,,,,,,,,,,,,,,,,,,,,,,,,,,,,,,,,,,,,,,,,,,,,,,,,,,,,,,,,,,,,,,,,,,,,,,,,,,,,,,,,,,,,,,,,,,,,,,2,41,1,2,1,3,4,
8/2/17 12:16,8/2/17 12:28,0,104.33.225.169,100,718,1,8/2/17 12:28,R_3j6BWo8ftaSzZzO,,,,,34.19799805,-119.1725998,anonymous,EN,A1BE2EQFHHB22K,"1,2",3,6,,,,,,,,,,,,,,,,,,,,,,,,,,,,,,,,,,,,,,,,,,,,,,,,,3,The manager monitors and makes changes to algorithm. The algorithm decideds what gets fixed and who fixes it. ,A set of factors with various weights that produces an ouput or outcome when certain things set it into action.,5,"While there isn't much about the process that is unfair, Chris may get assignments he is not the best match for.",3,4,4,4,4,5,"He may be professional about his job, but I can see how easily he may get tasks he does not want.",4,I did not see any weight considerations given to the employees and their skills.,1,,,,,,,,,,,,,,,,,,,,,,,,,,,,,,,,,,,,,,,,,,,,,,,,,,,,,,,,,,,,,,,,,,,,,,,,,,,,,,,,,,,,,,,,,,,,,,,,,,,,,,,,,,,,,,,,,,,,,,,,,,,,,,,,,,,,,,,,,,,,,,,,,,,,,,,,,,,,,,,,,,,,,,,,,,,,,,,,,,,,,,3,45,1,5,2,3,1,
8/2/17 12:14,8/2/17 12:28,0,50.105.137.224,100,821,1,8/2/17 12:28,R_2pWi5PnVur0CIlp,,,,,43.56730652,-89.31890106,anonymous,EN,A10ZOUOZZ3EOAJ,"1,2",3,6,,,,,,,,,,,,,,,,,,,,,,,,,,,,,,,,,,,,,,,,,,,,,,,,,3,"The manager monitors the algorithm and makes adjustments to it, but the algorithm had the final say in employee performance rating.","I think they are an equation of sorts, a set of rules that is considered a standard, and used to measure all sorts of things according to that standard.",,,,,,,,,,,,,,,,,,,,,,,,,,,,,,,,,,,,,3,"I am somewhat torn as I believe this system could measure quality to a certain extent, but I think it would fail to factor in every possible variable possible when dealing with human beings. While the manager monitors the algorithm, the algorithm makes the final decision about Chris's performance.",3,2,5,4,4,6,"I think Chris would be proud of his work, but disappointed that it is not truly evaluated by his manager and if his manager isn't fair,it could skew the results unfavorably against Chris.",2,I guess I don't see the point in using it at all when the manager oversees it and can make adjustments to it. I would have very little trust in it because it can easily be manipulated/adjusted by the manager.,1,,,,,,,,,,,,,,,,,,,,,,,,,,,,,,,,,,,,,,,,,,,,,,,,,,,,,,,,,,,,,,,,,,,,,,,,,,,,,,,,,,,,,,,,,,,,,,,,,,,,,,,,,,,,,,,,,,,,,,,,,,,,,,,,,,,,,,,,,,,,,,,,,,1,53,1,5,1,3,4,
8/2/17 12:19,8/2/17 12:28,0,117.195.234.183,100,537,1,8/2/17 12:28,R_pSiax38BuRyl2qB,,,,,17.37530518,78.47439575,anonymous,EN,A3UNLVZ3F1EZBS,"1,2",3,6,,,,,,,,,,,,,,,,,,,,,,,,,2,It is unfair to select top applicants as everyone should be given equal chance to prove there talent.,3,2,1,6,5,6,Chris would feel bad as selection was not for all and suitable candidates,4,He might be somewhat trustworthy as he is into that position.,1,,,,,,,,,,,,,5,role of manager was to select applicants for the post.,rules and regulations,,,,,,,,,,,,,,,,,,,,,,,,,,,,,,,,,,,,,,,,,,,,,,,,,,,,,,,,,,,,,,,,,,,,,,,,,,,,,,,,,,,,,,,,,,,,,,,,,,,,,,,,,,,,,,,,,,,,,,,,,,,,,,,,,,,,,,,,,,,,,,,,,,,,,,,,,,,,,,,,,,,,,,,,,,,,,,,,,,,,,,,,,,,,,,,,,,3,30,2,6,1,2,3,
8/2/17 12:15,8/2/17 12:29,0,73.64.19.156,100,796,1,8/2/17 12:29,R_1pyzOqaD8xoqMZR,,,,,40.6894989,-76.19580078,anonymous,EN,A12VU5YSHGQH2V,"1,2",3,6,,,,,,,,,,,,,,,,,,,,,,,,,,,,,,,,,,,,,,,,,,,,,,,,,3,"Manager tweaks the algorithm, the algorithm selects the top applicants",I think algorithms are equations that weight certain characteristcs and figure things out from there.,,,,,,,,,,,,,,,,,,,,,,,,,4,It is neither. It is up to the manager to decide how they want to hire people.,5,5,5,2,2,2,I think chris would realize that it is better to have the manager look over everything.,6,"Algorithms are good, especially if it is being monitored.",1,,,,,,,,,,,,,,,,,,,,,,,,,,,,,,,,,,,,,,,,,,,,,,,,,,,,,,,,,,,,,,,,,,,,,,,,,,,,,,,,,,,,,,,,,,,,,,,,,,,,,,,,,,,,,,,,,,,,,,,,,,,,,,,,,,,,,,,,,,,,,,,,,,,,,,,,,,,,,,2,22,2,5,1,3,3,
8/2/17 12:21,8/2/17 12:30,0,50.39.188.51,100,538,1,8/2/17 12:30,R_1n1tuzwofQL2OPK,,,,,45.44599915,-122.8820038,anonymous,EN,A3FI4PWGQDJN25,"1,2",3,6,,,,,,,,,,,,,,,,,,,,,,,,,,,,,,,,,,,,,,,,,,,,,,,,,,,,,,,,,,,,,,,,,,,,,,,,,,,,,,,,,,,,,,,,,,,,,,,,,,,,,,,,,,,,,,,,,,,,,,,,,,,,,,,,,,,,,,,,,,,,,,,,,,,,,,,,,,,,,,,,,,,,,,,,,,,,,,,,,,,,,,,,,,,,,,,,,,,,5,,,,,,,,,,,,,,,,,,,,,,,,,6,"As the manager will oversee the person they hire, it makes sense that the manager selects the top applicants. ",4,4,3,4,3,2,Chris's feelings of being happy or unhappy would ultimately be influenced on whether or not he was selected to be one of the final candidates.  ,5,As I do not have a lot of information on the manager I assume that he/she is qualified for their position and knows what a top candidate is capable of. ,1,,,,,,,,,,,,,2,25,2,5,4,5,3,
8/2/17 12:24,8/2/17 12:30,0,104.7.71.134,100,362,1,8/2/17 12:30,R_2VKfrJpF2Dqty5c,,,,,38.10409546,-122.2565994,anonymous,EN,AOKTAHY4F4J2B,"1,2",3,6,,,,,,,,,,,,,,,,,,,,,,,,,,,,,,,,,,,,,,,,,,,,,,,,,,,Calculations used to carry out tasks and perform them based on how they were programmed,,,,,,,,,,,,,,,,,,,,,,,,,,,,,,,,,,,,,,,,,,,,,,,,,,,,,,,,,,,,,,,,,,,,,,,,,,,,,,,,,,,,,,,,,,,,,,,,,5,It's somewhat fair because his job is significant and ensures that everything runs properly,4,4,4,1,1,1,I feel that his job is appropriate and should have no anger towards it,5,Algorithms can sometimes create calculations to the optimal standard. ,1,,,,,,,,,,,,,,,,,,,,,,,,,,,,,,,,,,,,,1,,,,,,,,,,,,,,,,,,,,,,,,,,,,,,,,,,,,,,,,,,,,,,,,,1,26,2,3,4,1,1,
8/2/17 12:17,8/2/17 12:30,0,24.39.223.162,100,772,1,8/2/17 12:30,R_24CYloy1x9lb4JR,,,,,42.40759277,-73.65640259,anonymous,EN,A8LN94NNLE8MU,"1,2",3,6,7,"The algorithm has figured out based on previous results that the machine may be in need of repair, it's fair because it's his job to repair machines, and thats what he has to do.",4,4,4,1,4,1,Why should Chris feel strongly about the algorithm deciding if a part has to be replaced? He should trust the manager's judgement based on the algorithm that the work has to be done.,7,"Algorithms are not always perfect, but are a great indicator, in this case it is extremely helpful to have some 'warning' about the failing parts.",1,,,,,,,,,,,,,,,,,,,,,,,,,,,,,,,,,,,,,3,The algorithm takes previous information about parts and suggests to the manager that the part needs repair / replacement. The manager then assigns the work to a repairer.,"Algorithms are logical steps in a computer program, that determine results given inputs.",,,,,,,,,,,,,,,,,,,,,,,,,,,,,,,,,,,,,,,,,,,,,,,,,,,,,,,,,,,,,,,,,,,,,,,,,,,,,,,,,,,,,,,,,,,,,,,,,,,,,,,,,,,,,,,,,,,,,,,,,,,,,,,,,,,,,,,,,,,,,,,,,,,,,,,,,,,,,,,,,,,,,,,,,,,,,,,,,,,,,,,,,,,,,,,,,,3,20,2,3,1,2,1,
8/2/17 12:16,8/2/17 12:30,0,73.20.7.134,100,859,1,8/2/17 12:30,R_1FFD0VkRdxmJ5jX,,,,,40.49819946,-111.8435974,anonymous,EN,A1DIL5CPN9GUU5,"1,2",3,6,,,,,,,,,,,,,,,,,,,,,,,,,,,,,,,,,,,,,,,,,,,,,,,,,3,"The manager analyzes the importance of the components, and the algorithm analyzes the breakdown history of the components.",Algorithms are a set of rules that follow calculations or problem solving operations.,,,,,,,,,,,,,,,,,,,,,,,,,,,,,,,,,,,,,,,,,,,,,,,,,6,The algorithm assigned Chris because Chris had all the qualifications to carry out the maintenance task.,6,4,7,2,2,2,I think Chris would be pleased to know he was chosen to carry out the task because of his competence and qualifications.,6,I like that a human is part of the analysis because computers can make mistakes.,1,,,,,,,,,,,,,,,,,,,,,,,,,,,,,,,,,,,,,,,,,,,,,,,,,,,,,,,,,,,,,,,,,,,,,,,,,,,,,,,,,,,,,,,,,,,,,,,,,,,,,,,,,,,,,,,,,,,,,,,,,,,,,,,,,,,,,,1,61,1,3,1,4,1,
8/2/17 12:21,8/2/17 12:31,0,65.27.219.101,100,590,1,8/2/17 12:31,R_3j1mP7xVA3kUg5w,,,,,39.19859314,-84.48549652,anonymous,EN,A2X5O7HXXFYSFB,"1,2",3,6,,,,,,,,,,,,,,,,,,,,,,,,,,,,,,,,,,,,,4,I'm not sure how well the algorithm can analyze the calls to make a fair and concise analysis for the manager to review.,4,4,4,4,4,5,I think most people would question the capabilities of the algorithm without a understanding of its workings especially if the outcome was negative.,4,I think with understanding of the algorithm the manager should be able to make a somewhat fair evaluation.,1,3,The algorithm analyzes past calls and the manager makes a evaluation based upon the analyisis.,A set of instructions a computer or human follows to solve a problem.,,,,,,,,,,,,,,,,,,,,,,,,,,,,,,,,,,,,,,,,,,,,,,,,,,,,,,,,,,,,,,,,,,,,,,,,,,,,,,,,,,,,,,,,,,,,,,,,,,,,,,,,,,,,,,,,,,,,,,,,,,,,,,,,,,,,,,,,,,,,,,,,,,,,,,,,,,,,,,,,,,,,,,,,,,,,,,,,,,,,,,,,,,,,,,,,,,2,25,2,2,2,2,4,
8/2/17 12:17,8/2/17 12:32,0,97.87.120.142,100,877,1,8/2/17 12:32,R_1Qll4RJaPL81rAd,,,,,38.34410095,-89.061203,anonymous,EN,A34AFYT6XP6GOV,"1,2",3,6,,,,,,,,,,,,,5,"Seems fair for the coffee shop, but with no input from Chris.",3,3,4,4,5,5,He was put into the position strictly for the needs of the coffee shop.,4,"The computer can predict the number of customers, but not necessarily employee needs or abilities.",1,,,,,,,,,,,,,,,,,,,,,,,,,3,"The algorithm predicts the number of customers throughout the day, along with employee availability. The manager makes the final decision about who works what shift.",An algorithm is a process done by a computer following a certain set of rules.,,,,,,,,,,,,,,,,,,,,,,,,,,,,,,,,,,,,,,,,,,,,,,,,,,,,,,,,,,,,,,,,,,,,,,,,,,,,,,,,,,,,,,,,,,,,,,,,,,,,,,,,,,,,,,,,,,,,,,,,,,,,,,,,,,,,,,,,,,,,,,,,,,,,,,,,,,,,,,,,,,,,,,,,,,,,,,,,,,,,,,,,,,,,,,,,,,1,28,1,2,1,2,2,
8/2/17 12:29,8/2/17 12:33,0,73.28.173.226,100,245,1,8/2/17 12:33,R_3kLATYnjmZH44xE,,,,,26.9855957,-82.09100342,anonymous,EN,A2I4VW9ZHQ63XO,"1,2",3,6,,,,,,,,,,,,,,,,,,,,,,,,,,,,,,,,,,,,,4,The algorithm could be wrong or right. There is no way of checking it.,4,4,4,4,4,4,It depends on what the review is.,4,The manager is following the computer so I trust him to do that.,1,3,The algorithm evaluated and the manager followed the recommendation of the computer.,They are a computer program that evaluates work with AI,,,,,,,,,,,,,,,,,,,,,,,,,,,,,,,,,,,,,,,,,,,,,,,,,,,,,,,,,,,,,,,,,,,,,,,,,,,,,,,,,,,,,,,,,,,,,,,,,,,,,,,,,,,,,,,,,,,,,,,,,,,,,,,,,,,,,,,,,,,,,,,,,,,,,,,,,,,,,,,,,,,,,,,,,,,,,,,,,,,,,,,,,,,,,,,,,,2,31,2,5,1,2,4,
