7/21/17 14:10,7/21/17 14:16,0,141.218.179.226,100,371,1,7/21/17 14:16,R_3QFZ3ooU63lQVqK,,,,,42.26829529,-85.61669922,anonymous,EN,A2R6XDIBAQYDDL,"1,2",3,6,,,,,,,,,,,,,,,,,,,,,,,,,,,,,,,,,,,,,,,,,,,,,,,,,3,The manager provided oversight for the algorithm and adjusted it to try and improve its accuracy in evaluating the employee's performance.,The are computer programs used to make formulaic decisions in the absense of human decision makers.,,,,,,,,,,,,,,,,,,,,,,,,,,,,,,,,,,,,,2,Although algorithms can evaluate things like pitch or tone of voice or place numerical values to certain words or phrases this is not the equivalent of true human oversight.,2,2,2,5,5,6,If I were in the given situation these are the feelings I would have toward being treated in the same manner.,3,"As I previously stated, placing numerical values on pitch or specific words or phrases does not always give a clear indication of the worker's quality of service.",1,,,,,,,,,,,,,,,,,,,,,,,,,,,,,,,,,,,,,,,,,,,,,,,,,,,,,,,,,,,,,,,,,,,,,,,,,,,,,,,,,,,,,,,,,,,,,,,,,,,,,,,,,,,,,,,,,,,,,,,,,,,,,,,,,,,,,,,,,,,,,,,,,,1,30,1,6,1,3,4,
7/21/17 14:10,7/21/17 14:16,0,70.178.254.74,100,387,1,7/21/17 14:16,R_2fIhuEdmG33DmwU,,,,,36.1013031,-94.26999664,anonymous,EN,A15FKRMMU2F47I,"1,2",3,6,,,,,,,,,,,,,,,,,,,,,,,,,,,,,,,,,,,,,,,,,,,,,,,,,3,The manager analyzed the personal statements and the algorithm analyzed the resumes as a whole and chose which ones should be interviewed.,A set of rules for a computer to make decisions.,,,,,,,,,,,,,,,,,,,,,,,,,,,,,,,,,,,,,,,,,,,,,,,,,,,,,,,,,,,,,,,,,,,,,,,,,5,"Well it depends on the algorithm, some are more fair than others.",3,3,4,5,5,5,Chris may not want his life to be controlled by a machine.,3,"The algorithm, while not necessarily completely fair, probably isn't completely arbitrary either.",1,,,,,,,,,,,,,,,,,,,,,,,,,,,,,,,,,,,,,,,,,,,,,,,,,,,,,,,,,,,,,,,,,,,,,,,,,,,,,,,,,,,,,,,,,,,,,,,,,,,,,,,,,,,,,,2,34,2,1,1,4,3,
7/21/17 14:12,7/21/17 14:16,0,99.122.85.233,100,234,1,7/21/17 14:16,R_27myrLXnMNJIeBU,,,,,37.14889526,-93.26139832,anonymous,EN,A3SX229VS1X6B6,"1,2",3,6,,,,,,,,,,,,,7,An algorithm does not have personal bias. It takes objective facts and outputs the best possible result. It is the most fair way possible.,5,4,4,2,1,2,"I think Chris would know that the algorithm is fair, using common sense, and would have to be relatively happy about his schedule.",6,I think the manager wants to make the best possible decision for the business and so I trust their judgment.,1,,,,,,,,,,,,,,,,,,,,,,,,,3,The manager decided to use an algorithm for employee scheduling.,"Algorithms take a series of inputs, and make calculations based on them that maximize a certain variable.",,,,,,,,,,,,,,,,,,,,,,,,,,,,,,,,,,,,,,,,,,,,,,,,,,,,,,,,,,,,,,,,,,,,,,,,,,,,,,,,,,,,,,,,,,,,,,,,,,,,,,,,,,,,,,,,,,,,,,,,,,,,,,,,,,,,,,,,,,,,,,,,,,,,,,,,,,,,,,,,,,,,,,,,,,,,,,,,,,,,,,,,,,,,,,,,,,1,30,2,8,4,2,2,
7/21/17 14:13,7/21/17 14:16,0,169.241.60.213,100,198,1,7/21/17 14:16,R_1DZq1woY8jicrpH,,,,,36.17500305,-115.1371994,anonymous,EN,AUL89KDPY6YFT,"1,2",3,6,,,,,,,,,,,,,,,,,,,,,,,,,,,,,,,,,,,,,,,,,,,,,,,,,3,The manager adjusts and the algorithm schedules.,Algorithms are programs that use data to determine an answer.,,,,,,,,,,,,,7,The algorithm probably has a better method of determining appropriate scheduling than a human boss.,6,6,5,1,2,4,Chris would probably be getting shifts he was the most available for.,6,The manager gives the employee someone to talk to if issues arise.,1,,,,,,,,,,,,,,,,,,,,,,,,,,,,,,,,,,,,,,,,,,,,,,,,,,,,,,,,,,,,,,,,,,,,,,,,,,,,,,,,,,,,,,,,,,,,,,,,,,,,,,,,,,,,,,,,,,,,,,,,,,,,,,,,,,,,,,,,,,,,,,,,,,,,,,,,,,,,,,,,,,,,,,,,,,2,35,2,4,1,3,2,
7/21/17 14:10,7/21/17 14:16,0,69.68.240.114,100,372,1,7/21/17 14:16,R_21BLWNBk2XdmuqX,,,,,28.65150452,-81.34320068,anonymous,EN,AT5NKCNE7LOAZ,"1,2",3,6,5,Chris is a manager and that means he needs to look out for the company and its needs,4,3,5,3,3,3,"Chris might not want to do it, but he should feel proud for contributing to the cause.",5,"From my experience, algorithms work pretty well and I generally trust them.",2,,,,,,,,,,,,,,,,,,,,,,,,,,,,,,,,,,,,,3,"algorithm was a tool and a decider, manager was an assigner and analyzer",a set of rules used to solve a problem,,,,,,,,,,,,,,,,,,,,,,,,,,,,,,,,,,,,,,,,,,,,,,,,,,,,,,,,,,,,,,,,,,,,,,,,,,,,,,,,,,,,,,,,,,,,,,,,,,,,,,,,,,,,,,,,,,,,,,,,,,,,,,,,,,,,,,,,,,,,,,,,,,,,,,,,,,,,,,,,,,,,,,,,,,,,,,,,,,,,,,,,,,,,,,,,,,1,19,1,3,1,2,1,
7/21/17 14:10,7/21/17 14:17,0,68.49.244.98,100,417,1,7/21/17 14:17,R_2fjm45eZmL1m4UU,,,,,42.23989868,-83.15080261,anonymous,EN,A2F93SIUUV5HQH,"1,2",3,6,,,,,,,,,,,,,,,,,,,,,,,,,,,,,,,,,,,,,,,,,,,,,,,,,3,"The algorithm essentially narrowed the search for the manager, who read and judged the qualities it could not assess.",They are programs designed to find patterns and make predictions based on those patterns.,,,,,,,,,,,,,,,,,,,,,,,,,,,,,,,,,,,,,,,,,,,,,,,,,,,,,,,,,,,,,,,,,,,,,,,,,3,"I believe in judgements being made on a case by case basis, for the most part. Algorithms essentially make predetermined choices.",3,2,2,4,4,4,I doubt he would have strong feelings about it at all.,2,Algorithms are pre-programmed. they cannot make quality choices on their own.,1,,,,,,,,,,,,,,,,,,,,,,,,,,,,,,,,,,,,,,,,,,,,,,,,,,,,,,,,,,,,,,,,,,,,,,,,,,,,,,,,,,,,,,,,,,,,,,,,,,,,,,,,,,,,,,1,31,1,3,1,4,3,
7/21/17 14:12,7/21/17 14:17,0,162.226.190.29,100,300,1,7/21/17 14:17,R_3G0PD5W3kPkzp46,,,,,33.88000488,-117.9633026,anonymous,EN,A0017268R9SKD8U2Y3F,"1,2",3,6,,,,,,,,,,,,,,,,,,,,,,,,,,,,,,,,,,,,,,,,,,,,,,,,,3,manager says how many customers they have and algorithm uses that input to analyze when workers are needed,"Calculations, logical ones",,,,,,,,,,,,,,,,,,,,,,,,,,,,,,,,,,,,,,,,,,,,,,,,,,,,,,,,,,,,,5,I think its fair because the algorithm is logical and I am trusting the manager to be fair and logical in their analysis,5,5,1,1,1,1,"I dont see why he would be upset, as its all based on logical configurations",7,I think the algorithm is trustful as its based on pretty precise calculations,1,,,,,,,,,,,,,,,,,,,,,,,,,,,,,,,,,,,,,,,,,,,,,,,,,,,,,,,,,,,,,,,,,,,,,,,,,,,,,,,,,,,,,,,,,,,,,,,,,,,,,,,,,,,,,,,,,,,,,,,,,,1,25,1,3,1,4,2,
7/21/17 14:11,7/21/17 14:17,0,66.177.132.175,100,358,1,7/21/17 14:17,R_2vYtA6caQQFGoUY,,,,,30.26559448,-81.77799988,anonymous,EN,A3749HUHYLI50L,"1,2",3,6,,,,,,,,,,,,,,,,,,,,,,,,,,,,,,,,,,,,,,,,,,,,,,,,,,,calculations put in place like a program to solve a problem or come up with a solution,,,,,,,,,,,,,,,,,,,,,,,,,,,,,,,,,,,,,,,,,,,,,,,,,,,,,,,,,,,,,,,,,,,,,,,,,,,,,,,,,,,,,,,,,,,,,,,,,,,,,,,,,,,,,,,,,,,,,,,,,2,I don't think algorithm is a substitute for human judgement,4,2,3,6,3,5,He might have had expectations for a human to judge what he wrote and for it to entice them to select him,2,algorithm can't make human judgements about a person ,1,,,,,,,,,,,,,1,,,,,,,,,,,,,,,,,,,,,,,,,,,,,,,,,,,,,,,,,,,,,,,,,1,42,1,2,6,1,3,
7/21/17 14:10,7/21/17 14:17,0,12.23.120.193,100,411,1,7/21/17 14:17,R_3JL3Q5HorSmYGAk,,,,,41.48539734,-88.74310303,anonymous,EN,A3760PCQD2MPIO,"1,2",3,6,,,,,,,,,,,,,,,,,,,,,,,,,,,,,,,,,,,,,,,,,,,,,,,,,,,computer programs that perform tasks according to a set of rules,,,,,,,,,,,,,,,,,,,,,,,,,,,,,,,,,,,,,,,,,,,,,,,,,,,,,,,,,,,,,,,,,,,,,,,,,,,,,,,,,,,,,,,,,,,,,,,,,,,,,,,,,,,,,,,,,,,,,,,,,,,,,,,,,,,,,3,I'm not sure the algorism has all the necessary understanding and can catch nuances of a conversation.,3,3,3,5,5,5,"If the evaluation is unfair, of course the employee would be upset, especially knowing that an unfeeling ""robot"" did it.",2,Already answered that. See above.,1,1,,,,,,,,,,,,,,,,,,,,,,,,,,,,,,,,,,,,,,,,,,,,,,,,,1,44,1,5,1,1,4,
7/21/17 14:10,7/21/17 14:17,0,68.4.232.116,100,416,1,7/21/17 14:17,R_NVCxynjxxUNfsLD,,,,,33.64509583,-117.6786041,anonymous,EN,A1RZT7L92M3XY0,"1,2",3,6,,,,,,,,,,,,,,,,,,,,,,,,,,,,,,,,,,,,,2,I don't see how an algorithm can make a determination of your customer service performance.,2,2,2,6,5,6,It probably depends on the result of the algorithm but he would probably not be happy with having a alg.... rate his performance.,3,It must get it right sometimes but I don't think very often.,1,3,"algorithm rate employee's performance, manager uses that info to rate employee.",Computer program that takes several factors into consideration to make a determination.,,,,,,,,,,,,,,,,,,,,,,,,,,,,,,,,,,,,,,,,,,,,,,,,,,,,,,,,,,,,,,,,,,,,,,,,,,,,,,,,,,,,,,,,,,,,,,,,,,,,,,,,,,,,,,,,,,,,,,,,,,,,,,,,,,,,,,,,,,,,,,,,,,,,,,,,,,,,,,,,,,,,,,,,,,,,,,,,,,,,,,,,,,,,,,,,,,1,58,1,3,1,2,4,
7/21/17 14:09,7/21/17 14:17,0,73.150.213.235,100,463,1,7/21/17 14:17,R_2EgA2brUqPCyFGE,,,,,39.74009705,-74.97090149,anonymous,EN,A1GRPIBHW72HDU,"1,2",3,6,,,,,,,,,,,,,,,,,,,,,,,,,,,,,,,,,,,,,,,,,,,,,,,,,3,The algorithm makes decisions and the manager overlooks how the algorithm is making decisions. ,Inputs and programming that help make computers make decisions. ,6,I think it is pretty fair because it is similar to his manager assigning him duties since his ,4,4,2,2,2,2,"I don't think Chris would feel any of these emotions at all. He wouldn't be proud because there's nothing for him to be proud of. He wouldn't be angry, disappointed or frustrated because it is a computer that will tell him what to do. ",6,I think the algorithm would do what it is meant to do and the fact that it is overlooked by the manger is even better.,1,,,,,,,,,,,,,,,,,,,,,,,,,,,,,,,,,,,,,,,,,,,,,,,,,,,,,,,,,,,,,,,,,,,,,,,,,,,,,,,,,,,,,,,,,,,,,,,,,,,,,,,,,,,,,,,,,,,,,,,,,,,,,,,,,,,,,,,,,,,,,,,,,,,,,,,,,,,,,,,,,,,,,,,,,,,,,,,,,,,,,,1,28,2,4,1,3,1,
7/21/17 14:10,7/21/17 14:17,0,128.113.63.179,100,464,1,7/21/17 14:17,R_33wCyd6l89ngcnJ,,,,,42.74949646,-73.5951004,anonymous,EN,A303X7UXRA6FP2,"1,2",3,6,,,,,,,,,,,,,,,,,,,,,,,,,,,,,,,,,,,,,,,,,,,,,,,,,3,"From what I recall, the manager initially screens  the applicants using the algorithm and then the algorithm chooses the top candidates to be interviewed. ",Algorithms are computational processes that a computer uses to derive outcomes. ,,,,,,,,,,,,,,,,,,,,,,,,,,,,,,,,,,,,,,,,,,,,,,,,,,,,,,,,,,,,,,,,,,,,,,,,,3,I don't think currently a computer has the computational ability to derive information from a resume that can accurately gauge candidates for a job. Resumes are more than just words and data on a page.,4,3,3,6,5,7,I think Chris would feel a bit put out that he was being judged or scrutinized by a machine. ,2,"Again, unless data can be entered into a numerical format for the computer to understand, it takes some intuition and experience to judge the qualities of job seekers. People are more than the sum of their algorithms. ",1,,,,,,,,,,,,,,,,,,,,,,,,,,,,,,,,,,,,,,,,,,,,,,,,,,,,,,,,,,,,,,,,,,,,,,,,,,,,,,,,,,,,,,,,,,,,,,,,,,,,,,,,,,,,,,2,53,1,4,1,4,3,
7/21/17 14:12,7/21/17 14:17,0,100.11.41.185,100,312,1,7/21/17 14:17,R_1l67SlM7WmXvqeM,,,,,39.95300293,-75.17559814,anonymous,EN,A2PYGLCXIXOHBQ,"1,2",3,6,,,,,,,,,,,,,,,,,,,,,,,,,,,,,,,,,,,,,,,,,,,,,,,,,,,"As far as I know, an algorithm is like a formula, a sort of rubric for how a computer determines things...",,,,,,,,,,,,,,,,,,,,,,,,,,,,,,,,,,,,,,,,,,,,,,,,,,,,,,,,,,,,,,,,,,,,,,,,,,,,,,,,,,,,,,,,,,,,,,,,,,,,,,,,,,,,,3,"I think it's a little bit unfair because, unlike with a human boss scheduling people, there's no opportunity for someone like Chris to voice whether he prefers mornings or not, or whether he is capable of dealing with crowds better than other employees..it just seems like something a person would know/do better than a computer. I think Chris would just find it fairer if a human, with feelings and compassion, made the schedule.",2,2,5,4,4,4,"I think in a coffee shop especially, Chris would not be very joyful or happy to be scheduled in the morning, the busiest time of day. He might be a little proud, because perhaps the boss entering his name as a possibility for the computer to schedule in mornings means that they think he's competent,but I think it's equally likely and unlikely that he'd be disappointed, frustrated, or angry--it depends whether he likes working mornings or not! ",5,"Well, I'm not familiar with this particular algorithm, but in general, I've found computer-generated things to be okay, but not stellar, when compared to the same things performed by humans. ",1,,,,,,,,,,,,,,,,,,,,,,,,,1,,,,,,,,,,,,,,,,,,,,,,,,,,,,,,,,,,,,,,,,,,,,,,,,,1,32,1,5,1,1,2,
7/21/17 14:14,7/21/17 14:18,0,97.113.110.214,100,230,1,7/21/17 14:18,R_1o4HIK0gCuWrh6E,,,,,47.64759827,-122.5363998,anonymous,EN,AGA1PIIWM8I8D,"1,2",3,6,,,,,,,,,,,,,,,,,,,,,,,,,3,An algorithm can't detect every possible trait a person might have regarding their work ethic.,2,2,2,6,3,5,I imagine it would be hard to pick out people using this method.,3,I think he'd do the best with the information that he had.,1,,,,,,,,,,,,,3,The algorithm would go through the candidates and rate them. Chris would have the final say on who was hired though.,They use a set amount of data to determine a likely scenario or outcome.,,,,,,,,,,,,,,,,,,,,,,,,,,,,,,,,,,,,,,,,,,,,,,,,,,,,,,,,,,,,,,,,,,,,,,,,,,,,,,,,,,,,,,,,,,,,,,,,,,,,,,,,,,,,,,,,,,,,,,,,,,,,,,,,,,,,,,,,,,,,,,,,,,,,,,,,,,,,,,,,,,,,,,,,,,,,,,,,,,,,,,,,,,,,,,,,,,2,35,2,2,1,2,3,
7/21/17 14:10,7/21/17 14:18,0,184.152.105.68,100,478,1,7/21/17 14:18,R_1NssT42BzM41lPp,,,,,40.81759644,-74.00219727,anonymous,EN,A175PJR0W3LO8I,"1,2",3,6,,,,,,,,,,,,,,,,,,,,,,,,,,,,,,,,,,,,,,,,,,,,,,,,,,,,,,,,,,,,,,,,,,,,,,,,,,,,,,,,,,,,,,,,,,,,,,,,,,,,,,,,,,,,,,,,,,,,,,,,,,,,,,,,,,,,,,,,,,,,,,,,,,,,,,,,,,,,,,,,,,,,,,,,,,,,,,,,,,,,,,,,,,,,,,,,,,,,5,6,"Assuming Chris is a subordinate of the manager, then it is natural for the manager to assign the task to him.  It is part of a working hierarchy.",4,4,4,4,4,4,It's part of Chris's job to do this. He should not feel ANYTHING about doing this.  He's just supposed to do it.,5,"The manager has been entrusted to do his job, based on his past experience, and backing of his superiors, who assigned him/her to the position.  ",1,,,,,,,,,,,,,,,,,,,,,,,,,,,,,,,,,,,,,2,34,2,5,4,5,1,
7/21/17 14:10,7/21/17 14:18,0,24.154.33.80,100,456,1,7/21/17 14:18,R_2l9F07ozwpHW305,,,,,40.94050598,-79.75170135,anonymous,EN,A2EP2TI8HE8EGK,"1,2",3,6,,,,,,,,,,,,,,,,,,,,,,,,,,,,,,,,,,,,,,,,,,,,,,,,,3,The manager provided input for the algorithm then the algorithm considered both its own assessment and the manager's to assess employees.,"Algorithms are computer programs that follow an ""If [this], then [that]"" path of reasoning to use data to make decisions that normally would be made by humans.",,,,,,,,,,,,,,,,,,,,,,,,,,,,,,,,,,,,,,,,,,,,,,,,,,,,,,,,,,,,,,,,,,,,,,,,,,,,,,,,,,,,,2,"I would not want the final decision about an evaluation to fall to algorithm, even one that takes into account a human's input.",4,4,4,5,5,5,"It's tough to say without knowing how the algorithm evaluated him, but I would imagine it wouldn't be as convincing as a real person's evaluation.",3,Algorithms are good but far from infallible.,1,,,,,,,,,,,,,,,,,,,,,,,,,,,,,,,,,,,,,,,,,,,,,,,,,,,,,,,,,,,,,,,,,,,,,,,,,,,,,,,,,,,,,,,,,,,,,,,,,,2,29,1,5,1,4,4,
7/21/17 14:15,7/21/17 14:18,0,70.162.42.63,100,212,1,7/21/17 14:18,R_1gdvVMe93ctGKNL,,,,,33.59129333,-112.107399,anonymous,EN,A31IZKL0SIL3MB,"1,2",3,6,,,,,,,,,,,,,,,,,,,,,,,,,,,,,,,,,,,,,,,,,,,,,,,,,3,The manager evaluated importance and the algorithm evaluated breakdown history,Kind of like equations to solve problems,,,,,,,,,,,,,,,,,,,,,,,,,,,,,,,,,,,,,,,,,,,,,,,,,7,I don't see any reason to consider it unfair,4,4,4,4,4,4,How should I know? I don't even know him,6,"Algorithms have a high success rate, however there is a chance of failure of course",1,,,,,,,,,,,,,,,,,,,,,,,,,,,,,,,,,,,,,,,,,,,,,,,,,,,,,,,,,,,,,,,,,,,,,,,,,,,,,,,,,,,,,,,,,,,,,,,,,,,,,,,,,,,,,,,,,,,,,,,,,,,,,,,,,,,,,,2,25,2,5,1,4,1,
7/21/17 14:13,7/21/17 14:18,0,96.58.1.204,100,295,1,7/21/17 14:18,R_W3ry4pZtjU400bD,,,,,28.23539734,-82.22000122,anonymous,EN,A20Z5O57UDPFLX,"1,2",3,6,,,,,,,,,,,,,,,,,,,,,,,,,,,,,,,,,,,,,,,,,,,,,,,,,,,Algorithms are formulas that help process things faster,,,,,,,,,,,,,,,,,,,,,,,,,,,,,,,,,,,,,,,,,,,,,,,,,,,,,,,,,,,,,,,,,,,,,,,,,,,,,,,,,,,,,,,,,,,,,,,,,6,It's fair to everyone that Chris doesn't have to waste time rechecking working parts,4,4,5,2,3,2,I can't imagine anyone would mind if it made their job easier.,5,I trust it because it uses a proven formula,1,,,,,,,,,,,,,,,,,,,,,,,,,,,,,,,,,,,,,1,,,,,,,,,,,,,,,,,,,,,,,,,,,,,,,,,,,,,,,,,,,,,,,,,2,24,2,2,1,1,1,
7/21/17 14:15,7/21/17 14:18,0,73.49.55.135,100,182,1,7/21/17 14:18,R_1pYUpK6CWfiaf0D,,,,,26.05839539,-80.32520294,anonymous,EN,A30OE9CYEOU2MQ,"1,2",3,6,,,,,,,,,,,,,,,,,,,,,,,,,,,,,,,,,,,,,6,because it is not biased.,7,7,7,1,1,1,he should be proud if he is performing well.,6,because the manager has the information given to him from the algorithims,1,3,the manager makes the final call and the algorithim gives the data,data that is analyzed and processed by a machine,,,,,,,,,,,,,,,,,,,,,,,,,,,,,,,,,,,,,,,,,,,,,,,,,,,,,,,,,,,,,,,,,,,,,,,,,,,,,,,,,,,,,,,,,,,,,,,,,,,,,,,,,,,,,,,,,,,,,,,,,,,,,,,,,,,,,,,,,,,,,,,,,,,,,,,,,,,,,,,,,,,,,,,,,,,,,,,,,,,,,,,,,,,,,,,,,,1,32,1,5,3,2,4,
7/21/17 14:11,7/21/17 14:18,0,99.203.128.63,100,430,1,7/21/17 14:18,R_1kIDbUFz5oIZu9G,,,,,40.48959351,-82.85910034,anonymous,EN,A29IH4NCOUNIAM,"1,2",3,6,,,,,,,,,,,,,,,,,,,,,,,,,,,,,,,,,,,,,,,,,,,,,,,,,,,,,,,,,,,,,,,,,,,,,,,,,,,,,,,,,,,,,,,,,,,,,,,,,,,,,,,,,,,,,,,,,,,,,,,,,,,,,,,,,,,,,,,,,,,,,,,,,,,,,,,,,,,,,,,,,,,,,,,,,,,,,,,,,,,,,,,,,,,,,,,,,,,,5,,,,,,,,,,,,,,,,,,,,,,,,,7,"the top applicants have made it through the initial screenin process, so they have earned an opportunity for an interview.",6,6,6,1,1,6,"if Chris got an interview out of thousands of prospective applicants, he would feel very accomplishec.",7,No manager wants to invest in an employee who is not promising ,1,,,,,,,,,,,,,1,28,1,5,1,5,3,
7/21/17 14:10,7/21/17 14:18,0,97.75.244.20,100,485,1,7/21/17 14:18,R_OegmNksvPlbVqXn,,,,,35.76119995,-81.72799683,anonymous,EN,AKRWFBDVG23T,"1,2",3,6,6,Preventative maintenance will reduce downtime in the factory. ,6,4,4,2,2,2,Chris should have no problem using an algorithmic analysis to help him do his work. ,6,Nothing wrong with using algorithmic analysis as long as the original data used is accurate. ,1,,,,,,,,,,,,,,,,,,,,,,,,,,,,,,,,,,,,,3,Manager assigns the employees to check and update machinery to prevent failure. The algorithm takes into account how important a machine is and how they have broken down in the past as a guide for the future. ,A process of set rules that a computer uses to calculate or problem solve. ,,,,,,,,,,,,,,,,,,,,,,,,,,,,,,,,,,,,,,,,,,,,,,,,,,,,,,,,,,,,,,,,,,,,,,,,,,,,,,,,,,,,,,,,,,,,,,,,,,,,,,,,,,,,,,,,,,,,,,,,,,,,,,,,,,,,,,,,,,,,,,,,,,,,,,,,,,,,,,,,,,,,,,,,,,,,,,,,,,,,,,,,,,,,,,,,,,2,41,2,6,1,2,1,
7/21/17 14:10,7/21/17 14:18,0,104.33.105.103,100,511,1,7/21/17 14:18,R_1KloAJVCuxApwBP,,,,,34.22869873,-118.4440994,anonymous,EN,A1A46CKE3F5JAJ,"1,2",3,6,,,,,,,,,,,,,,,,,,,,,,,,,,,,,,,,,,,,,,,,,,,,,,,,,,,algorithm are complex lines of codes needed for software or hardware to do certain given tasks. ,,,,,,,,,,,,,,,,,,,,,,,,,,,,,,,,,,,,,,,,,,,,,,,,,,,,,,,,,,,,,,,,,,,,,,,,,,,,,,,,,,,,,,,,,,,,,,,,,,,,,,,,,,,,,,,,,,,,,,,,,,,,,,,,,,,,,6,I think its fair because the algorithm will give a non biased evaluation of chris. ,4,4,4,4,4,4,"I think chris's feelings are based on his own performance, the algorithm simply analyzes the data.",6,I think that the algorithm is fully capable of analyzing the data needed.,1,1,,,,,,,,,,,,,,,,,,,,,,,,,,,,,,,,,,,,,,,,,,,,,,,,,2,24,1,5,3,1,4,
7/21/17 11:20,7/21/17 14:18,0,70.178.176.71,100,10704,1,7/21/17 14:18,R_3k4FvX2zwLJsOsm,,,,,36.16900635,-94.45639801,anonymous,EN,ANJJYKB47APL5,"1,2",3,6,,,,,,,,,,,,,,,,,,,,,,,,,,,,,,,,,,,,,,,,,,,,,,,,,,,,,,,,,,,,,,,,,,,,,,,,,,,,,,,,,,,,,,,,,,,,,,,,,,,,,,,,,,,,,,,,,,,,,,,,,,,,,,,,,,,,,,,,,,,,,,,,,,,,,,,,,,,,,,,,,,,,,,,,,,,,,,,,,,,,,,,,,,,,,,,,,,,,5,5,it's the managers job to assign someone to a task,4,4,4,3,4,4,he wouldn't have much thought on it because it's his job to be assigned a task,4,because he has that position i trust his judgement,1,,,,,,,,,,,,,,,,,,,,,,,,,,,,,,,,,,,,,2,28,1,4,3,5,1,
7/21/17 14:10,7/21/17 14:19,0,73.143.188.11,100,516,1,7/21/17 14:19,R_23erTZ5W0AOeAWg,,,,,42.56530762,-70.85780334,anonymous,EN,A2C7WH5KWEHKCS,"1,2",3,6,,,,,,,,,,,,,,,,,,,,,,,,,,,,,,,,,,,,,,,,,,,,,,,,,3,The manager would analyze calls and the algorithm would analyze customer comments.,I think algorithms are programs that have a set of rules and calculations for solving problems.,,,,,,,,,,,,,,,,,,,,,,,,,,,,,,,,,,,,,,,,,,,,,,,,,,,,,,,,,,,,,,,,,,,,,,,,,,,,,,,,,,,,,7,The fact that it incorporates both analyses from the manager and the algorithm seems like the most fair way to do it.,6,6,6,2,2,2,I think he would feel happy that he had both of these methods analyzing his performance since that is the most fair way to do it.,6,"I think if it were just the algorithm, it wouldn't be as trustworthy; but because the manager is also involved it makes it more trustworthy.",1,,,,,,,,,,,,,,,,,,,,,,,,,,,,,,,,,,,,,,,,,,,,,,,,,,,,,,,,,,,,,,,,,,,,,,,,,,,,,,,,,,,,,,,,,,,,,,,,,,1,27,2,2,1,4,4,
7/21/17 14:14,7/21/17 14:19,0,72.36.113.165,100,274,1,7/21/17 14:19,R_2901bTgHbQpwKlP,,,,,40.10949707,-88.21230316,anonymous,EN,A3ATU3VULAB7K2,"1,2",3,6,,,,,,,,,,,,,,,,,,,,,,,,,,,,,,,,,,,,,,,,,,,,,,,,,,,,,,,,,,,,,,,,,,,,,,,,,,,,,,,,,,,,,,,,,,,,,,,,,,,,,,,,,,,,,,,,,,,,,,,,,,,,,,,,,,,,,,,,,,,,,,,,,,,,,,,,,,,,,,,,,,,,,,,,,,,,,,,,,,,,,,,,,,,,,,,,,,,,5,,,,,,,,,,,,,4,"Chris has to work earlier, but Chris might have an easier time working early than others.",4,4,4,4,4,4,"Chris could see the benefits and drawbacks of working in the morning. He might have to get up early, but he could retire for the day earlier.",4,"The manager is decisive in picking a schedule in Chris, but he might have picked wrongly.",1,,,,,,,,,,,,,,,,,,,,,,,,,4,29,2,5,4,5,2,
7/21/17 14:10,7/21/17 14:19,0,198.181.11.140,100,545,1,7/21/17 14:19,R_1gzrRIPl3UM7Ciy,,,,,33.68969727,-117.8502045,anonymous,EN,A2ZC32HX99ZQXA,"1,2",3,6,,,,,,,,,,,,,,,,,,,,,,,,,,,,,,,,,,,,,,,,,,,,,,,,,1,THe algorithm does the scheduling i don't recall the manager having a role,a program that executes logic,,,,,,,,,,,,,6,ITs logical and less prone to error than a human manager,4,4,4,2,2,2,i'm not sure how logical he would be about it,6,it would be easy to program this algorithm,1,,,,,,,,,,,,,,,,,,,,,,,,,,,,,,,,,,,,,,,,,,,,,,,,,,,,,,,,,,,,,,,,,,,,,,,,,,,,,,,,,,,,,,,,,,,,,,,,,,,,,,,,,,,,,,,,,,,,,,,,,,,,,,,,,,,,,,,,,,,,,,,,,,,,,,,,,,,,,,,,,,,,,,,,,,3,40,2,5,1,3,2,
7/21/17 14:12,7/21/17 14:19,0,162.119.240.70,100,443,1,7/21/17 14:19,R_O9wXy8ekJjWm6ml,,,,,38.9671936,-76.959198,anonymous,EN,A3PUYC6APSO9E,"1,2",3,6,,,,,,,,,,,,,6,"I think it is somewhat fair because it's based on a formula that analyzes the availabilities of all the employees, and takes everyone into consideration. Also, the computer isn't playing favorites because it's just using a formula with inputted data. ",5,5,2,2,2,2,"I think Chris would feel fine about working mornings, since it would seem to work with Chris' availability (given the data inputted into the algorithm). I do not think Chris would feel angry or disappointed, or particularly enthusiastic, but simply fine about the choice. ",5,"I have a moderate amount of trust in these decisions because I think the algorithm takes everyone else's schedule and availability into account. However, I do not think the algorithm takes any personal circumstances into consideration. ",1,,,,,,,,,,,,,,,,,,,,,,,,,1,"The algorithm analyses the data of the different employees and their availabilities, and then the manager allots the schedule and assigns each employee according to that information.",I think algorithms are formulas based on specific inputs to compile data in a particular way. ,,,,,,,,,,,,,,,,,,,,,,,,,,,,,,,,,,,,,,,,,,,,,,,,,,,,,,,,,,,,,,,,,,,,,,,,,,,,,,,,,,,,,,,,,,,,,,,,,,,,,,,,,,,,,,,,,,,,,,,,,,,,,,,,,,,,,,,,,,,,,,,,,,,,,,,,,,,,,,,,,,,,,,,,,,,,,,,,,,,,,,,,,,,,,,,,,,1,32,1,3,1,2,2,
7/21/17 14:11,7/21/17 14:20,0,24.252.36.128,100,547,1,7/21/17 14:20,R_tJwaKVUd9kHXzYB,,,,,41.23899841,-95.99939728,anonymous,EN,A3JG98R2KKAYYB,"1,2",3,6,,,,,,,,,,,,,,,,,,,,,,,,,,,,,,,,,,,,,,,,,,,,,,,,,,,,,,,,,,,,,,,,,,,,,,,,,,,,,,,,,,,,,,,,,,,,,,,,,,,,,,,,,,,,,,,,,,,,,,,,,,,,,,,,,,,,,,,,,,,,,,,,,,,,,,,,,,,,,,,,,,,,,,,,,,,,,,,,,,,,,,,,,,,,,,,,,,,,5,,,,,,,,,,,,,5,so that he can check his timelines. Is Chris come in time or not.,5,4,5,4,5,4,may be his feelings might be changed due to shift,5,his shift allowances to employees.,1,,,,,,,,,,,,,,,,,,,,,,,,,2,27,2,5,4,5,2,
7/21/17 14:10,7/21/17 14:20,0,99.3.18.80,100,595,1,7/21/17 14:20,R_1jqETA21JziOOeq,,,,,41.48170471,-81.80239868,anonymous,EN,A1YX741QQSMKPS,"1,2",3,6,,,,,,,,,,,,,,,,,,,,,,,,,,,,,,,,,,,,,,,,,,,,,,,,,3,manager evaluates component importance to overall system of manufacture. Algorithm assigns rating and individual analysis to a component alone.,"series of facts or arithmetic results that follow a sequence, or show multiple sequences which are then linked to various results",,,,,,,,,,,,,,,,,,,,,,,,,,,,,,,,,,,,,,,,,,,,,,,,,7,although the algrithm has a final say in assignment or not that is a result of two different analysis one of which is an actual human anc Chris would have no say anyway.,4,1,1,3,2,4,I don't think Chris's feelings would be impacted one way or the other but his expressions of general angst might be more focused in this scenario on the machine decision,4,I know that machines can and do make very accurate predictons but as a rule am always very wary of the algorithms themselves and assigning any sort of across the board trust,1,,,,,,,,,,,,,,,,,,,,,,,,,,,,,,,,,,,,,,,,,,,,,,,,,,,,,,,,,,,,,,,,,,,,,,,,,,,,,,,,,,,,,,,,,,,,,,,,,,,,,,,,,,,,,,,,,,,,,,,,,,,,,,,,,,,,,,1,60,2,5,1,4,1,
