7/21/17 9:34,7/21/17 9:43,0,97.78.251.230,100,508,1,7/21/17 9:43,R_ufUQJt7YnSN1Y1r,,,,,35.15499878,-119.0603027,anonymous,EN,A248G7WMC2OS7F,"1,2",3,6,,,,,,,,,,,,,6,I think this a fair way to schedule since it doesn't make sense to have him come in when not needed.,6,5,5,2,2,3,I think he would want to come in when it is busy so that the day goes by faster and he is being productive.,6,I think having the data to back up the scheduling proves that it works.,1,,,,,,,,,,,,,,,,,,,,,,,,,3,The manager used the algorithm to schedule his employee.,A solution to a question based on the data that is given.,,,,,,,,,,,,,,,,,,,,,,,,,,,,,,,,,,,,,,,,,,,,,,,,,,,,,,,,,,,,,,,,,,,,,,,,,,,,,,,,,,,,,,,,,,,,,,,,,,,,,,,,,,,,,,,,,,,,,,,,,,,,,,,,,,,,,,,,,,,,,,,,,,,,,,,,,,,,,,,,,,,,,,,,,,,,,,,,,,,,,,,,,,,,,,,,,,1,44,1,2,1,2,2,
7/21/17 9:34,7/21/17 9:43,0,184.158.87.188,100,562,1,7/21/17 9:43,R_cT4ONGCQ4CUixj3,,,,,43.90649414,-90.97550201,anonymous,EN,AUNKGVA9J7GQX,"1,2",3,6,,,,,,,,,,,,,,,,,,,,,,,,,,,,,,,,,,,,,,,,,,,,,,,,,,,Algorithms are mathematical equations designed to to make decisions based on the input of a number of variables.,,,,,,,,,,,,,,,,,,,,,,,,,,,,,,,,,,,,,,,,,,,,,,,,,,,,,,,,,,,,,,,,,,,,,,,,,,,,,,,,,,,,,,,,,,,,,,,,,,,,,,,,,,,,,7,"The algorithm was ultimately developed by the owners of the coffee shop, and they are free to schedule employees as they see fit.  To the extent that the algorithm does not work properly, it could be adjusted as needed.",6,4,4,2,1,2,"If Chris has indicated availability during the time selected by the algorithm, he should be pleased that he's being scheduled according to his availability, and that there is sufficient business to warrant his work on that day.",6,"As indicated earlier, there are some very real considerations that went into the writing of the algorithm, such as determined availability of employees, and anticipated business on a given day.  If theer is a mismatch in either of these variables, and that mismatch can be determined to be consistent, than the algorithm can be adjusted.",1,,,,,,,,,,,,,,,,,,,,,,,,,1,,,,,,,,,,,,,,,,,,,,,,,,,,,,,,,,,,,,,,,,,,,,,,,,,3,50,2,6,1,1,2,
7/21/17 9:34,7/21/17 9:43,0,68.117.69.139,100,571,1,7/21/17 9:43,R_2QKRlHIRD1v5F5G,,,,,44.13079834,-94,anonymous,EN,A31Z54PHZF1JKU,"1,2",3,6,,,,,,,,,,,,,,,,,,,,,,,,,,,,,,,,,,,,,,,,,,,,,,,,,3,the manager uses the algorithm to find scan through peoples resumes. he can change the algorithm to narrow down more specific criterea.,a computer based series of criteria that is searching for specific things. it can scan a lot of information very quickly and narrow down its searches.,,,,,,,,,,,,,,,,,,,,,,,,,5,it is somewhat fair because the company is looking for certain criteria from people. but its also unfair because it doesnt give everyone an equal chance to prove themselves in an interview.,5,4,5,4,2,5,its hard to know what he is really feeling but if his resume does get approved im sure he will be happy,4,algorithms can always miss some very good canidates in my opinion,1,,,,,,,,,,,,,,,,,,,,,,,,,,,,,,,,,,,,,,,,,,,,,,,,,,,,,,,,,,,,,,,,,,,,,,,,,,,,,,,,,,,,,,,,,,,,,,,,,,,,,,,,,,,,,,,,,,,,,,,,,,,,,,,,,,,,,,,,,,,,,,,,,,,,,,,,,,,,,,1,28,2,3,1,3,3,
7/21/17 9:35,7/21/17 9:44,0,174.194.20.157,100,524,1,7/21/17 9:44,R_3kijUXyN8t5i5Dg,,,,,35.77209473,-78.63860321,anonymous,EN,A22XXEKKEV78L2,"1,2",3,6,,,,,,,,,,,,,,,,,,,,,,,,,,,,,,,,,,,,,,,,,,,,,,,,,3,"The manager adjusts the algorithm, and the algorithm analyzes the data to produce task assignments based on need for factory production.","They are, effectively, a program that accepts data, processes the data through a series of rules or calculations, and outputs data from the analysis.",6,"The algorithm uses historical data to assess the need for maintenance activities, and while the manager can adjust the rules, the algorithm will likely produce a fair task for Chris based on the data provided, as long as the manager does not enter false or biased data.",5,5,5,3,3,2,"Unless the manager is falsely adjusting the algorithm, Chris can rest easy that the assigned task is necessary for uninterrupted function of the factory equipment, and was chosen for the next task due to it's importance to continuous production.",6,"The algorithm will only analyze data available for analysis.  Provided the data is valid and accurate, one can trust the algorithm to produce quality decisions.",1,,,,,,,,,,,,,,,,,,,,,,,,,,,,,,,,,,,,,,,,,,,,,,,,,,,,,,,,,,,,,,,,,,,,,,,,,,,,,,,,,,,,,,,,,,,,,,,,,,,,,,,,,,,,,,,,,,,,,,,,,,,,,,,,,,,,,,,,,,,,,,,,,,,,,,,,,,,,,,,,,,,,,,,,,,,,,,,,,,,,,,2,36,1,5,1,3,1,
7/21/17 9:33,7/21/17 9:44,0,50.235.14.20,100,634,1,7/21/17 9:44,R_2ZBOuKCmCidchOm,,,,,41.11079407,-112.026001,anonymous,EN,A1N39UO5JDTIBH,"1,2",3,6,,,,,,,,,,,,,,,,,,,,,,,,,,,,,,,,,,,,,,,,,,,,,,,,,3,The manager puts the algorithm in place. The algorithm reports results to the manager. The manager decides performance based on results.,Specific rules that are folowed in calculations.,,,,,,,,,,,,,,,,,,,,,,,,,,,,,,,,,,,,,,,,,,,,,,,,,,,,,,,,,,,,,,,,,,,,,,,,,,,,,,,,,,,,,4,People who call into customer service usually aren't happy. Taking subjective (perhaps unfair) coments from customers and putting them into an algorithm could develop a pattern but it's hard to say that it's indicitive of the Chris's performance. ,3,2,3,5,2,6,I'd be frustrated in a situation where a questionable algorithm is deciding how well I'm doing.,2,Subjective data in an objective algorithm doesn't leave me trusting it much.,1,,,,,,,,,,,,,,,,,,,,,,,,,,,,,,,,,,,,,,,,,,,,,,,,,,,,,,,,,,,,,,,,,,,,,,,,,,,,,,,,,,,,,,,,,,,,,,,,,,1,27,2,3,1,4,4,
7/21/17 9:37,7/21/17 9:44,0,104.172.128.4,100,434,1,7/21/17 9:44,R_2ZOKnu3HANBDyYG,,,,,34.19799805,-119.1725998,anonymous,EN,A1S4RFBRB0QH1G,"1,2",3,6,,,,,,,,,,,,,,,,,,,,,,,,,,,,,,,,,,,,,,,,,,,,,,,,,,,,,,,,,,,,,,,,,,,,,,,,,,,,,,,,,,,,,,,,,,,,,,,,,,,,,,,,,,,,,,,,,,,,,,,,,,,,,,,,,,,,,,,,,,,,,,,,,,,,,,,,,,,,,,,,,,,,,,,,,,,,,,,,,,,,,,,,,,,,,,,,,,,,5,,,,,,,,,,,,,6,The manager is giving hours to Chris that are beneficial to him ,6,4,5,3,2,2,"Chris shouldn't be too upset, morning shifts are harder but a job is a job.",4,"Some managers can be jerks, if he didn't like Chris he could be giving him a bunk schedule.",1,,,,,,,,,,,,,,,,,,,,,,,,,1,28,1,3,3,5,2,
7/21/17 9:41,7/21/17 9:44,0,204.62.59.186,100,215,1,7/21/17 9:44,R_9U0XgBZ3ctMlVtL,,,,,38.23570251,-84.959198,anonymous,EN,A1PGI3MHP9JZL4,"1,2",3,6,,,,,,,,,,,,,,,,,,,,,,,,,,,,,,,,,,,,,,,,,,,,,,,,,,,process or set of rules to be followed in calculations or other problem,,,,,,,,,,,,,,,,,,,,,,,,,,,,,,,,,,,,,,,,,,,,,,,,,,,,,,,,,,,,,,,,,,,,,,,,,,,,,,,,,,,,,,,,,,,,,,,,,,,,,,,,,,,,,,,,,,,,,,,,,,,,,,,,,,,,,4,sometimes it is and sometimes its not but equals out,4,4,4,4,4,4,could go either way,1,should be more personal,1,1,,,,,,,,,,,,,,,,,,,,,,,,,,,,,,,,,,,,,,,,,,,,,,,,,1,38,2,5,1,1,4,
7/21/17 9:35,7/21/17 9:44,0,173.31.255.207,100,562,1,7/21/17 9:44,R_2ePwOTCZbZGNBE9,,,,,30.8717041,-83.33339691,anonymous,EN,A1R2IY8ITXNPE4,"1,2",3,6,,,,,,,,,,,,,,,,,,,,,,,,,,,,,,,,,,,,,,,,,,,,,,,,,,,Algorithms are different rules or sets of rules that calculate an end result from information.,,,,,,,,,,,,,,,,,,,,,,,,,,,,,,,,,,,,,,,,,,,,,,,,,,,,,,,,,,,,,,,,,,,,,,,,,,,,,,,,,,,,,,,,,,,,,,,,,,,,,,,,,,,,,,,,,,,,,,,,,,,,,,,,,,,,,5,I am sure it can have it's up and downs but I could see the justification for the company needing a way to evaluate employee performance.,3,3,4,4,2,5,I don't think he would be particularly mad or happy about the algorithm evaluation but just annoyed or frustrated at it sometimes at most.,4,I am sure the algorithm mostly evaluates information fairly well but there is no way to say that it's judgement is infallible.,1,1,,,,,,,,,,,,,,,,,,,,,,,,,,,,,,,,,,,,,,,,,,,,,,,,,1,32,1,3,1,1,4,
7/21/17 9:41,7/21/17 9:45,0,73.200.197.36,100,260,1,7/21/17 9:45,R_3Q0lYxMpFDEnkhN,,,,,38.8789978,-76.9897995,anonymous,EN,A36DDHDQ56N60C,"1,2",3,6,,,,,,,,,,,,,,,,,,,,,,,,,,,,,,,,,,,,,,,,,,,,,,,,,3,The algorithm selects candidates for the manager to interview,Algorithms are computer programs that select candidates based on pre-existing criteria,,,,,,,,,,,,,,,,,,,,,,,,,5,"Well, for a large company that can be the only practical way to weed through potentially thousands of resumes, but there is a slight unfair component in that some people may know better how to pass the algorithm checks",2,2,2,5,5,6,It's very frustrating to think that your personal responses and writings will only be evaluated for keywords by a computer instead of being read by a fellow human being.,2,Because it is a computer and therefore can't really respond well to the subtle nuances of top candidates.,1,,,,,,,,,,,,,,,,,,,,,,,,,,,,,,,,,,,,,,,,,,,,,,,,,,,,,,,,,,,,,,,,,,,,,,,,,,,,,,,,,,,,,,,,,,,,,,,,,,,,,,,,,,,,,,,,,,,,,,,,,,,,,,,,,,,,,,,,,,,,,,,,,,,,,,,,,,,,,,1,30,1,5,1,3,3,
7/21/17 9:34,7/21/17 9:46,0,73.231.19.114,100,721,1,7/21/17 9:46,R_22ExFQfS97lfnHM,,,,,34.60450745,-120.397995,anonymous,EN,A41HU62H5MR58,"1,2",3,6,,,,,,,,,,,,,,,,,,,,,,,,,,,,,,,,,,,,,,,,,,,,,,,,,3,The manager checked the machinery and inputs info and the algorithm analyzes the data to determine if the machine needs maintenance ,A computer programs to solve/fix things ,,,,,,,,,,,,,,,,,,,,,,,,,,,,,,,,,,,,,,,,,,,,,,,,,7,If it is part of Chris' job to check and work on the machinery and both the algorithm and manager say it needs maintenance then it is just part of his job and is fair.,3,3,4,2,2,2,"I don't think he would feel any negative feelings but I also don't think he'd necessarily feel any happy ones either. I would probably just feel indifferent towards the situation, unless there was some other past factors.",6,Usually they can detect things very soon.,1,,,,,,,,,,,,,,,,,,,,,,,,,,,,,,,,,,,,,,,,,,,,,,,,,,,,,,,,,,,,,,,,,,,,,,,,,,,,,,,,,,,,,,,,,,,,,,,,,,,,,,,,,,,,,,,,,,,,,,,,,,,,,,,,,,,,,,1,32,1,4,1,4,1,
7/21/17 9:42,7/21/17 9:46,0,173.217.105.151,100,219,1,7/21/17 9:46,R_12anCTSQaAWLJ7J,,,,,32.70809937,-93.2779007,anonymous,EN,A3FPXLLF0B8CIC,"1,2",3,6,,,,,,,,,,,,,,,,,,,,,,,,,,,,,,,,,,,,,,,,,,,,,,,,,3,manager also manages employees in addition to scheduling,computer progreams that follow a set of rules,,,,,,,,,,,,,,,,,,,,,,,,,,,,,,,,,,,,,,,,,,,,,,,,,,,,,,,,,,,,,6,Employee scheduling has to ensure an adequate number are on hand at a given time,5,5,6,2,2,2,He probably prefers the morning shift,6,most alorithms work well,1,,,,,,,,,,,,,,,,,,,,,,,,,,,,,,,,,,,,,,,,,,,,,,,,,,,,,,,,,,,,,,,,,,,,,,,,,,,,,,,,,,,,,,,,,,,,,,,,,,,,,,,,,,,,,,,,,,,,,,,,,,2,34,2,5,2,4,2,
7/21/17 9:39,7/21/17 9:46,0,50.5.54.60,100,403,1,7/21/17 9:46,R_p0MrzUQuv2R2jpT,,,,,39.06570435,-84.52899933,anonymous,EN,A1MJFW27HXR76D,"1,2",3,6,,,,,,,,,,,,,,,,,,,,,,,,,,,,,,,,,,,,,,,,,,,,,,,,,,,"Its just a calculator, might be mathematical or logical.  You plug in details, it'll automatically produce/calculate a result.",,,,,,,,,,,,,,,,,,,,,,,,,,,,,,,,,,,,,,,,,,,,,,,,,,,,,,,,,,,,,,,,,,,,,,,,,,,,,,,,,,,,,,,,,,,,,,,,,,,,,,,,,,,,,4,Whether a computer makes a decision or a person makes a decision doesn't make it any more or less fair and absent more information I can't say if its fair or not.,4,4,4,3,3,3,"He's available in the morning, so I doubt he will be mad he got scheduled to work in the morning, but he probably doesn't feel super happy about working: so i put mostly neutral responses.",3,"The algorithm wont play favorites, so i can trust it a little bit there, but it might not factor in other aspects.",1,,,,,,,,,,,,,,,,,,,,,,,,,1,,,,,,,,,,,,,,,,,,,,,,,,,,,,,,,,,,,,,,,,,,,,,,,,,3,29,2,3,2,1,2,
7/21/17 9:39,7/21/17 9:46,0,174.111.61.7,100,460,1,7/21/17 9:46,R_5vjrGfUKea5iSuR,,,,,36.11720276,-80.07649994,anonymous,EN,A1RW6RIF1MT2YT,"1,2",3,6,,,,,,,,,,,,,,,,,,,,,,,,,3,Computer algorithm won't see the personality traits or interaction that conversation would pick up. ,5,4,5,1,2,4,If based on the algorithm he misses the opportunity he might be upset. ,4,I am not 100% confident in computer's decision for the best candidate. ,1,,,,,,,,,,,,,3,Computer alogrithm grades the statements and resumes and manager picks the top rated candidates for the interviews.,Formulas or set of rules. ,,,,,,,,,,,,,,,,,,,,,,,,,,,,,,,,,,,,,,,,,,,,,,,,,,,,,,,,,,,,,,,,,,,,,,,,,,,,,,,,,,,,,,,,,,,,,,,,,,,,,,,,,,,,,,,,,,,,,,,,,,,,,,,,,,,,,,,,,,,,,,,,,,,,,,,,,,,,,,,,,,,,,,,,,,,,,,,,,,,,,,,,,,,,,,,,,,2,51,2,5,1,2,3,
7/21/17 9:43,7/21/17 9:46,0,24.211.155.199,100,228,1,7/21/17 9:46,R_24CRVog4KxZNv0Q,,,,,35.94999695,-78.96160126,anonymous,EN,A121XHPQ7XU0X5,"1,2",3,6,,,,,,,,,,,,,,,,,,,,,,,,,,,,,,,,,,,,,,,,,,,,,,,,,,,,,,,,,,,,,,,,,,,,,,,,,,,,,,,,,,,,,,,,,,,,,,,,,,,,,,,,,,,,,,,,,,,,,,,,,,,,,,,,,,,,,,,,,,,,,,,,,,,,,,,,,,,,,,,,,,,,,,,,,,,,,,,,,,,,,,,,,,,,,,,,,,,,5,,,,,,,,,,,,,6,"Chris provided the times he was available, assuming he put that he was available mornings, the manager has the right to schedule Chris based on the needs of the cafe. ",6,5,5,1,1,1,Chris gets to work. He is happy.,6,The manager has been given the authority to make decisions about scheduling. He should be trusted to exercise that authority. ,1,,,,,,,,,,,,,,,,,,,,,,,,,2,28,2,5,1,5,2,
7/21/17 9:41,7/21/17 9:46,0,69.40.59.58,100,312,1,7/21/17 9:46,R_2aRfMTyUdOVSUzd,,,,,38.13459778,-84.4957962,anonymous,EN,A1MTRZDRKNB9GV,"1,2",3,6,,,,,,,,,,,,,,,,,,,,,,,,,,,,,,,,,,,,,4,I think it could go either way on this depending on the customer,5,3,5,4,2,4,he could have many feeling about this and what would be going on during the analysis,5,I think he would look at it with reason and allow some things ,1,3,"the role of the manager was to analysis data , the algorithm sets up the data to go over ",things that have set up for it to check like costumers complaint s,,,,,,,,,,,,,,,,,,,,,,,,,,,,,,,,,,,,,,,,,,,,,,,,,,,,,,,,,,,,,,,,,,,,,,,,,,,,,,,,,,,,,,,,,,,,,,,,,,,,,,,,,,,,,,,,,,,,,,,,,,,,,,,,,,,,,,,,,,,,,,,,,,,,,,,,,,,,,,,,,,,,,,,,,,,,,,,,,,,,,,,,,,,,,,,,,,2,55,1,4,1,2,4,
7/21/17 9:35,7/21/17 9:48,0,69.155.109.55,100,735,1,7/21/17 9:48,R_C3LTNYfZrXD20RX,,,,,29.83230591,-95.37650299,anonymous,EN,A11J2OPH9ZX9X5,"1,2",3,6,,,,,,,,,,,,,,,,,,,,,,,,,,,,,,,,,,,,,,,,,,,,,,,,,,,,,,,,,,,,,,,,,,,,,,,,,,,,,,,,,,,,,,,,,,,,,,,,,,,,,,,,,,,,,,,,,,,,,,,,,,,,,,,,,,,,,,,,,,,,,,,,,,,,,,,,,,,,,,,,,,,,,,,,,,,,,,,,,,,,,,,,,,,,,,,,,,,,5,,,,,,,,,,,,,,,,,,,,,,,,,,,,,,,,,,,,,6,While a person is at work for a company the manager has the right to evaluate the employee at ANY time ,1,2,1,5,6,7,He would have negative feelings because he thought he was being micro managed,4,most managers judge a little too harshly and are naturally untrusting,1,3,25,2,5,2,5,4,
7/21/17 9:41,7/21/17 9:48,0,174.25.104.11,100,380,1,7/21/17 9:48,R_3GddDmdo1xUQWO1,,,,,45.62010193,-122.5774994,anonymous,EN,A1RJ5MKFHLTA9T,"1,2",3,6,,,,,,,,,,,,,,,,,,,,,,,,,,,,,,,,,,,,,,,,,,,,,,,,,1,The manager monitors and adjusts the algorithm but the algorithm has the final say in the process of scheduling.,I think algorithms are a computer program that factors in whatever information you provide it and give back the best answer based on the information provided.,,,,,,,,,,,,,6,The algorithm takes what availability Chris has and the needs of the coffee shop and figures out what hours to schedule him.  I think it is fair because it takes both Chris's needs and the coffee shop's needs and figures out the best shift for both of them.,6,6,5,3,3,3,"Chris's availability was factored into the scheduling so he should be happy.  They didn't just assign him a schedule per the coffee shop's needs, they actually listened to him.",6,It is a computer and not a person making the scheduling decision.  It isn't biased.,1,,,,,,,,,,,,,,,,,,,,,,,,,,,,,,,,,,,,,,,,,,,,,,,,,,,,,,,,,,,,,,,,,,,,,,,,,,,,,,,,,,,,,,,,,,,,,,,,,,,,,,,,,,,,,,,,,,,,,,,,,,,,,,,,,,,,,,,,,,,,,,,,,,,,,,,,,,,,,,,,,,,,,,,,,,1,38,1,3,1,3,2,
7/21/17 9:43,7/21/17 9:48,0,135.26.161.194,100,335,1,7/21/17 9:48,R_8uBR5tpbIiy1cUV,,,,,39.40840149,-88.80439758,anonymous,EN,A1RVMADIZE3BXK,"1,2",3,6,,,,,,,,,,,,,,,,,,,,,,,,,,,,,,,,,,,,,,,,,,,,,,,,,,,Algorithms are programs/trackers that determine certain outcomes in certain situations based upon what they were programmed to do.,,,,,,,,,,,,,,,,,,,,,,,,,,,,,,,,,,,,,,,,,,,,,,,,,,,,,,,,,,,,,,,,,,,,,,,,,,,,,,,,,,,,,,,,,,,,,,,,,6,The algorithm chose at random and Chris is qualified.,4,4,4,3,3,3,I think Chris would feel somewhat indifferent about the task.  It is a job that needs to be done.,5,I think the algorithm was more than likely designed to make the best decisions in each given situation.,1,,,,,,,,,,,,,,,,,,,,,,,,,,,,,,,,,,,,,1,,,,,,,,,,,,,,,,,,,,,,,,,,,,,,,,,,,,,,,,,,,,,,,,,1,33,1,4,1,1,1,
7/21/17 9:39,7/21/17 9:49,0,107.196.115.57,100,549,1,7/21/17 9:49,R_2ysDB9xOPxpwmdK,,,,,34.82009888,-86.87709808,anonymous,EN,A1ZEHBMQ2P0QRW,"1,2",3,6,,,,,,,,,,,,,,,,,,,,,,,,,,,,,,,,,,,,,,,,,,,,,,,,,1,The algorithm selects the top applicants and the manager looks through personal statements.,Computerized processes that weed through paperwork by looking for key words or phrases. ,,,,,,,,,,,,,,,,,,,,,,,,,,,,,,,,,,,,,,,,,,,,,,,,,,,,,,,,,,,,,,,,,,,,,,,,,7,It's very fair because it finds the most qualified candidates to be screened onsite. It doesn't make sense for managers to be sorting through resumes all the time that may not have people that are qualified for the jobs they are applying for. ,6,6,6,3,2,3,"As long as Chris is qualified, I don't believe he would mind this occuring and I would hope he would only want jobs in which he was qualified and would excel. ",5,I don't always trust computers and their processes 100%.,1,,,,,,,,,,,,,,,,,,,,,,,,,,,,,,,,,,,,,,,,,,,,,,,,,,,,,,,,,,,,,,,,,,,,,,,,,,,,,,,,,,,,,,,,,,,,,,,,,,,,,,,,,,,,,,2,33,1,4,1,4,3,
7/21/17 9:38,7/21/17 9:49,0,4.16.172.134,100,678,1,7/21/17 9:49,R_01wl0IVInDhazBL,,,,,45.5072937,-122.6931992,anonymous,EN,A36W7RZROOARHJ,"1,2",3,6,6,It seems unbiased.,4,4,4,4,4,4,I think Chris would feel mostly neutral.,5,I think he will stay mostly unbiased.,1,,,,,,,,,,,,,,,,,,,,,,,,,,,,,,,,,,,,,3,The manger assigned humans to monitor the components the algorithm thought would have maintenance issues.,Mathmatical formulas using multiple variables.,,,,,,,,,,,,,,,,,,,,,,,,,,,,,,,,,,,,,,,,,,,,,,,,,,,,,,,,,,,,,,,,,,,,,,,,,,,,,,,,,,,,,,,,,,,,,,,,,,,,,,,,,,,,,,,,,,,,,,,,,,,,,,,,,,,,,,,,,,,,,,,,,,,,,,,,,,,,,,,,,,,,,,,,,,,,,,,,,,,,,,,,,,,,,,,,,,1,37,2,5,1,2,1,
7/21/17 9:37,7/21/17 9:50,0,162.225.152.241,100,772,1,7/21/17 9:50,R_3gNwBLvUpWCoJv6,,,,,38.8125,-90.35009766,anonymous,EN,A24U7XTFENX96C,"1,2",3,6,,,,,,,,,,,,,,,,,,,,,,,,,,,,,,,,,,,,,,,,,,,,,,,,,3,"The manager analyzed the personal statement, while the algorithm chose the top applicants from their resumes. From there on-site interviews were scheduled.",A computer program that analyzes information using specific keywords.,,,,,,,,,,,,,,,,,,,,,,,,,,,,,,,,,,,,,,,,,,,,,,,,,,,,,,,,,,,,,,,,,,,,,,,,,5,"It seems fair to use an algorithm to find people that meet specific qualifications. However, not giving the whole resume consideration seems slightly unfair. The algorithm cannot take in everything that a human can.",3,3,3,4,3,4,"I don't think Chris would have any positive feelings about this process, but I don't think he'd feel strongly negative ones either. ",3,"As I noted before, simply flagging keywords can result in a good candidate falling through the cracks.",1,,,,,,,,,,,,,,,,,,,,,,,,,,,,,,,,,,,,,,,,,,,,,,,,,,,,,,,,,,,,,,,,,,,,,,,,,,,,,,,,,,,,,,,,,,,,,,,,,,,,,,,,,,,,,,1,38,1,5,1,4,3,
7/21/17 9:34,7/21/17 9:50,0,184.155.9.64,100,1002,1,7/21/17 9:50,R_2woFhNZ2wiIJOwH,,,,,30.4730072,-89.1493988,anonymous,EN,A3UPZ88FI1EJC,"1,2",3,6,,,,,,,,,,,,,,,,,,,,,,,,,,,,,,,,,,,,,,,,,,,,,,,,,3,The algorithm chose the hours and times the employees would work based on the information it has.The manager's role was to pay attention to the amount of customers each day so the algorithm could create his schedule.,Computer programs made up of a specific set of information used to solve problems.,,,,,,,,,,,,,,,,,,,,,,,,,,,,,,,,,,,,,,,,,,,,,,,,,,,,,,,,,,,,,6,"If the algorithm is efficient, then I do not see how it could be unfair at all.",5,4,4,3,3,3,"I have no reason to believe why he would feel frustrated, or upset about anything. I can see how he would be somewhat happy, but not quite joyful and proud.",5,"Again, I have no reason to believe the alogrithm does not do a good job, or I would assume the coffee shop would no longer be using it.",1,,,,,,,,,,,,,,,,,,,,,,,,,,,,,,,,,,,,,,,,,,,,,,,,,,,,,,,,,,,,,,,,,,,,,,,,,,,,,,,,,,,,,,,,,,,,,,,,,,,,,,,,,,,,,,,,,,,,,,,,,,1,29,1,4,1,4,2,
7/21/17 9:34,7/21/17 9:51,0,173.217.6.56,100,1005,1,7/21/17 9:51,R_2aetNQZvx7kv7Qo,,,,,32.56950378,-93.69229889,anonymous,EN,A30RAYNDOWQ61S,"1,2",3,6,,,,,,,,,,,,,,,,,,,,,,,,,,,,,,,,,,,,,,,,,,,,,,,,,3,The manager gave input and the algorithm made the final quality task assignments.,a set of rules that govern an operation or function.,,,,,,,,,,,,,,,,,,,,,,,,,,,,,,,,,,,,,,,,,,,,,,,,,6,It seems fair based on best practices for the factory to use the algorithm to assign the task. The algorithm may be less prone to human error or bias.,5,4,4,3,2,2,"His feelings would be positive, having a job to do and believing the assignment of the task was well made.",6,"I trust that the many decisions made by humans programming the algorithm resulted in a product that has the expertise and understanding, combined with the manager's input, to make the best decision on task assignments.",1,,,,,,,,,,,,,,,,,,,,,,,,,,,,,,,,,,,,,,,,,,,,,,,,,,,,,,,,,,,,,,,,,,,,,,,,,,,,,,,,,,,,,,,,,,,,,,,,,,,,,,,,,,,,,,,,,,,,,,,,,,,,,,,,,,,,,,1,54,2,3,1,4,1,
7/21/17 9:44,7/21/17 9:52,0,24.90.180.91,100,486,1,7/21/17 9:52,R_1r0qRV8eAHgX5qM,,,,,40.76539612,-73.81739807,anonymous,EN,A1CE2XPYCDRHVZ,"1,2",3,6,,,,,,,,,,,,,,,,,,,,,,,,,,,,,,,,,,,,,,,,,,,,,,,,,3,The algorithm gathers data and evaluates the output; the manager evaluates the algorithm.,programs that evaluate data,,,,,,,,,,,,,,,,,,,,,,,,,,,,,,,,,,,,,5,Much of Chris's job involves working with computers and their output either exists or it doesn't.  Technical evaluations are fait.,5,3,4,5,2,5,"He might be pleased overall, but have identified some computer glitches that hold him back.",5,It is largely objective but doesn't account for crashing or other glitches.,1,,,,,,,,,,,,,,,,,,,,,,,,,,,,,,,,,,,,,,,,,,,,,,,,,,,,,,,,,,,,,,,,,,,,,,,,,,,,,,,,,,,,,,,,,,,,,,,,,,,,,,,,,,,,,,,,,,,,,,,,,,,,,,,,,,,,,,,,,,,,,,,,,,2,41,1,5,1,3,4,
7/21/17 9:50,7/21/17 9:54,0,98.215.140.99,100,267,1,7/21/17 9:54,R_1gOdRB1B2w7nSFI,,,,,40.9420929,-90.37799835,anonymous,EN,ALM8YFO0272UR,"1,2",3,6,,,,,,,,,,,,,,,,,,,,,,,,,,,,,,,,,,,,,,,,,,,,,,,,,3,The manager reviewed past call recording while the algorithm reviewed customer comments to evaluate the worker,Mathematical functions used to perform a task,,,,,,,,,,,,,,,,,,,,,,,,,,,,,,,,,,,,,,,,,,,,,,,,,,,,,,,,,,,,,,,,,,,,,,,,,,,,,,,,,,,,,6,If it was just the algorithm it wouldn't be fair but since the manager is doing part as well then it seems ok.,4,3,4,4,5,5,He might be a little upset that something not human is evaluating him,5,If the company uses it it must work somewhat well,1,,,,,,,,,,,,,,,,,,,,,,,,,,,,,,,,,,,,,,,,,,,,,,,,,,,,,,,,,,,,,,,,,,,,,,,,,,,,,,,,,,,,,,,,,,,,,,,,,,1,20,2,4,1,4,4,
7/21/17 9:42,7/21/17 9:55,0,173.171.47.111,100,766,1,7/21/17 9:55,R_vYzpMeZSke1JnRT,,,,,27.90029907,-82.30239868,anonymous,EN,A3IBAQLCOPU6BH,"1,2",3,6,,,,,,,,,,,,,,,,,,,,,,,,,,,,,,,,,,,,,5,It somewhat fair because the manager is analyzing the results before coming to an conclusion. ,3,3,3,5,5,6,I think Chris would be annoyed because there are many factors to explained a customer tone that Chris has no control over.,4,It hard come to a conslution with out more details but hopefully the manager understand all the factors when evaluating tone. ,1,3,The algorithm judge the calls and comments and the manager uses that to evaluate Chris. ,a process to sort and label things. ,,,,,,,,,,,,,,,,,,,,,,,,,,,,,,,,,,,,,,,,,,,,,,,,,,,,,,,,,,,,,,,,,,,,,,,,,,,,,,,,,,,,,,,,,,,,,,,,,,,,,,,,,,,,,,,,,,,,,,,,,,,,,,,,,,,,,,,,,,,,,,,,,,,,,,,,,,,,,,,,,,,,,,,,,,,,,,,,,,,,,,,,,,,,,,,,,,3,33,1,5,1,2,4,
7/21/17 9:54,7/21/17 9:58,0,67.246.238.76,100,269,1,7/21/17 9:58,R_26mqFmOIY1emkaE,,,,,43.14120483,-77.63279724,anonymous,EN,A3MBYCF9YZGFKD,"1,2",3,6,,,,,,,,,,,,,,,,,,,,,,,,,6,"He didn't target chris personally, as long as the algorithm targets characteristics that are legal then there is no problem.",2,2,2,4,4,4,He didn't get a interview and that happens. It'll make him sad and then he'll keep trying. If he got a interview and then had a computer decide I think he'd feel helpless.,5,I don't have a problem with it,1,,,,,,,,,,,,,3,The managers job was to listen to the algorithms decisions.,Algorithms are a set of rules designed to accomplish a task repeatedly ,,,,,,,,,,,,,,,,,,,,,,,,,,,,,,,,,,,,,,,,,,,,,,,,,,,,,,,,,,,,,,,,,,,,,,,,,,,,,,,,,,,,,,,,,,,,,,,,,,,,,,,,,,,,,,,,,,,,,,,,,,,,,,,,,,,,,,,,,,,,,,,,,,,,,,,,,,,,,,,,,,,,,,,,,,,,,,,,,,,,,,,,,,,,,,,,,,2,31,2,3,2,2,3,
7/21/17 9:56,7/21/17 10:00,0,99.17.45.160,100,249,1,7/21/17 10:00,R_3L10MAEhKXCUPdd,,,,,35.23300171,-97.41220093,anonymous,EN,A30YUB0WTMKX73,"1,2",3,6,,,,,,,,,,,,,,,,,,,,,,,,,,,,,,,,,,,,,,,,,,,,,,,,,3,Both the manager and algorithm evaluated Chris' responses and his performance.,I think that algorithms are specific sets of instructions carried out by a computer.,,,,,,,,,,,,,,,,,,,,,,,,,,,,,,,,,,,,,,,,,,,,,,,,,,,,,,,,,,,,,,,,,,,,,,,,,,,,,,,,,,,,,1,I don't think an algorithm can accurately evaluate a human response or human performance.,1,1,1,7,7,7,I think that Chris would find it to be extremely frustrating that an algorithm was evaluating his performance.,1,"As I said above, I don't feel that a computer algorithm could accurately evaluate human performance.",1,,,,,,,,,,,,,,,,,,,,,,,,,,,,,,,,,,,,,,,,,,,,,,,,,,,,,,,,,,,,,,,,,,,,,,,,,,,,,,,,,,,,,,,,,,,,,,,,,,3,27,2,5,1,4,4,
