8/2/17 12:15,8/2/17 12:20,0,96.39.214.219,100,301,1,8/2/17 12:20,R_1pDORcjdazQg49R,,,,,32.47590637,-97.72329712,anonymous,EN,A1LK6QRCHJQGAE,"1,2",3,6,,,,,,,,,,,,,,,,,,,,,,,,,,,,,,,,,,,,,,,,,,,,,,,,,3,The algorithm looks at the traffic the shop sees and the employee availabilty along with the manager to decide the schedule of the employees,A equation designed to help determing things.,,,,,,,,,,,,,,,,,,,,,,,,,,,,,,,,,,,,,,,,,,,,,,,,,,,,,,,,,,,,,6,"There isn't any sort of bias in the assignment, it's simply based off numbers and observations.",4,4,4,4,4,4,It's a fair shift and I don't see any reason to feel much of anything about it.,5,"It's just a machine looking at numbers, so it can make mistakes, but having a person involved as well helps balance both sides.",1,,,,,,,,,,,,,,,,,,,,,,,,,,,,,,,,,,,,,,,,,,,,,,,,,,,,,,,,,,,,,,,,,,,,,,,,,,,,,,,,,,,,,,,,,,,,,,,,,,,,,,,,,,,,,,,,,,,,,,,,,,2,37,2,3,1,4,2,
8/2/17 12:15,8/2/17 12:20,0,170.146.220.21,100,315,1,8/2/17 12:20,R_3oz8tpKqrSIpd3L,,,,,33.74899292,-84.38800049,anonymous,EN,A32LNVRHDOWZNU,"1,2",3,6,,,,,,,,,,,,,,,,,,,,,,,,,,,,,,,,,,,,,,,,,,,,,,,,,3,the manager applied the rules to the algorithm in the selection process for the top candidates,criteria set to a list a rules run by computer,,,,,,,,,,,,,,,,,,,,,,,,,5,the algorithm used would easily parse out lower qualified candidates,4,4,4,4,4,4,I don't feel he would necessarily feel any of these emotions,5,there can always be errors or prejudice applied,1,,,,,,,,,,,,,,,,,,,,,,,,,,,,,,,,,,,,,,,,,,,,,,,,,,,,,,,,,,,,,,,,,,,,,,,,,,,,,,,,,,,,,,,,,,,,,,,,,,,,,,,,,,,,,,,,,,,,,,,,,,,,,,,,,,,,,,,,,,,,,,,,,,,,,,,,,,,,,,1,52,1,6,1,3,3,
8/2/17 12:16,8/2/17 12:20,0,98.176.102.40,100,271,1,8/2/17 12:20,R_PtegQYUtltuYEDv,,,,,33.15649414,-117.1707001,anonymous,EN,A2CWJRAEFZ44HU,"1,2",3,6,,,,,,,,,,,,,,,,,,,,,,,,,,,,,,,,,,,,,,,,,,,,,,,,,,,rules that a computer follows in order to calculate certain things,,,,,,,,,,,,,,,,,,,,,,,,,,,,,,,,,,,,,,,,,,,,,,,,,,,,,,,,,,,,,,,,,,,,,,,,,,,,,,,,,,,,,,,,,,,,,,,,,6,I suppose if the algorithm is properly calibrated than it is offering an unbiased assignment,4,4,4,2,2,2,"it's just a job, Chris just wants to do it, fix the parts and clock out",6,without more information i'm assuming the algorithm has been working fine so far,1,,,,,,,,,,,,,,,,,,,,,,,,,,,,,,,,,,,,,1,,,,,,,,,,,,,,,,,,,,,,,,,,,,,,,,,,,,,,,,,,,,,,,,,1,33,2,3,3,1,1,
8/2/17 12:15,8/2/17 12:20,0,71.192.121.179,100,305,1,8/2/17 12:20,R_ujGYamhYcAdktxL,,,,,42.12289429,-72.51080322,anonymous,EN,A9ZS3JB9F24V4,"1,2",3,6,,,,,,,,,,,,,,,,,,,,,,,,,,,,,,,,,,,,,,,,,,,,,,,,,,,"I think algorithms are a series of mathematical equations performed by a computer to come to a specific outcome: in this case, an algorithm would run through a computer determining when employees should be scheduled and at what times.",,,,,,,,,,,,,,,,,,,,,,,,,,,,,,,,,,,,,,,,,,,,,,,,,,,,,,,,,,,,,,,,,,,,,,,,,,,,,,,,,,,,,,,,,,,,,,,,,,,,,,,,,,,,,2,"I think that it's unfair to have an algorithm schedule anyone's shift, and in Chris's case his hours could get cut drastically because of some non-human algorithm, and it wouldn't be fair if his schedule were to change completely due to a possible error.",1,2,2,6,7,6,"I think CHris would be angry, disappointed, and frustrated that an algorithm was scheduling his shift schedule instead of an actual person. His schedule could be inadvertently changed at any time without someone to talk to about it because it's ""all in the algorithm,"" so I think that he would be extremely frustrated with having this method decide when he's allowed to work.",4,"While I think that the algorithm has some trust in it, and that it does have a good way of determining basic numbers, the amount of customers in a place like a coffee shop can always change at any given time; and using technology to come to a determination about scheduling leads to less trust because there are human factors (people calling out or getting sick, last-minute changes) that the algorithm cannot account for, and so an employer should still be making the scheduling decisions.",1,,,,,,,,,,,,,,,,,,,,,,,,,1,,,,,,,,,,,,,,,,,,,,,,,,,,,,,,,,,,,,,,,,,,,,,,,,,2,25,1,5,1,1,2,
8/2/17 12:16,8/2/17 12:20,0,24.140.139.177,100,266,1,8/2/17 12:20,R_28MUKPEc6YhACTH,,,,,40.81820679,-81.4917984,anonymous,EN,35NVL86J33,"1,2",3,6,,,,,,,,,,,,,,,,,,,,,,,,,,,,,,,,,,,,,,,,,,,,,,,,,3,The manager would review the calls  and the algorithm would review the calls as well.,A set of rules that are applied to something to come up with an outcome for every input provided.,,,,,,,,,,,,,,,,,,,,,,,,,,,,,,,,,,,,,,,,,,,,,,,,,,,,,,,,,,,,,,,,,,,,,,,,,,,,,,,,,,,,,2,Algorithms can make mistakes.,3,2,4,5,6,6,It would make him upset knowing he is being reviewed by a computer.,1,Its not easy to judge voice tone and what transpired during the call by a computer.,1,,,,,,,,,,,,,,,,,,,,,,,,,,,,,,,,,,,,,,,,,,,,,,,,,,,,,,,,,,,,,,,,,,,,,,,,,,,,,,,,,,,,,,,,,,,,,,,,,,2,29,2,4,1,4,4,
8/2/17 12:18,8/2/17 12:20,0,98.219.195.235,100,170,1,8/2/17 12:20,R_2CUsW5ANEOO32Id,,,,,40.6421051,-79.94450378,anonymous,EN,A1YILFU07P6DND,"1,2",3,6,6,It makes it so everyone has an equal chance,4,4,4,4,4,4,Depends if he wanted to or not,4,Don't know him so can't really tell,1,,,,,,,,,,,,,,,,,,,,,,,,,,,,,,,,,,,,,3,Manager selected the algorithm to pick the person,A random process that generates an outcome,,,,,,,,,,,,,,,,,,,,,,,,,,,,,,,,,,,,,,,,,,,,,,,,,,,,,,,,,,,,,,,,,,,,,,,,,,,,,,,,,,,,,,,,,,,,,,,,,,,,,,,,,,,,,,,,,,,,,,,,,,,,,,,,,,,,,,,,,,,,,,,,,,,,,,,,,,,,,,,,,,,,,,,,,,,,,,,,,,,,,,,,,,,,,,,,,,2,24,2,5,1,2,1,
8/2/17 12:15,8/2/17 12:20,0,72.235.11.248,100,335,1,8/2/17 12:20,R_117yvfVERqcCe9n,,,,,21.37750244,-158.0861969,anonymous,EN,A1FKZ2HY4XKMG1,"1,2",3,6,,,,,,,,,,,,,,,,,,,,,,,,,,,,,,,,,,,,,,,,,,,,,,,,,,,,,,,,,,,,,,,,,,,,,,,,,,,,,,,,,,,,,,,,,,,,,,,,,,,,,,,,,,,,,,,,,,,,,,,,,,,,,,,,,,,,,,,,,,,,,,,,,,,,,,,,,,,,,,,,,,,,,,,,,,,,,,,,,,,,,,,,,,,,,,,,,,,,5,6,He is just doing his job,4,4,4,4,4,4,someone has to do the work,6,I dont see why he wouldnt make good decisions,1,,,,,,,,,,,,,,,,,,,,,,,,,,,,,,,,,,,,,1,29,1,5,4,5,1,
8/2/17 12:15,8/2/17 12:21,0,24.38.239.172,100,359,1,8/2/17 12:21,R_XIlWrdoTTwVVi8h,,,,,41.1882019,-73.18029785,anonymous,EN,A2R0Y8A3SSZ30S,"1,2",3,6,,,,,,,,,,,,,,,,,,,,,,,,,,,,,,,,,,,,,,,,,,,,,,,,,,,something that is programmed and designed to select certain words and phrases and judge an applicants worth based on those things,,,,,,,,,,,,,,,,,,,,,,,,,,,,,,,,,,,,,,,,,,,,,,,,,,,,,,,,,,,,,,,,,,,,,,,,,,,,,,,,,,,,,,,,,,,,,,,,,,,,,,,,,,,,,,,,,,,,,,,,,3,algorithms are designed to be accurate but they can't always pick up on the nuances of individual submissions,5,4,5,4,3,6,"His feelings would really depend on whether he was selected or not, but I think he would be a bit frustrated that the algorithm was deciding the top applicants instead of an actual human.",3,"I don't trust an algorithm over a human, but I think it would do an ok job.",1,,,,,,,,,,,,,1,,,,,,,,,,,,,,,,,,,,,,,,,,,,,,,,,,,,,,,,,,,,,,,,,1,30,1,5,1,1,3,
8/2/17 12:15,8/2/17 12:21,0,99.94.131.21,100,352,1,8/2/17 12:21,R_2XbcRZL4iztuk8o,,,,,34.94889832,-89.96649933,anonymous,EN,A3T4KZG7UPS8EI,"1,2",3,6,,,,,,,,,,,,,,,,,,,,,,,,,6,"If there are a lot of applicants, the use of the algorithm would help streamline the process.",4,4,4,5,2,5,Chris might be a bit disappointed that a human was not evaluating all of the applications.,5,I do not think algorithms are fool proof.,1,,,,,,,,,,,,,3,The algorithm analyzed all applicants and their resumes and gave the manager the best of the applicants. The manager then chooses one from the top 10 given.,Computer processes that analyze data. ,,,,,,,,,,,,,,,,,,,,,,,,,,,,,,,,,,,,,,,,,,,,,,,,,,,,,,,,,,,,,,,,,,,,,,,,,,,,,,,,,,,,,,,,,,,,,,,,,,,,,,,,,,,,,,,,,,,,,,,,,,,,,,,,,,,,,,,,,,,,,,,,,,,,,,,,,,,,,,,,,,,,,,,,,,,,,,,,,,,,,,,,,,,,,,,,,,2,46,1,3,1,2,3,
8/2/17 12:17,8/2/17 12:21,0,70.171.70.106,100,233,1,8/2/17 12:21,R_1I3CkHCfHiw85in,,,,,30.00379944,-90.2141037,anonymous,EN,A1WNXEXREXUZPZ,"1,2",3,6,,,,,,,,,,,,,,,,,,,,,,,,,,,,,,,,,,,,,,,,,,,,,,,,,,,A process of rules to be followed in calculation of a problem,,,,,,,,,,,,,,,,,,,,,,,,,,,,,,,,,,,,,,,,,,,,,,,,,,,,,,,,,,,,,,,,,,,,,,,,,,,,,,,,,,,,,,,,,,,,,,,,,,,,,,,,,,,,,,,,,,,,,,,,,,,,,,,,,,,,,4,I don't have nearly enough information to comment on the validity of the algorithm.,5,5,5,4,5,5,"It would all depend on what the results were. If it goes well for him, I'd imagine he would be happy, if not, he wouldn't",4,"Again, I don't have enough information. But I've had decent experience with algorithms in the past",1,1,,,,,,,,,,,,,,,,,,,,,,,,,,,,,,,,,,,,,,,,,,,,,,,,,1,31,2,5,1,1,4,
8/2/17 12:15,8/2/17 12:21,0,167.102.56.138,100,364,1,8/2/17 12:21,R_0GqH1WR2ya8DXwt,,,,,39.61720276,-75.86779785,anonymous,EN,A22HYDD0CJ9ZF2,"1,2",3,6,,,,,,,,,,,,,,,,,,,,,,,,,,,,,,,,,,,,,,,,,,,,,,,,,3,"The algorithm figures out how often things break down and the manager adjusts how the algorithm comes to a decision. The algorithm will chose a random person to check on the machines while the manager makes sure that the part is truly important to being checked, the algorithm makes the final descision on who does the work. ","They are systems in place to determine if something needs to be fixed, while the manager double checks and approves the algorithms theory. ",6,"It seems completely fair that Chris was chosen. It also seems like a good fit considering he works in the manufacturing factory, so he probably knows what to do already. ",5,5,6,2,2,3,I tihnk he would be happy work on the maintenance as it is something that he is familiar with. ,4,I think it is completely random and it could chose someone who isn't best suited for the task. ,1,,,,,,,,,,,,,,,,,,,,,,,,,,,,,,,,,,,,,,,,,,,,,,,,,,,,,,,,,,,,,,,,,,,,,,,,,,,,,,,,,,,,,,,,,,,,,,,,,,,,,,,,,,,,,,,,,,,,,,,,,,,,,,,,,,,,,,,,,,,,,,,,,,,,,,,,,,,,,,,,,,,,,,,,,,,,,,,,,,,,,,1,22,1,4,1,3,1,
8/2/17 12:14,8/2/17 12:21,0,73.204.157.144,100,395,1,8/2/17 12:21,R_3HFxYXCLwuApdNL,,,,,25.60319519,-80.33470154,anonymous,EN,A1HP506HGINWSV,"1,2",3,6,,,,,,,,,,,,,,,,,,,,,,,,,,,,,,,,,,,,,,,,,,,,,,,,,,,,,,,,,,,,,,,,,,,,,,,,,,,,,,,,,,,,,,,,,,,,,,,,,,,,,,,,,,,,,,,,,,,,,,,,,,,,,,,,,,,,,,,,,,,,,,,,,,,,,,,,,,,,,,,,,,,,,,,,,,,,,,,,,,,,,,,,,,,,,,,,,,,,5,,,,,,,,,,,,,7,The managers responsibility is to make sure that there are enough employees for every shift. He is just doing his duty when scheduling Chris to work mornings. ,6,6,4,2,2,2,Chris knows the opening hours of coffee shop. I think he would be happy working any of the shifts.,6,"If he wouldn't make good decisions, then he probably would be fired. He was given the job of a manager, so he must be competent to do it.",1,,,,,,,,,,,,,,,,,,,,,,,,,1,56,1,4,1,5,2,
8/2/17 12:15,8/2/17 12:21,0,70.112.101.54,100,372,1,8/2/17 12:21,R_1hBeTyweNvw69G9,,,,,29.98930359,-97.85720062,anonymous,EN,A3ICC7SGEF40KR,"1,2",3,6,,,,,,,,,,,,,,,,,,,,,,,,,,,,,,,,,,,,,,,,,,,,,,,,,,,Program to assign when to check the components and such. Uses past information,,,,,,,,,,,,,,,,,,,,,,,,,,,,,,,,,,,,,,,,,,,,,,,,,,,,,,,,,,,,,,,,,,,,,,,,,,,,,,,,,,,,,,,,,,,,,,,,,6,the algorithm makes it easier to check the components.,4,4,4,3,3,3,"it's a program for him to work efficiently, he does not have to have feelings for it. ",5,if the program is well made I don't see any problem with its decisions.,1,,,,,,,,,,,,,,,,,,,,,,,,,,,,,,,,,,,,,1,,,,,,,,,,,,,,,,,,,,,,,,,,,,,,,,,,,,,,,,,,,,,,,,,1,29,1,5,4,1,1,
8/2/17 12:15,8/2/17 12:21,0,98.127.92.16,100,355,1,8/2/17 12:21,R_8BVGP5Cw4ZPLjgd,,,,,41.33859253,-105.860199,anonymous,EN,AIYJ5S5A9OR2I,"1,2",3,6,6,If the machine says it needs to be fixed then it makes sense he said fix it. ,4,4,4,2,2,3,He shouldn't be angry or upset becaues this is his job.,5,He seems to know what he is doing so I would trust his rule. ,2,,,,,,,,,,,,,,,,,,,,,,,,,,,,,,,,,,,,,3,The algorithm says whether something needs fixed or not and the manager assigns the employee to fix it. ,I system that can detect if something needs fixed or is working properly. ,,,,,,,,,,,,,,,,,,,,,,,,,,,,,,,,,,,,,,,,,,,,,,,,,,,,,,,,,,,,,,,,,,,,,,,,,,,,,,,,,,,,,,,,,,,,,,,,,,,,,,,,,,,,,,,,,,,,,,,,,,,,,,,,,,,,,,,,,,,,,,,,,,,,,,,,,,,,,,,,,,,,,,,,,,,,,,,,,,,,,,,,,,,,,,,,,,1,26,1,5,1,2,1,
8/2/17 12:15,8/2/17 12:21,0,173.63.161.174,100,390,1,8/2/17 12:21,R_3paRwKrXFygUlOU,,,,,41.00990295,-74.00730133,anonymous,EN,A97VUS7WA0E70,"1,2",3,6,,,,,,,,,,,,,,,,,,,,,,,,,,,,,,,,,,,,,,,,,,,,,,,,,3,The manager would review the personal statements and the algorithm made the pick for people to come in for interviews.,a process a computer follows to produce a wanted result.,,,,,,,,,,,,,,,,,,,,,,,,,,,,,,,,,,,,,,,,,,,,,,,,,,,,,,,,,,,,,,,,,,,,,,,,,6,"The algorithm (probably) isn't randomly picking candidates, it is choosing based on a certain set of criteria that the company is looking for.  If anything, it is saving Chris time if he doesn't qualify.",4,4,5,5,4,2,"I'm assuming he would generally feel more positive if he was considered one of the top applicants, and more disappointed if he wasn't.",5,"Both the computer and manager put in their input, so it isn't all just one opinion.",1,,,,,,,,,,,,,,,,,,,,,,,,,,,,,,,,,,,,,,,,,,,,,,,,,,,,,,,,,,,,,,,,,,,,,,,,,,,,,,,,,,,,,,,,,,,,,,,,,,,,,,,,,,,,,,1,18,2,1,1,4,3,
8/2/17 12:16,8/2/17 12:21,0,104.156.124.49,100,279,1,8/2/17 12:21,R_3NKzAIgTH3EeQNk,,,,,37.48789978,-82.49559784,anonymous,EN,A1OQIXAU1SEJ4P,"1,2",3,6,,,,,,,,,,,,,,,,,,,,,,,,,,,,,,,,,,,,,,,,,,,,,,,,,,,,,,,,,,,,,,,,,,,,,,,,,,,,,,,,,,,,,,,,,,,,,,,,,,,,,,,,,,,,,,,,,,,,,,,,,,,,,,,,,,,,,,,,,,,,,,,,,,,,,,,,,,,,,,,,,,,,,,,,,,,,,,,,,,,,,,,,,,,,,,,,,,,,5,,,,,,,,,,,,,,,,,,,,,,,,,,,,,,,,,,,,,6,It's fair because that's the job of the manager. The manager has to evaluate the employees' performances.,3,3,3,3,2,3,I don't think Chris would feel any of these specific feelings about the evaluation. ,5,I have no reason to doubt the evaluations of the manager. ,1,1,30,1,4,1,5,4,
8/2/17 12:15,8/2/17 12:21,0,70.188.200.68,100,376,1,8/2/17 12:21,R_1gUx9sa8aovD14Y,,,,,33.71640015,-112.1746979,anonymous,EN,A1KAIOBTXQ77A6,"1,2",3,6,,,,,,,,,,,,,5,I think the algorithm will do what is best for the company by scheduling the right amount of people. ,6,5,6,3,1,1,I think he would be positive because it is convenient for him. ,6,It goes based off of consumer needs so it is helpful in designating correct times. ,1,,,,,,,,,,,,,,,,,,,,,,,,,1,The algorithm determines how many people to schedule and the manager schedules accordingly ,numerical systems,,,,,,,,,,,,,,,,,,,,,,,,,,,,,,,,,,,,,,,,,,,,,,,,,,,,,,,,,,,,,,,,,,,,,,,,,,,,,,,,,,,,,,,,,,,,,,,,,,,,,,,,,,,,,,,,,,,,,,,,,,,,,,,,,,,,,,,,,,,,,,,,,,,,,,,,,,,,,,,,,,,,,,,,,,,,,,,,,,,,,,,,,,,,,,,,,,1,27,1,5,3,2,2,
8/2/17 12:15,8/2/17 12:21,0,24.255.44.26,100,402,1,8/2/17 12:21,R_3kNfnClOxMv0Ykd,,,,,33.66690063,-112.1856995,anonymous,EN,AI4AO0O0WIJF7,"1,2",3,6,,,,,,,,,,,,,,,,,,,,,,,,,,,,,,,,,,,,,,,,,,,,,,,,,3,"The manager know what is most important to keep everything running, and the algorithm keeps track of how often all the components start to get worn.",Computer programs that take all the information and decide what would be best to do next.,,,,,,,,,,,,,,,,,,,,,,,,,,,,,,,,,,,,,,,,,,,,,,,,,6,"The manager and the algorithm are working together to make sure there's no breakdowns, and it's his job to maintain the parts that are probably getting worn.",5,4,4,3,3,2,"He shouldn't be upset by what he's being sent to do, because it is time to work on that particular part.",5,The computer can decide faster than people can and will be able to better monitor everything.,1,,,,,,,,,,,,,,,,,,,,,,,,,,,,,,,,,,,,,,,,,,,,,,,,,,,,,,,,,,,,,,,,,,,,,,,,,,,,,,,,,,,,,,,,,,,,,,,,,,,,,,,,,,,,,,,,,,,,,,,,,,,,,,,,,,,,,,1,42,1,2,1,4,1,
8/2/17 12:15,8/2/17 12:21,0,47.33.193.124,100,403,1,8/2/17 12:21,R_20VGDDAksgEvStY,,,,,43.04429626,-83.51920319,anonymous,EN,A1QA5EWFMNKGTA,"1,2",3,6,7,The computer is calculating the level of importance on which item should be maintained first. How isn't it fair?,4,4,4,1,1,1,I don't know why he'd feel negatively about this. It's prioritizing everything for him.,7,"If you program the computer right, it should be very accurate very often.",1,,,,,,,,,,,,,,,,,,,,,,,,,,,,,,,,,,,,,3,The manager has the algorithm prioritizing maintenance for Chris. I don't know how this could be a bad thing.,"It's a program that takes all the information plugged in about something, and casts it's predictions on what will happen based on what info was given.",,,,,,,,,,,,,,,,,,,,,,,,,,,,,,,,,,,,,,,,,,,,,,,,,,,,,,,,,,,,,,,,,,,,,,,,,,,,,,,,,,,,,,,,,,,,,,,,,,,,,,,,,,,,,,,,,,,,,,,,,,,,,,,,,,,,,,,,,,,,,,,,,,,,,,,,,,,,,,,,,,,,,,,,,,,,,,,,,,,,,,,,,,,,,,,,,,1,33,2,5,1,2,1,
8/2/17 12:15,8/2/17 12:22,0,75.99.158.2,100,374,1,8/2/17 12:22,R_2ROI6kzmusW4ab6,,,,,40.91679382,-74.63700104,anonymous,EN,A178P5C2JJ4A32,"1,2",3,6,,,,,,,,,,,,,,,,,,,,,,,,,,,,,,,,,,,,,,,,,,,,,,,,,,,It's a set of operations that are to be performed.,,,,,,,,,,,,,,,,,,,,,,,,,,,,,,,,,,,,,,,,,,,,,,,,,,,,,,,,,,,,,,,,,,,,,,,,,,,,,,,,,,,,,,,,,,,,,,,,,,,,,,,,,,,,,,,,,,,,,,,,,5,It's somewhat fair because it can quickly sift through the resumes vs the time it would take for a person.,3,3,3,7,5,6,I'm assuming Chris' resume was not part of the top applicants so he most definitely feels disappointed because it's like he never even got a chance.,4,"I trust that the algorithm would definitely pick out key words and such within the resumes, but people can easily butter themselves up but not be qualified.",1,,,,,,,,,,,,,1,,,,,,,,,,,,,,,,,,,,,,,,,,,,,,,,,,,,,,,,,,,,,,,,,2,31,1,5,4,1,3,
8/2/17 12:15,8/2/17 12:22,0,24.55.9.21,100,423,1,8/2/17 12:22,R_DC5fTu42hiu4OMF,,,,,30.41540527,-97.79820251,anonymous,EN,A1J9IYN46FX00O,"1,2",3,6,,,,,,,,,,,,,,,,,,,,,,,,,,,,,,,,,,,,,,,,,,,,,,,,,3,The algorithm decided the schedule based on availability and customer counts and the manager monitored the schedule.,Computer and number sequences that are programmed to accept various information inputted in order to output the best possible outcome.,,,,,,,,,,,,,6,"The algorithm, for the most part, is fair un impartial towards the employees. It makes decisions based on numbers instead of feelings, and if there's any issues the manager can step in and adjust it.",5,5,2,3,3,3,"Chris wouldn't feel upset at the algorithm's schedule as it could argued that he is being scheduled according to his availability, and his schedule stays constant and stable.",6,"The algorithm is unbiased, and if there's ever any issues the manager can adjust it.",1,,,,,,,,,,,,,,,,,,,,,,,,,,,,,,,,,,,,,,,,,,,,,,,,,,,,,,,,,,,,,,,,,,,,,,,,,,,,,,,,,,,,,,,,,,,,,,,,,,,,,,,,,,,,,,,,,,,,,,,,,,,,,,,,,,,,,,,,,,,,,,,,,,,,,,,,,,,,,,,,,,,,,,,,,,1,26,2,5,4,3,2,
8/2/17 12:17,8/2/17 12:22,0,73.99.93.42,100,280,1,8/2/17 12:22,R_1is7PxgWDiNpYVk,,,,,37.55769348,-77.37689972,anonymous,EN,A3GO2JCV966XGE,"1,2",3,6,,,,,,,,,,,,,,,,,,,,,,,,,,,,,,,,,,,,,,,,,,,,,,,,,3,The manager set up a algorithm to predict the number of customers in a day.,It is a program that predicts something based  on past events,,,,,,,,,,,,,6,A robot can give a more accurate answer than a human can,5,6,6,4,2,3,Chris will be exited to see how it works and how accurate it is,5,You can always trust a robot to do the job.Predictions is based on history,1,,,,,,,,,,,,,,,,,,,,,,,,,,,,,,,,,,,,,,,,,,,,,,,,,,,,,,,,,,,,,,,,,,,,,,,,,,,,,,,,,,,,,,,,,,,,,,,,,,,,,,,,,,,,,,,,,,,,,,,,,,,,,,,,,,,,,,,,,,,,,,,,,,,,,,,,,,,,,,,,,,,,,,,,,,2,27,2,4,3,3,2,
8/2/17 12:14,8/2/17 12:22,0,73.234.251.115,100,452,1,8/2/17 12:22,R_26btGklvFYmO2ot,,,,,41.3157959,-73.13539886,anonymous,EN,A26P7RK24NCS99,"1,2",3,6,,,,,,,,,,,,,,,,,,,,,,,,,,,,,,,,,,,,,,,,,,,,,,,,,3,The manager and algorithm both had a role to evaluate the performance of Chris.,An algorithm is set of sequences to perform problem solving tasks on a device or computer.,,,,,,,,,,,,,,,,,,,,,,,,,,,,,,,,,,,,,,,,,,,,,,,,,,,,,,,,,,,,,,,,,,,,,,,,,,,,,,,,,,,,,6,It is more fair that there are 2 sources of review rather than just the manager only or just the alogorithm.,2,2,4,4,2,2,Depending on the results Chris may feel either disappointed if there are poor results or proud if there are good results.,4,"Depending on the competency of the manager it could not be a good evaluation. Also, if the algorithm is too harsh evaluating Chris is could perhaps be an overly critical evaluation.",1,,,,,,,,,,,,,,,,,,,,,,,,,,,,,,,,,,,,,,,,,,,,,,,,,,,,,,,,,,,,,,,,,,,,,,,,,,,,,,,,,,,,,,,,,,,,,,,,,,1,27,2,5,1,4,4,
8/2/17 12:15,8/2/17 12:22,0,184.13.41.74,100,404,1,8/2/17 12:22,R_1r6Lo2oD8UpfJ5E,,,,,38.30479431,-81.75769806,anonymous,EN,A25T92H4YKP4RN,"1,2",3,6,,,,,,,,,,,,,,,,,,,,,,,,,6,"This process does take some potential bias out of the selection process initially, disallowing any candidates to get through who might know the manager well, but are not qualified. ",3,5,5,1,1,1,I think Chirs would be happy that he had passed the standards of both the algorithm and the manager.,5,"I think the manager is probably someone with good judgment, especially if he was chosen to work for the company by a similar algorithm",1,,,,,,,,,,,,,3,The manager selected candidates for onsite interviews based on a pool of candidates' personal statements and resumes sorted through by the algorithm.,"Algorithms are like machines which things are put through, and they perform actions on them, often analyzing them for certain components or qualities. ",,,,,,,,,,,,,,,,,,,,,,,,,,,,,,,,,,,,,,,,,,,,,,,,,,,,,,,,,,,,,,,,,,,,,,,,,,,,,,,,,,,,,,,,,,,,,,,,,,,,,,,,,,,,,,,,,,,,,,,,,,,,,,,,,,,,,,,,,,,,,,,,,,,,,,,,,,,,,,,,,,,,,,,,,,,,,,,,,,,,,,,,,,,,,,,,,,2,26,2,3,1,2,3,
8/2/17 12:15,8/2/17 12:23,0,50.118.198.18,100,461,1,8/2/17 12:23,R_1CJfbueamtijysI,,,,,37.33869934,-121.8914032,anonymous,EN,A25SNFXNG34KBP,"1,2",3,6,,,,,,,,,,,,,,,,,,,,,,,,,,,,,,,,,,,,,,,,,,,,,,,,,3,"The manager was the human component, while the algorithm was the computer component. ",They are mathematical formulas to decipher information and provide answers. ,,,,,,,,,,,,,,,,,,,,,,,,,,,,,,,,,,,,,,,,,,,,,,,,,6,It made the jobs of both easier by analyzing the breakdown history,4,4,4,5,4,5,"He made the algorithm to help, then ended up having to do more work. ",4,"I would trust it some, simply because it is a program",1,,,,,,,,,,,,,,,,,,,,,,,,,,,,,,,,,,,,,,,,,,,,,,,,,,,,,,,,,,,,,,,,,,,,,,,,,,,,,,,,,,,,,,,,,,,,,,,,,,,,,,,,,,,,,,,,,,,,,,,,,,,,,,,,,,,,,,3,27,2,6,1,4,1,
8/2/17 12:15,8/2/17 12:23,0,50.252.189.62,100,470,1,8/2/17 12:23,R_2afCyXBfwLYG6oK,,,,,39.0223999,-94.31569672,anonymous,EN,A2UMPV8X9EJTHQ,"1,2",3,6,,,,,,,,,,,,,,,,,,,,,,,,,,,,,,,,,,,,,,,,,,,,,,,,,,,,,,,,,,,,,,,,,,,,,,,,,,,,,,,,,,,,,,,,,,,,,,,,,,,,,,,,,,,,,,,,,,,,,,,,,,,,,,,,,,,,,,,,,,,,,,,,,,,,,,,,,,,,,,,,,,,,,,,,,,,,,,,,,,,,,,,,,,,,,,,,,,,,5,7,How is it not fair? Does Chris want his job? Then he needs to get his ass to work and do what the manager says.,4,4,4,4,4,4,"I'm not going to assume how Chris would feel as I know nothing about Chris except his name and that he works ""at a company.""  Maybe it would make him mad.  Maybe, his manager is sexually atractive and he gets a boner when the manager tells him to do something.  Couldn't tell ya either way there doc.",1,I don't trust anyone except my wife.,1,,,,,,,,,,,,,,,,,,,,,,,,,,,,,,,,,,,,,1,28,2,3,1,5,1,
8/2/17 12:15,8/2/17 12:23,0,96.59.134.192,100,454,1,8/2/17 12:23,R_2QMKEl9Q9FISlgl,,,,,28.04069519,-81.90429688,anonymous,EN,A3JHJ780SMQ8IB,"1,2",3,6,,,,,,,,,,,,,,,,,,,,,,,,,,,,,,,,,,,,,,,,,,,,,,,,,3,The manager analyzes the employee while using an algorithm to analyze customers responses to said employee.,A set of rules for evalutating outcomes,,,,,,,,,,,,,,,,,,,,,,,,,,,,,,,,,,,,,,,,,,,,,,,,,,,,,,,,,,,,,,,,,,,,,,,,,,,,,,,,,,,,,3,I don't feel that a algorithm can truly measure performance based on customers comments,3,3,4,5,4,5,I feel he may get frustrated at the unfair practice.,2,"As previously stated, I don't thing it is a fair way to evaluate. ",2,,,,,,,,,,,,,,,,,,,,,,,,,,,,,,,,,,,,,,,,,,,,,,,,,,,,,,,,,,,,,,,,,,,,,,,,,,,,,,,,,,,,,,,,,,,,,,,,,,2,46,1,3,1,4,4,
8/2/17 12:17,8/2/17 12:23,0,104.52.200.22,100,390,1,8/2/17 12:23,R_3Gwc5lwfPV6FAtT,,,,,36.12879944,-95.87110138,anonymous,EN,A3UR1AE3D5U7F,"1,2",3,6,,,,,,,,,,,,,,,,,,,,,,,,,,,,,,,,,,,,,,,,,,,,,,,,,,,,,,,,,,,,,,,,,,,,,,,,,,,,,,,,,,,,,,,,,,,,,,,,,,,,,,,,,,,,,,,,,,,,,,,,,,,,,,,,,,,,,,,,,,,,,,,,,,,,,,,,,,,,,,,,,,,,,,,,,,,,,,,,,,,,,,,,,,,,,,,,,,,,5,6,Fair because the machine needed to be worked on and it could have been any employee.,4,4,4,2,2,2,"I don't know if Chris would be happy or equivalent, per se, but I doubt that he would be upset in any way of the assignment because he knows what he's supposed to do as an employee.",4,"There's no for sure way to know without full info, but he is doing what he's supposed to.",1,,,,,,,,,,,,,,,,,,,,,,,,,,,,,,,,,,,,,2,28,1,4,1,5,1,
8/2/17 12:20,8/2/17 12:23,0,173.92.54.242,100,170,1,8/2/17 12:23,R_2TtVkSbAdgpG1yj,,,,,35.4197998,-80.67479706,anonymous,EN,A2S4BU23GT93ZD,"1,2",3,6,,,,,,,,,,,,,,,,,,,,,,,,,,,,,,,,,,,,,,,,,,,,,,,,,,,Processes that use given info based on past experiences to reach a conclusion ,,,,,,,,,,,,,,,,,,,,,,,,,,,,,,,,,,,,,,,,,,,,,,,,,,,,,,,,,,,,,,,,,,,,,,,,,,,,,,,,,,,,,,,,,,,,,,,,,,,,,,,,,,,,,,,,,,,,,,,,,,,,,,,,,,,,,6,Algorithm technology has come a long way and I believe to be an accurate judge of performance,5,5,5,2,2,2,I believe having an algorithm assess you rather than another person may relieve some stress,6,They are good at making decisions,1,1,,,,,,,,,,,,,,,,,,,,,,,,,,,,,,,,,,,,,,,,,,,,,,,,,1,21,2,2,1,1,4,
