7/21/17 14:13,7/21/17 14:28,0,45.116.232.8,100,932,1,7/21/17 14:28,R_273S0Lcv2i4JUUT,,,,,24.90559387,67.0821991,anonymous,EN,A2OFRJHPNIMPI7,"1,2",3,6,,,,,,,,,,,,,,,,,,,,,,,,,,,,,,,,,,,,,,,,,,,,,,,,,3,manager assign the role algorithum monitor the performance,performance of the employee,,,,,,,,,,,,,,,,,,,,,,,,,,,,,,,,,,,,,6,Evaluation of the employee is the right of the company ,6,6,5,4,2,3,If the people confident in his performance there should be no ,5,its good to monitor,2,,,,,,,,,,,,,,,,,,,,,,,,,,,,,,,,,,,,,,,,,,,,,,,,,,,,,,,,,,,,,,,,,,,,,,,,,,,,,,,,,,,,,,,,,,,,,,,,,,,,,,,,,,,,,,,,,,,,,,,,,,,,,,,,,,,,,,,,,,,,,,,,,,4,43,1,6,4,3,4,
7/21/17 14:15,7/21/17 14:28,0,75.130.179.94,100,793,1,7/21/17 14:28,R_3s7iPqhjgNyVxG0,,,,,34.75950623,-77.50189972,anonymous,EN,A28J4SW0GG4II3,"1,2",3,6,,,,,,,,,,,,,,,,,,,,,,,,,,,,,,,,,,,,,,,,,,,,,,,,,3,"The algorithm did the scheduling, but based on its own doings as well as input from the manager. ","Algorithms are calculations made by a computer, in a business situation they can calculate much quicker things that would benefit the business than a person would be able to make. ",,,,,,,,,,,,,,,,,,,,,,,,,,,,,,,,,,,,,,,,,,,,,,,,,,,,,,,,,,,,,5,"It seems fair because it's considering what's best for the benefit of the job, as well as the manager having input. So it isn't solely being done by a nonhuman. ",5,4,3,3,4,3,I think Chris would be generally happy with the decision because it's of benefit to him and the business that he work the shift he was given. I don't see him being angry or disappointed because it wasn't chosen just because of an algorithm. ,6,"I think if it were solely the algorithm I would be concerned, but the fact that the manager has input puts the human emotion into the decision making as well. So he can make decisions based on emotion that an algorithm won't consider. ",1,,,,,,,,,,,,,,,,,,,,,,,,,,,,,,,,,,,,,,,,,,,,,,,,,,,,,,,,,,,,,,,,,,,,,,,,,,,,,,,,,,,,,,,,,,,,,,,,,,,,,,,,,,,,,,,,,,,,,,,,,,1,32,1,4,1,4,2,
7/21/17 14:30,7/21/17 14:37,0,184.7.242.110,100,421,1,7/21/17 14:37,R_3EGdl4gLfnrJXwk,,,,,31.86639404,-95.65070343,anonymous,EN,A2YATPGNVEN36Q,"1,2",3,6,,,,,,,,,,,,,,,,,,,,,,,,,,,,,,,,,,,,,,,,,,,,,,,,,,,Computer programs that run and measure different criteria.,,,,,,,,,,,,,,,,,,,,,,,,,,,,,,,,,,,,,,,,,,,,,,,,,,,,,,,,,,,,,,,,,,,,,,,,,,,,,,,,,,,,,,,,,,,,,,,,,,,,,,,,,,,,,,,,,,,,,,,,,,,,,,,,,,,,,6,The algorithm evaluates fairly because it is only looking at Chris' measureable performances and is not basing anything on emotions.,5,4,4,3,3,3,"I don't think Chris would have a problem with this evaluation method, unless his performance is lacking.",5,"I think the algorithim can only judge on the things it can measure and not other factors like attendance, attitude, etc.",1,1,,,,,,,,,,,,,,,,,,,,,,,,,,,,,,,,,,,,,,,,,,,,,,,,,2,40,1,6,1,1,4,
7/21/17 14:37,7/21/17 14:42,0,24.62.138.44,100,285,1,7/21/17 14:42,R_3Gk5t9GdDqLekQp,,,,,42.63389587,-71.29570007,anonymous,EN,A1B76WYZ47BQJ,"1,2",3,6,,,,,,,,,,,,,,,,,,,,,,,,,,,,,,,,,,,,,,,,,,,,,,,,,,,,,,,,,,,,,,,,,,,,,,,,,,,,,,,,,,,,,,,,,,,,,,,,,,,,,,,,,,,,,,,,,,,,,,,,,,,,,,,,,,,,,,,,,,,,,,,,,,,,,,,,,,,,,,,,,,,,,,,,,,,,,,,,,,,,,,,,,,,,,,,,,,,,5,,,,,,,,,,,,,,,,,,,,,,,,,7,very fair because he suspects that they meet the criteria.,5,4,4,4,4,4,Chris has neutral feeling without bias to make right choice.,7,He must trust system to work or than find a new system.,1,,,,,,,,,,,,,1,50,2,5,1,5,3,
7/21/17 14:31,7/21/17 14:42,0,70.124.6.112,100,648,1,7/21/17 14:42,R_1MVYxY5ZsMwoc5x,,,,,26.15460205,-98.20449829,anonymous,EN,AAJEPFSQNC6X,"1,2",3,6,,,,,,,,,,,,,,,,,,,,,,,,,,,,,,,,,,,,,,,,,,,,,,,,,3,The algorithm finds the candidates based on what the manager is looking for. The algorithm then selects candidates for the manager to interview.,I think algorithms are computer functions that are set to find things or data depending on their settings.,,,,,,,,,,,,,,,,,,,,,,,,,2,The algorithm could possibly screen out candidates with better qualifications. I think a human would make better decisions in this situation.,3,2,2,7,5,7,Chris might feel that he wasn't even given a chance to present himself to the hiring manager. ,2,I cannot trust a machine to make a decision like this. A human should be the one to weed out the bad candidates because they might have better idea as to what they are looking for.,1,,,,,,,,,,,,,,,,,,,,,,,,,,,,,,,,,,,,,,,,,,,,,,,,,,,,,,,,,,,,,,,,,,,,,,,,,,,,,,,,,,,,,,,,,,,,,,,,,,,,,,,,,,,,,,,,,,,,,,,,,,,,,,,,,,,,,,,,,,,,,,,,,,,,,,,,,,,,,,1,36,2,3,3,3,3,
7/21/17 14:32,7/21/17 14:42,0,98.177.136.98,100,622,1,7/21/17 14:42,R_3OcyptHFxv5r9Bf,,,,,33.57339478,-112.2570038,anonymous,EN,A1C66QKNXGH895,"1,2",3,6,,,,,,,,,,,,,,,,,,,,,,,,,,,,,,,,,,,,,,,,,,,,,,,,,3,The manager reads through the personal statements and the algorithm sorts through resumes.  Then the algorithm chooses the top candidates based on those results.,A computer program that looks for patterns and sorts them.,,,,,,,,,,,,,,,,,,,,,,,,,,,,,,,,,,,,,,,,,,,,,,,,,,,,,,,,,,,,,,,,,,,,,,,,,5,The algorithm analyzes resumes which sorts out how qualified the applicants are. ,4,4,4,4,4,5,"It would depend on whether he gets chosen, how he would feel.",6,"I think the algorythm would take the emotion out of hiring, it would choose based on which were best qualified.",1,,,,,,,,,,,,,,,,,,,,,,,,,,,,,,,,,,,,,,,,,,,,,,,,,,,,,,,,,,,,,,,,,,,,,,,,,,,,,,,,,,,,,,,,,,,,,,,,,,,,,,,,,,,,,,1,41,1,2,1,4,3,
7/21/17 14:37,7/21/17 14:48,0,50.243.111.147,100,692,1,7/21/17 14:48,R_DvOl78kVra4l2vL,,,,,47.61019897,-122.3042984,anonymous,EN,A22MREX05K7V9Y,"1,2",3,6,,,,,,,,,,,,,4,Algorithms cannot fully determine a person's actions and productivity.  It can only guess because a person's actions cannot be fully predicted base on data. ,2,2,2,6,6,6,Chris could feel like he is treated as an object rather than a person with feelings. ,4,"Although it may seem unethical, I see the manager's reasoning with predicting a person's actions through a computer.  It may give them him/her some assurance and a sense of security.",1,,,,,,,,,,,,,,,,,,,,,,,,,3,The manager is in charge of scheduling the employees and the algorithm helps the manager choose the schedule base on data collected on employee.,Algorithms collect data and reach results and analyzations through those data.,,,,,,,,,,,,,,,,,,,,,,,,,,,,,,,,,,,,,,,,,,,,,,,,,,,,,,,,,,,,,,,,,,,,,,,,,,,,,,,,,,,,,,,,,,,,,,,,,,,,,,,,,,,,,,,,,,,,,,,,,,,,,,,,,,,,,,,,,,,,,,,,,,,,,,,,,,,,,,,,,,,,,,,,,,,,,,,,,,,,,,,,,,,,,,,,,,2,27,1,5,4,2,2,
7/21/17 14:52,7/21/17 15:01,0,76.243.100.30,100,527,1,7/21/17 15:01,R_cC8yQ2DhH5WxmjD,,,,,42.42550659,-83.25330353,anonymous,EN,A3SUN3J72ZJ8W9,"1,2",3,6,,,,,,,,,,,,,,,,,,,,,,,,,,,,,,,,,,,,,,,,,,,,,,,,,,,Algorithms a pretty much rules made by a system or computer.,,,,,,,,,,,,,,,,,,,,,,,,,,,,,,,,,,,,,,,,,,,,,,,,,,,,,,,,,,,,,,,,,,,,,,,,,,,,,,,,,,,,,,,,,,,,,,,,,7,"I think its very fair that an algorithm, if anything the algorithm makes it easier to identify and prevent problems",4,3,4,2,3,3,"I dont think chris would necessarily happy being assigned jobs by the algorithm, but i dont see him being mad either.",6,"I trust the algorithm because that's what its made for, when maintenance is done chris will see if there's something wrong anyway.",1,,,,,,,,,,,,,,,,,,,,,,,,,,,,,,,,,,,,,1,,,,,,,,,,,,,,,,,,,,,,,,,,,,,,,,,,,,,,,,,,,,,,,,,2,24,2,3,2,1,1,
7/21/17 14:57,7/21/17 15:02,0,73.114.22.97,100,299,1,7/21/17 15:02,R_2BnzG3e5cUZanvT,,,,,42.08070374,-72.55819702,anonymous,EN,A2FXD55FJV1RSV,"1,2",3,6,,,,,,,,,,,,,,,,,,,,,,,,,,,,,,,,,,,,,,,,,,,,,,,,,3,The manager and the algorithm work together to determine the schedule of who works when based upon availability and the number of customers during different times of the week.,"Mathematical systems that take in information and manipulate the information to give a ""solution"" to the problem that the data represent.",,,,,,,,,,,,,,,,,,,,,,,,,,,,,,,,,,,,,,,,,,,,,,,,,,,,,,,,,,,,,6,It is fair because the algorithm uses the employees' availabilities to make the schedule. ,6,5,5,2,1,2,If Chris stated that he was available to work mornings he should be happy that the algorithm put him on the schedule in the mornings.,6,It seems like it probably works well to use an algorithm based on availabilities.,1,,,,,,,,,,,,,,,,,,,,,,,,,,,,,,,,,,,,,,,,,,,,,,,,,,,,,,,,,,,,,,,,,,,,,,,,,,,,,,,,,,,,,,,,,,,,,,,,,,,,,,,,,,,,,,,,,,,,,,,,,,2,29,2,5,1,4,2,