7/25/17 21:20,7/25/17 21:26,0,73.194.119.127,100,404,1,7/25/17 21:26,R_1jIi9slb6BfMxwX,,,,,40.73640442,-74.07240295,anonymous,EN,A31898LQJO7I3,"1,2",3,6,,,,,,,,,,,,,,,,,,,,,,,,,,,,,,,,,,,,,,,,,,,,,,,,,,,,,,,,,,,,,,,,,,,,,,,,,,,,,,,,,,,,,,,,,,,,,,,,,,,,,,,,,,,,,,,,,,,,,,,,,,,,,,,,,,,,,,,,,,,,,,,,,,,,,,,,,,,,,,,,,,,,,,,,,,,,,,,,,,,,,,,,,,,,,,,,,,,,5,7,"It's the manager's job to assess all the components and to assign the necessary people like Chris to do the maintenance since he is qualified to do so, so it's very fair.",5,4,6,1,1,1,"It's Chris' job to perform maintenance since he's trained to do so, so I imagine that he'd be happy and content to do so and would not be angry or frustrated. It's what is expected of him to do as his job.",7,The manager's job is to look at the bigger picture of all the components so I trust him extremely if there needs to be maintenance that he would be able to notice and asses.,1,,,,,,,,,,,,,,,,,,,,,,,,,,,,,,,,,,,,,1,24,2,5,4,5,1,
7/25/17 21:21,7/25/17 21:27,0,75.169.0.82,100,312,1,7/25/17 21:27,R_2pQchEDsswpQ8sR,,,,,40.60969543,-111.9391022,anonymous,EN,A26OJ4TA28AFHC,"1,2",3,6,,,,,,,,,,,,,,,,,,,,,,,,,,,,,,,,,,,,,,,,,,,,,,,,,,,Computer programs/equations used to analyze data,,,,,,,,,,,,,,,,,,,,,,,,,,,,,,,,,,,,,,,,,,,,,,,,,,,,,,,,,,,,,,,,,,,,,,,,,,,,,,,,,,,,,,,,,,,,,,,,,,,,,,,,,,,,,,,,,,,,,,,,,,,,,,,,,,,,,6,An algorithm cannot be biased on the basis of race or other personal characteristics ,3,4,4,1,2,2,"I think he would not be too emotional about it, just think it's a fair way to evaluate",5,Algorithms affect prefect but they are less preferential ,1,1,,,,,,,,,,,,,,,,,,,,,,,,,,,,,,,,,,,,,,,,,,,,,,,,,1,30,2,5,1,1,4,
7/25/17 21:21,7/25/17 21:27,0,65.129.170.192,100,364,1,7/25/17 21:27,R_cvETcW8WQuEJPtD,,,,,32.24760437,-110.9499969,anonymous,EN,A1EHERSHAHOWRB,"1,2",3,6,,,,,,,,,,,,,,,,,,,,,,,,,,,,,,,,,,,,,,,,,,,,,,,,,,,,,,,,,,,,,,,,,,,,,,,,,,,,,,,,,,,,,,,,,,,,,,,,,,,,,,,,,,,,,,,,,,,,,,,,,,,,,,,,,,,,,,,,,,,,,,,,,,,,,,,,,,,,,,,,,,,,,,,,,,,,,,,,,,,,,,,,,,,,,,,,,,,,5,,,,,,,,,,,,,,,,,,,,,,,,,,,,,,,,,,,,,4,not a fairness issue,2,2,2,2,2,2,I  dont think it would produce any of those feelings,2,most managers make poor quality evaluation,1,1,32,2,4,1,5,4,
7/25/17 21:20,7/25/17 21:27,0,67.214.7.189,100,431,1,7/25/17 21:27,R_3LZUgjwa5GsoLiu,,,,,40.98120117,-76.95870209,anonymous,EN,A31K4ASJODLAFM,"1,2",3,6,,,,,,,,,,,,,,,,,,,,,,,,,,,,,,,,,,,,,,,,,,,,,,,,,,,Algorithms are sets of rules used by computers to produce calculations and results.,,,,,,,,,,,,,,,,,,,,,,,,,,,,,,,,,,,,,,,,,,,,,,,,,,,,,,,,,,,,,,,,,,,,,,,,,,,,,,,,,,,,,,,,,,,,,,,,,,,,,,,,,,,,,6,"I think, so long as the algorithm accurately accounts for employee availability, it's no less fair for Chris's schedule to be computer generated than human generated.",4,3,2,4,4,4,"Chris's feelings would depend upon how well the schedule actually works with their available time, though I doubt anyone often feels joyful or proud of their work schedule itself.",5,I think if the algorithm were not producing acceptable schedules it would not be being used.,1,,,,,,,,,,,,,,,,,,,,,,,,,1,,,,,,,,,,,,,,,,,,,,,,,,,,,,,,,,,,,,,,,,,,,,,,,,,2,37,1,5,1,1,2,
7/25/17 21:17,7/25/17 21:27,0,74.176.177.84,100,571,1,7/25/17 21:27,R_2P5Kmxi1JBlB0ry,,,,,34.27310181,-83.89050293,anonymous,EN,AFECJV2SCEZ82,"1,2",3,6,,,,,,,,,,,,,,,,,,,,,,,,,,,,,,,,,,,,,,,,,,,,,,,,,3,"Manager analyzed the calls the employee had, and the algo analyzed the customer comments.",computer programs designed to analyze data,,,,,,,,,,,,,,,,,,,,,,,,,,,,,,,,,,,,,,,,,,,,,,,,,,,,,,,,,,,,,,,,,,,,,,,,,,,,,,,,,,,,,5,"Although it is not a human entity, I'm sure the algorithm is programmed to be fair.",5,4,5,5,4,5,He might prefer an actual human to rate his performance.,5,I have faith in technology.,1,,,,,,,,,,,,,,,,,,,,,,,,,,,,,,,,,,,,,,,,,,,,,,,,,,,,,,,,,,,,,,,,,,,,,,,,,,,,,,,,,,,,,,,,,,,,,,,,,,1,55,1,5,1,4,4,
7/25/17 21:21,7/25/17 21:27,0,67.233.108.170,100,384,1,7/25/17 21:27,R_3fC7M1artbEdYYd,,,,,38.03610229,-78.33280182,anonymous,EN,A2I1IBMQ1J82J9,"1,2",3,6,,,,,,,,,,,,,,,,,,,,,,,,,,,,,,,,,,,,,,,,,,,,,,,,,3,the algorithm was designed for analysis of applications and resumes as a way of selecting the most favorable employees. The manager's job was to manage and oversee the use of the algorithm.,"A set of procedures to accomplish something, which is often applied to computers.",,,,,,,,,,,,,,,,,,,,,,,,,3,The algorithm should be set up to eliminate subjective matters or favoritism. The fact that this is managed by a human manager compromises its impartiality.,2,2,2,3,6,6,Chris might be concerned about the manager's ability to set the algorithm in a way that would exclude him from consideration.,4,"Normally, the algorithm provides an objective and unbiased form of selection of the best candidates, provided the manager is honest and doesn't manipulate it to his own purposes.",1,,,,,,,,,,,,,,,,,,,,,,,,,,,,,,,,,,,,,,,,,,,,,,,,,,,,,,,,,,,,,,,,,,,,,,,,,,,,,,,,,,,,,,,,,,,,,,,,,,,,,,,,,,,,,,,,,,,,,,,,,,,,,,,,,,,,,,,,,,,,,,,,,,,,,,,,,,,,,,2,65,1,6,1,3,3,
7/25/17 21:19,7/25/17 21:27,0,99.195.170.121,100,514,1,7/25/17 21:27,R_cO06wtWD6XbcfSh,,,,,30.74090576,-92.34549713,anonymous,EN,A3HSYVE3KZ2OP7,"1,2",3,6,,,,,,,,,,,,,,,,,,,,,,,,,,,,,,,,,,,,,,,,,,,,,,,,,3,"The manager decides the importance of he co ponent to the factory, while the algorithm gives the history breakdown of the component. ",The decisions or process made by the computer on something.,,,,,,,,,,,,,,,,,,,,,,,,,,,,,,,,,,,,,,,,,,,,,,,,,5,"The machine is very objective, the manager on the other hand can see or tell something abt the employee himself.",5,4,4,4,3,3,He is not otally agreeing nor disagreeing but just doing his job.,5,The algorithm decision will be nased on whatever input put on it.,1,,,,,,,,,,,,,,,,,,,,,,,,,,,,,,,,,,,,,,,,,,,,,,,,,,,,,,,,,,,,,,,,,,,,,,,,,,,,,,,,,,,,,,,,,,,,,,,,,,,,,,,,,,,,,,,,,,,,,,,,,,,,,,,,,,,,,,1,36,1,5,4,4,1,
7/25/17 21:19,7/25/17 21:27,0,1.46.194.1,100,496,1,7/25/17 21:27,R_3fK9aNvogDscKa6,,,,,13.7539978,100.5014038,anonymous,EN,AU4KK3OYS2UZF,"1,2",3,6,,,,,,,,,,,,,,,,,,,,,,,,,,,,,,,,,,,,,,,,,,,,,,,,,3,The manager read the personal statements while the algorithm analyzed the rest of the application.,"An algorithm is a set of instructions to find a solution. In the case of the computer, it was some sort of math problem that ranked applicants.",,,,,,,,,,,,,,,,,,,,,,,,,,,,,,,,,,,,,,,,,,,,,,,,,,,,,,,,,,,,,,,,,,,,,,,,,5,"Because a manager reads the personal statements, I think the process is more fair. Although I think the manager should have sole discretion, having a computer analyze work history and qualifications is okay because the manager has input on their personality and potential (which a computer would have a hard job accurately determining)",3,3,3,5,3,4,"I believe Chris would want a real person to review his application and make the decision, instead of a computer algorithm having an input.",4,"I think the computer will do a decent job, but it still feels very impersonal.",1,,,,,,,,,,,,,,,,,,,,,,,,,,,,,,,,,,,,,,,,,,,,,,,,,,,,,,,,,,,,,,,,,,,,,,,,,,,,,,,,,,,,,,,,,,,,,,,,,,,,,,,,,,,,,,2,26,2,3,1,4,3,
7/25/17 21:23,7/25/17 21:28,0,74.128.94.79,100,256,1,7/25/17 21:28,R_1kYYyqOEtEdLMn2,,,,,39.00230408,-84.6568985,anonymous,EN,A1M9H7WED4RUD5,"1,2",3,6,,,,,,,,,,,,,,,,,,,,,,,,,1,Personal review of each candidate rather than a random computer integer should guide the process,1,2,2,7,7,6,I think he would be upset to be excluded from the process,2,He would no trust someone that would allow their pricipals to be decided by a computer,1,,,,,,,,,,,,,1,The algorithm decides what candidates should be interviewed by the manager,Computer programmed integers and scripts that determine outcomes,,,,,,,,,,,,,,,,,,,,,,,,,,,,,,,,,,,,,,,,,,,,,,,,,,,,,,,,,,,,,,,,,,,,,,,,,,,,,,,,,,,,,,,,,,,,,,,,,,,,,,,,,,,,,,,,,,,,,,,,,,,,,,,,,,,,,,,,,,,,,,,,,,,,,,,,,,,,,,,,,,,,,,,,,,,,,,,,,,,,,,,,,,,,,,,,,,1,33,2,3,1,2,3,
7/25/17 21:19,7/25/17 21:28,0,173.234.61.62,100,490,1,7/25/17 21:28,R_1DwnCOF75s37nRv,,,,,41.84829712,-87.65170288,anonymous,EN,A2XEH5CF7RUGA9,"1,2",3,6,,,,,,,,,,,,,,,,,,,,,,,,,,,,,,,,,,,,,,,,,,,,,,,,,,,,,,,,,,,,,,,,,,,,,,,,,,,,,,,,,,,,,,,,,,,,,,,,,,,,,,,,,,,,,,,,,,,,,,,,,,,,,,,,,,,,,,,,,,,,,,,,,,,,,,,,,,,,,,,,,,,,,,,,,,,,,,,,,,,,,,,,,,,,,,,,,,,,5,,,,,,,,,,,,,,,,,,,,,,,,,6,Everyone seems to have an equal chance of being chosen for an onsite interview. So I don't think it is unfair.,5,4,5,4,3,4,"I am unsure on whether Chris was chosen for an onsite interview. He could be happy or upset, depending.",5,"I am not sure if he is a good-decision maker. However, he is a manager at a high-tech company, so he got there by accomplishment ( I am guessing).",1,,,,,,,,,,,,,1,39,1,5,1,5,3,
7/25/17 21:19,7/25/17 21:28,0,73.202.17.168,100,524,1,7/25/17 21:28,R_AciiA4NBwvdOkSd,,,,,37.81129456,-122.3007965,anonymous,EN,AL8XTNQ7MQH5F,"1,2",3,6,,,,,,,,,,,,,,,,,,,,,,,,,,,,,,,,,,,,,,,,,,,,,,,,,,,An algorithm describes the process of applying a set of rules to inputs in order to produce a result.  ,,,,,,,,,,,,,,,,,,,,,,,,,,,,,,,,,,,,,,,,,,,,,,,,,,,,,,,,,,,,,,,,,,,,,,,,,,,,,,,,,,,,,,,,,,,,,,,,,6,The algorithm likely provides a more reliable estimate of when a component needs to be checked than Chris's own assumptions.,5,3,1,3,2,3,"I think Chris probably doesn't experience many emotions based on the algorithm's assignment of the maintenance task. However, since it is just a computational algorithm, it is highly unlikely that Chris would feel any negative emotions (such as anger, disappointment, or frustration) toward it. It is also unlikely that he experiences such a strong emotion as ""joy."" And there's no reason for him to feel proud, since he has nothing to do with the algorithm. He might feel kind of happy that the algorithm decides which component needs to be maintained, because it takes some of the responsibility off of him. ",6,"The algorithm is based on historical data. Unless the circumstances change, and certain components become more or less important, or a new process causes parts to break more or less frequently, then it's reasonable to believe that the maintenance scheduled produced by the algorithm is relatively reliable. ",1,,,,,,,,,,,,,,,,,,,,,,,,,,,,,,,,,,,,,1,,,,,,,,,,,,,,,,,,,,,,,,,,,,,,,,,,,,,,,,,,,,,,,,,2,32,1,8,1,1,1,
7/25/17 21:18,7/25/17 21:28,0,184.63.88.33,100,593,1,7/25/17 21:28,R_3m3FL8jvOrk1BZt,,,,,30.40800476,-95.18560028,anonymous,EN,A3DZ46U9XRLVBI,"1,2",3,6,,,,,,,,,,,,,,,,,,,,,,,,,,,,,,,,,,,,,,,,,,,,,,,,,3,The manger monitored and adjusted the decision and data made by the algorithm.,A automated program that uses calculations and previous date as well as monitoring to make future decisions.,6,The algorithm is making a analyzed decision. Because of that I find it fair.,4,4,4,2,1,1,I don't think he would have any angry or upset feeling but wouldn't be particularly happy about the extra work either.,6,I think it uses calculations and that makes it pretty accurate.,1,,,,,,,,,,,,,,,,,,,,,,,,,,,,,,,,,,,,,,,,,,,,,,,,,,,,,,,,,,,,,,,,,,,,,,,,,,,,,,,,,,,,,,,,,,,,,,,,,,,,,,,,,,,,,,,,,,,,,,,,,,,,,,,,,,,,,,,,,,,,,,,,,,,,,,,,,,,,,,,,,,,,,,,,,,,,,,,,,,,,,,1,38,1,3,3,3,1,
7/25/17 21:18,7/25/17 21:29,0,69.145.11.9,100,609,1,7/25/17 21:29,R_2SesWglDAu4DXQk,,,,,41.10339355,-104.905899,anonymous,EN,A2CU75UPXCS8J6,"1,2",3,6,,,,,,,,,,,,,,,,,,,,,,,,,,,,,,,,,,,,,,,,,,,,,,,,,3,The algorithm decides what part should be looked at and who should do it.The human makes sure that all the parameters are properly entered.,"algorithms are combinations of equations, specifications and decision trees to help anyone or any machine decide what to do next",6,"Being assigned to a specific task in the factory is something that everyone there is subject to, which makes it completely fair - at least in theory",4,4,4,2,1,3,"Getting an assignment is probably not a joyful experience, so it causes neither that nor happiness.There should be no negative feelings, and pride should not enter into it at all, since it is just an assignment and not something super special.",6,"If you put the right information in, a good result should follow.",1,,,,,,,,,,,,,,,,,,,,,,,,,,,,,,,,,,,,,,,,,,,,,,,,,,,,,,,,,,,,,,,,,,,,,,,,,,,,,,,,,,,,,,,,,,,,,,,,,,,,,,,,,,,,,,,,,,,,,,,,,,,,,,,,,,,,,,,,,,,,,,,,,,,,,,,,,,,,,,,,,,,,,,,,,,,,,,,,,,,,,,1,55,2,8,1,3,1,
7/25/17 21:22,7/25/17 21:29,0,65.0.117.245,100,377,1,7/25/17 21:29,R_2rYJxo36t6IAVl4,,,,,33.42590332,-88.83029938,anonymous,EN,A30QRYULPVYZQV,"1,2",3,6,,,,,,,,,,,,,,,,,,,,,,,,,,,,,,,,,,,,,,,,,,,,,,,,,,,,,,,,,,,,,,,,,,,,,,,,,,,,,,,,,,,,,,,,,,,,,,,,,,,,,,,,,,,,,,,,,,,,,,,,,,,,,,,,,,,,,,,,,,,,,,,,,,,,,,,,,,,,,,,,,,,,,,,,,,,,,,,,,,,,,,,,,,,,,,,,,,,,5,4,"It is Chris's job to do the tasks assigned to him my the manager.  ""Fair"" does not play a part when you work for someone and have a job to do.",4,4,4,1,1,1,"As an employee who's job it is to do the assigned tasks from the manager, emotions have no place in the equation.  Chris either does the job as detailed and gets paid for doing so, or he does not do the job assigned and get fired.",7,It is the manager's job to assign tasks in a manner that benefits the company.,1,,,,,,,,,,,,,,,,,,,,,,,,,,,,,,,,,,,,,1,64,1,5,1,5,1,
7/25/17 21:18,7/25/17 21:29,0,67.177.170.18,100,662,1,7/25/17 21:29,R_2UWzXMmNVjrXvmT,,,,,35.79820251,-86.43560028,anonymous,EN,A1535FFYCFNGBX,"1,2",3,6,,,,,,,,,,,,,,,,,,,,,,,,,,,,,,,,,,,,,,,,,,,,,,,,,3,The algorithm was used by the manager to better help him to see when the employees time would be best spent at the coffee shop.  ,They can help determine an action by data processing.,,,,,,,,,,,,,5,It depends on the employee's availability so to me that is pretty fair.,5,4,4,3,3,3,I would think that Chris would want to do mornings.  Who wouldn't? And it would pretty busy to make the mornings go by fast. ,5,Sometimes compuers can be smarter than humans in my opinion. ,1,,,,,,,,,,,,,,,,,,,,,,,,,,,,,,,,,,,,,,,,,,,,,,,,,,,,,,,,,,,,,,,,,,,,,,,,,,,,,,,,,,,,,,,,,,,,,,,,,,,,,,,,,,,,,,,,,,,,,,,,,,,,,,,,,,,,,,,,,,,,,,,,,,,,,,,,,,,,,,,,,,,,,,,,,,2,46,1,2,1,3,2,
7/25/17 21:22,7/25/17 21:29,0,71.13.252.156,100,447,1,7/25/17 21:29,R_sHeP1Vl0t1CKfsZ,,,,,43.11839294,-89.52069855,anonymous,EN,A13N8H1IVF7TMJ,"1,2",3,6,,,,,,,,,,,,,,,,,,,,,,,,,,,,,,,,,,,,,,,,,,,,,,,,,3,"The algorithm is required to ""check"" the components of the company, and assign workers randomly for maintenance.  The manager oversees the computer, and in effect should have the final say.",Algorithms are basically directions.  They are a set of steps required for a computer to complete a task.,4,"I don't have enough context.  I need to know more about the company; how many employees work there, for example?  How frequently does Chris get assigned tasks?",4,4,4,5,4,5,"I chose frustrated and disappointed because it will most likely add to his normal duties.  Again, though, I need more context to render a complete decision.",3,I have to figure the company would have done its research as well as trials before implementing the algorithm.,1,,,,,,,,,,,,,,,,,,,,,,,,,,,,,,,,,,,,,,,,,,,,,,,,,,,,,,,,,,,,,,,,,,,,,,,,,,,,,,,,,,,,,,,,,,,,,,,,,,,,,,,,,,,,,,,,,,,,,,,,,,,,,,,,,,,,,,,,,,,,,,,,,,,,,,,,,,,,,,,,,,,,,,,,,,,,,,,,,,,,,,1,29,2,6,1,3,1,
7/25/17 21:18,7/25/17 21:30,0,67.248.70.34,100,694,1,7/25/17 21:30,R_2DOfbUICAsVQ8Va,,,,,42.71609497,-73.81580353,anonymous,EN,ABR4UCZ8K7I4K,"1,2",3,6,,,,,,,,,,,,,,,,,,,,,,,,,,,,,,,,,,,,,,,,,,,,,,,,,3,The manager goes over the applicant's personal statements while the algorithm has a set of rules in place that helps to make the final decision by going through the resumes. ,A step by step set of rules in place to perform a task.,,,,,,,,,,,,,,,,,,,,,,,,,,,,,,,,,,,,,,,,,,,,,,,,,,,,,,,,,,,,,,,,,,,,,,,,,6,"I believe it's fair because it is not only a computer making the final decision, but a human is going over information as well. ",6,5,4,3,2,2,"I believe he would also think it was fair, so he would be happy with the decision. ",6,"Because there are a set of rules in place, there is no favoritism or any other judgement taking place. I think this is very trustworthy. ",1,,,,,,,,,,,,,,,,,,,,,,,,,,,,,,,,,,,,,,,,,,,,,,,,,,,,,,,,,,,,,,,,,,,,,,,,,,,,,,,,,,,,,,,,,,,,,,,,,,,,,,,,,,,,,,1,30,1,2,1,4,3,
7/25/17 21:23,7/25/17 21:30,0,75.133.101.248,100,396,1,7/25/17 21:30,R_CZEXjyPiUIV5XHj,,,,,41.46749878,-73.24060059,anonymous,EN,AKHH4W14A6AN9,"1,2",3,6,,,,,,,,,,,,,,,,,,,,,,,,,,,,,,,,,,,,,,,,,,,,,,,,,3,the algorithm analyzes the calls and the manager adjusts what the algorithm factors in when analyzing ,automatic judgement system ,,,,,,,,,,,,,,,,,,,,,,,,,,,,,,,,,,,,,2,The manager can change it to be different any time,2,2,2,6,6,6,I think it would be frustrating because instead of just being observed he has to be judged by this algorithm ,1,The manager can adjust it to be any way he wants ,1,,,,,,,,,,,,,,,,,,,,,,,,,,,,,,,,,,,,,,,,,,,,,,,,,,,,,,,,,,,,,,,,,,,,,,,,,,,,,,,,,,,,,,,,,,,,,,,,,,,,,,,,,,,,,,,,,,,,,,,,,,,,,,,,,,,,,,,,,,,,,,,,,,1,35,1,5,1,3,4,
7/25/17 21:24,7/25/17 21:30,0,98.210.228.117,100,361,1,7/25/17 21:30,R_1Qcp2UUPBqZnkec,,,,,38.02400208,-122.5400009,anonymous,EN,AOBTFLJU2BEPR,"1,2",3,6,,,,,,,,,,,,,,,,,,,,,,,,,,,,,,,,,,,,,,,,,,,,,,,,,,,An algorithm is a computer program that is designed to make decisions.,,,,,,,,,,,,,,,,,,,,,,,,,,,,,,,,,,,,,,,,,,,,,,,,,,,,,,,,,,,,,,,,,,,,,,,,,,,,,,,,,,,,,,,,,,,,,,,,,,,,,,,,,,,,,,,,,,,,,,,,,3,I think this would be discriminatory.,2,2,2,5,5,5,I think an algorithm can't totally select a good candidate.,4,I think the algorithm can narrow down the pool of candidates but can't identify the best person for the job.,1,,,,,,,,,,,,,1,,,,,,,,,,,,,,,,,,,,,,,,,,,,,,,,,,,,,,,,,,,,,,,,,1,34,1,5,1,1,3,
7/25/17 21:27,7/25/17 21:30,0,24.148.94.178,100,190,1,7/25/17 21:30,R_3isXgDnowRrhj5k,,,,,42.00759888,-87.69560242,anonymous,EN,A2G30CUMM6UXG5,"1,2",3,6,,,,,,,,,,,,,,,,,,,,,,,,,,,,,,,,,,,,,,,,,,,,,,,,,3,The algorithm would plan out solutions and the manager would make the final decision.,A mathematical sequence that takes factors from real life into account to predict outcomes.,,,,,,,,,,,,,,,,,,,,,,,,,,,,,,,,,,,,,,,,,,,,,,,,,6,With the algorithim doing the majority of the work and manager making final decision it will be well thought out.,4,3,3,4,3,5,I don't think it would evoke too much other than a typical job activity.,6,The algorithm should be designed to be less impartial than anything else.,1,,,,,,,,,,,,,,,,,,,,,,,,,,,,,,,,,,,,,,,,,,,,,,,,,,,,,,,,,,,,,,,,,,,,,,,,,,,,,,,,,,,,,,,,,,,,,,,,,,,,,,,,,,,,,,,,,,,,,,,,,,,,,,,,,,,,,,1,27,2,5,1,4,1,
7/25/17 21:21,7/25/17 21:30,0,73.1.49.185,100,547,1,7/25/17 21:30,R_bswyC8Lw46nW3L3,,,,,27.44250488,-80.33059692,anonymous,EN,A1KLAGM9CCOFBN,"1,2",3,6,,,,,,,,,,,,,,,,,,,,,,,,,,,,,,,,,,,,,,,,,,,,,,,,,3,The manager and the algorithm both judged Chris together.,Computer code designed to do something specific and/or learn.,,,,,,,,,,,,,,,,,,,,,,,,,,,,,,,,,,,,,,,,,,,,,,,,,,,,,,,,,,,,,,,,,,,,,,,,,,,,,,,,,,,,,4,Would have to know more about how the algorithm works.,4,4,4,5,5,5,I don't really think an algorithm could fairly judge a human.,5,Trust the manager more than the algorithm.,1,,,,,,,,,,,,,,,,,,,,,,,,,,,,,,,,,,,,,,,,,,,,,,,,,,,,,,,,,,,,,,,,,,,,,,,,,,,,,,,,,,,,,,,,,,,,,,,,,,1,63,2,3,1,4,4,
7/25/17 21:21,7/25/17 21:30,0,174.105.8.87,100,512,1,7/25/17 21:30,R_3Pt1x14ZX4sIbvu,,,,,40.59820557,-83.14250183,anonymous,EN,A1F8O6BA8AZTRF,"1,2",3,6,,,,,,,,,,,,,,,,,,,,,,,,,,,,,,,,,,,,,,,,,,,,,,,,,3,"It was honestly a little confusing, but it sounded like the manager and the algorithm evaluated the customer service calls by use of comments and tone, and then the algorithm took those evaluations and further evaluated them. ",When a computer sees a process or set of rules and makes decisions based off of patterns. ,,,,,,,,,,,,,,,,,,,,,,,,,,,,,,,,,,,,,,,,,,,,,,,,,,,,,,,,,,,,,,,,,,,,,,,,,,,,,,,,,,,,,3,"I don't really understand how the algorithm would be able to evaluate things like tone, which can easily be subjective and/or misunderstood. ",2,2,2,5,5,6,I think Chris is a smart dude and would feel the same way that I explained as to why the evaluation is unfair. ,2,I don't think the algorithm could take into consideration human emotions and tone. ,1,,,,,,,,,,,,,,,,,,,,,,,,,,,,,,,,,,,,,,,,,,,,,,,,,,,,,,,,,,,,,,,,,,,,,,,,,,,,,,,,,,,,,,,,,,,,,,,,,,1,38,1,5,1,4,4,
7/25/17 21:22,7/25/17 21:30,0,104.11.61.83,100,501,1,7/25/17 21:30,R_2uWeG1Vwjz3svf5,,,,,37.95359802,-122.0780029,anonymous,EN,A8KX1HFH8NE2Q,"1,2",3,6,,,,,,,,,,,,,,,,,,,,,,,,,,,,,,,,,,,,,,,,,,,,,,,,,,,,,,,,,,,,,,,,,,,,,,,,,,,,,,,,,,,,,,,,,,,,,,,,,,,,,,,,,,,,,,,,,,,,,,,,,,,,,,,,,,,,,,,,,,,,,,,,,,,,,,,,,,,,,,,,,,,,,,,,,,,,,,,,,,,,,,,,,,,,,,,,,,,,5,,,,,,,,,,,,,6,"It is the manager's responsibility to schedule the shifts for all employees, including Chris.  The manager was given that position because he or she was deemed as being able to make those type of decisions that would be in the best interest of the coffee shop and its customers.",4,4,6,2,1,3,I think that Chris would feel wanted for being scheduled on the morning shift and this would make him proud.  He would not be frustrated or angry.,6,"The owners of the coffee shop felt that the manager had the ability to make those decisions and thus, they have put trust in the manager to make the best overall decisions for the coffee shop, its customers and their employees.",1,,,,,,,,,,,,,,,,,,,,,,,,,3,51,2,6,1,5,2,
7/25/17 21:17,7/25/17 21:30,0,108.240.90.69,100,766,1,7/25/17 21:30,R_1MRqo9MyjaMeaLg,,,,,39.6473999,-84.15730286,anonymous,EN,A1HK7CR71C8BCA,"1,2",3,6,,,,,,,,,,,,,,,,,,,,,,,,,,,,,,,,,,,,,,,,,,,,,,,,,3,Chris is being monitored by a manager through the algorithm that evaluates Chris.,Set of rules created and adjusted by manager or supervisor. It helps to evaluate more efficiently the worker.,,,,,,,,,,,,,,,,,,,,,,,,,,,,,,,,,,,,,6,The manager has his/her own responsibilities. Chris is his/her subordinate and has to be evaluated by algorithm followed by manager.,4,2,2,4,2,4,Chris knows the procedures and is accustomed to them.,5,The set of rules are esier to follow. Once the initial practice period is over I  can follow it pretty easily.,1,,,,,,,,,,,,,,,,,,,,,,,,,,,,,,,,,,,,,,,,,,,,,,,,,,,,,,,,,,,,,,,,,,,,,,,,,,,,,,,,,,,,,,,,,,,,,,,,,,,,,,,,,,,,,,,,,,,,,,,,,,,,,,,,,,,,,,,,,,,,,,,,,,1,39,1,5,4,3,4,
7/25/17 21:22,7/25/17 21:30,0,97.73.240.98,100,476,1,7/25/17 21:30,R_30r7aayHfP3hvch,,,,,34.05439758,-118.2440033,anonymous,EN,A3KNO82DZ519HG,"1,2",3,6,,,,,,,,,,,,,,,,,,,,,,,,,,,,,,,,,,,,,,,,,,,,,,,,,3,THE MANAGER AND ALGORITHM BOTH COME US WITH MAINTENANCE SHCHEDULES AND ASSIGN THEM TO CHRIS,THEY ARE CONCLUSIONS OF A SITUATION BY A COMPUTER BASED ON PREVIOUS EVENTS AND THE COMPUTERS ANALYSIS OF THOSE ACTIONS.,,,,,,,,,,,,,,,,,,,,,,,,,,,,,,,,,,,,,,,,,,,,,,,,,6,I THINK BOTH THE ALGORITHM AND THE MANAGER HAVE DIFFERENT VIEW POINTS AND USING THEM TOGETHER GIVES A BETTER ANSWER TO HOW BEST TO USE CHRIS.,4,4,4,3,3,3,CHRIS HAS A JOB TO DO AND SHOULD DO HIS BEST BASED ON THE CONCLUSIONS THAT ARE REACHED BY THE ALGORITHM AND THE MANGER.,6,AN ALGORITHM HAS DETAILED INFORMATION ON PRIOR ISSUES AND THE ABILITY OF STAFF TO MAKE TO GOOD DECISION.,1,,,,,,,,,,,,,,,,,,,,,,,,,,,,,,,,,,,,,,,,,,,,,,,,,,,,,,,,,,,,,,,,,,,,,,,,,,,,,,,,,,,,,,,,,,,,,,,,,,,,,,,,,,,,,,,,,,,,,,,,,,,,,,,,,,,,,,1,58,1,5,1,4,1,
7/25/17 21:19,7/25/17 21:31,0,98.236.24.49,100,713,1,7/25/17 21:31,R_1n0L5RIShWFOBxV,,,,,40.16470337,-79.8239975,anonymous,EN,AYBWFPTVDWKYS,"1,2",3,6,,,,,,,,,,,,,,,,,,,,,,,,,,,,,,,,,,,,,,,,,,,,,,,,,3,The algorithm was tasked with scheduling employee shifts at the coffee shop based on analyses of both employee availability and customer traffic done by both the algorithm and a human manager.,"A set of computer processes meant to analyze data, perform calculations and reach a conclusion to solve a problem",,,,,,,,,,,,,,,,,,,,,,,,,,,,,,,,,,,,,,,,,,,,,,,,,,,,,,,,,,,,,6,"The algorithm is not being left on its own to make the decisions, a human manager is involved as well. Both are being employed to balance workplace and employee needs. The manager can act as a check on the algorithm if need be.",5,4,3,4,3,4,I have no idea how the shift assignment actually worked out for chris. I can only go by the idea that both the algorithm and manager working together came up with something that balances between the needs of the shop and employees. But that doesn't mean that all employees will be happy.,5,"A computer program can still get things wrong when it doesn't have the human ability to think and react to human situations. I'm sure the algorithm can do a fairly good job, but there will always be situations and variables it will not account for.",1,,,,,,,,,,,,,,,,,,,,,,,,,,,,,,,,,,,,,,,,,,,,,,,,,,,,,,,,,,,,,,,,,,,,,,,,,,,,,,,,,,,,,,,,,,,,,,,,,,,,,,,,,,,,,,,,,,,,,,,,,,2,51,1,5,1,4,2,
7/25/17 21:25,7/25/17 21:32,0,74.208.11.240,100,446,1,7/25/17 21:32,R_3hzLVKH0S1kSmZw,,,,,40.05479431,-75.40830231,anonymous,EN,A1YC558J4E5KZ,"1,2",3,6,6,This is part of Chris' job and it needs to be done.,4,2,2,2,2,3,"I think he would mainly be focused on doing his job, not on why/how he was assigned the task.",5,"As long as the manager does what the algorithm indicates is appropriate, he makes good decisions. But I bet he doesn't always do what the algorithm says.",1,,,,,,,,,,,,,,,,,,,,,,,,,,,,,,,,,,,,,3,"The algorithm determined the best course of action, and the manager made the final decision about what to do.","Rules, programmed by humans, that computers follow exactly.",,,,,,,,,,,,,,,,,,,,,,,,,,,,,,,,,,,,,,,,,,,,,,,,,,,,,,,,,,,,,,,,,,,,,,,,,,,,,,,,,,,,,,,,,,,,,,,,,,,,,,,,,,,,,,,,,,,,,,,,,,,,,,,,,,,,,,,,,,,,,,,,,,,,,,,,,,,,,,,,,,,,,,,,,,,,,,,,,,,,,,,,,,,,,,,,,,3,46,2,6,1,2,1,
