7/25/17 21:17,7/25/17 21:24,0,97.93.245.153,100,405,1,7/25/17 21:24,R_2QozY0xB6zJ4CEP,,,,,32.88130188,-97.36219788,anonymous,EN,A35G7IWTS9004D,"1,2",3,6,,,,,,,,,,,,,7,"It is fair that he schedules his employee to work whenever he needs him, regardless of how he came upon that decision.",4,4,4,4,4,4,I do not feel that the scenario provides enough information to determine how Chris would feel.,5,"He makes good employee scheduling for the coffee shop, but if you take into account the happiness of employees and flexibility of their work schedules, the employees may not like this method.",1,,,,,,,,,,,,,,,,,,,,,,,,,3,The algorithm determined the best possible times for employees to work and it was the managers job to take that into account and make their schedules based on it.,algorithms are computer calculations for getting a mathematically based answer to a question.,,,,,,,,,,,,,,,,,,,,,,,,,,,,,,,,,,,,,,,,,,,,,,,,,,,,,,,,,,,,,,,,,,,,,,,,,,,,,,,,,,,,,,,,,,,,,,,,,,,,,,,,,,,,,,,,,,,,,,,,,,,,,,,,,,,,,,,,,,,,,,,,,,,,,,,,,,,,,,,,,,,,,,,,,,,,,,,,,,,,,,,,,,,,,,,,,,1,32,1,2,1,2,2,
7/25/17 21:17,7/25/17 21:24,0,172.221.198.176,100,402,1,7/25/17 21:24,R_3dT9hazhkb02hG1,,,,,37.77209473,-90.36720276,anonymous,EN,A1MT1OXZGY8RJ2,"1,2",3,6,,,,,,,,,,,,,,,,,,,,,,,,,,,,,,,,,,,,,3,"If it monitors the customers comments it may not be as fair, he could just have bad luck and get all the mad/irate customers, which isnt his fault. ",4,3,4,6,5,6,If he got a bad rating bc of the tome of a customers voice or their comments I could see why. not everyone that calls in does so in a friendly manner. Some people have their mind set and dont care at all. Those kind of customers could ruin something like this for the workers,5,I trust that the manager does his job but not so much the algorithm in place,1,3,The algorithm monitors the customers comments and maybe tone of voice and the manager monitors the algorithm to be sure its doing its job,a set of calculating rules followed by a computer,,,,,,,,,,,,,,,,,,,,,,,,,,,,,,,,,,,,,,,,,,,,,,,,,,,,,,,,,,,,,,,,,,,,,,,,,,,,,,,,,,,,,,,,,,,,,,,,,,,,,,,,,,,,,,,,,,,,,,,,,,,,,,,,,,,,,,,,,,,,,,,,,,,,,,,,,,,,,,,,,,,,,,,,,,,,,,,,,,,,,,,,,,,,,,,,,,1,32,1,3,1,2,4,
7/25/17 21:18,7/25/17 21:24,0,74.88.208.249,100,338,1,7/25/17 21:24,R_1NfzOzSzL3trtO8,,,,,41.13119507,-74.36740112,anonymous,EN,A109RO014V1BOZ,"1,2",3,6,,,,,,,,,,,,,,,,,,,,,,,,,,,,,,,,,,,,,,,,,,,,,,,,,,,,,,,,,,,,,,,,,,,,,,,,,,,,,,,,,,,,,,,,,,,,,,,,,,,,,,,,,,,,,,,,,,,,,,,,,,,,,,,,,,,,,,,,,,,,,,,,,,,,,,,,,,,,,,,,,,,,,,,,,,,,,,,,,,,,,,,,,,,,,,,,,,,,5,7,CHris works in the factory and presumably is knowledgable about the machinery. It makes sense and seems fair that he would be responsible for checking components in the factory.,4,2,5,4,4,4,I don't think it would faze him that much since his job already has to do with working with machinery.,6,The manager seems to care a lot about the company since they are very diligent about checking parts and making sure everything is working correctly ,1,,,,,,,,,,,,,,,,,,,,,,,,,,,,,,,,,,,,,3,23,1,5,1,5,1,
7/25/17 21:17,7/25/17 21:24,0,50.90.244.97,100,432,1,7/25/17 21:24,R_1M3A93S2345o48J,,,,,39.78509521,-86.16649628,anonymous,EN,AGQ12PTGHKMDU,"1,2",3,6,,,,,,,,,,,,,,,,,,,,,,,,,,,,,,,,,,,,,,,,,,,,,,,,,3,The manager sets how the algorithm considers things but the algorithm does the actual analysis and final scoring. ,Algorithms are a set of instructions for computers to ensure they make decisions.  ,,,,,,,,,,,,,,,,,,,,,,,,,,,,,,,,,,,,,5,"IT seems fair since themanager is setting the basic expectations and the algorithm is ensuring no bias when it comes to the evaluation. However, sometime you need to make exceptions due to outside factors and the algorithm can't detect that. ",3,3,3,6,5,5,I think Chris would fine the expectations to be frustrating since he has no way to explain any extra circumstances or factors. ,4,The algorithm will be unbiased but I worry about hoe comprehensive it is. ,1,,,,,,,,,,,,,,,,,,,,,,,,,,,,,,,,,,,,,,,,,,,,,,,,,,,,,,,,,,,,,,,,,,,,,,,,,,,,,,,,,,,,,,,,,,,,,,,,,,,,,,,,,,,,,,,,,,,,,,,,,,,,,,,,,,,,,,,,,,,,,,,,,,2,30,1,6,1,3,4,
7/25/17 21:18,7/25/17 21:24,0,108.212.142.253,100,347,1,7/25/17 21:24,R_RX0XKfRiHLfgBH3,,,,,39.84370422,-82.89330292,anonymous,EN,A2J7XOAS72YN0,"1,2",3,6,,,,,,,,,,,,,,,,,,,,,,,,,,,,,,,,,,,,,5,I would think that customer feedback would be a more accurate gauge of performance,4,4,4,2,2,5,Performace rating may be skewed,5,"It sound like this was done for the first time, so he really doesn't know if the analysis works",1,3,"The algorithm measures tone of the employee and customer, and produces a report. The manager evaluates the report ",A set of rules or programs that helps computers with tasks,,,,,,,,,,,,,,,,,,,,,,,,,,,,,,,,,,,,,,,,,,,,,,,,,,,,,,,,,,,,,,,,,,,,,,,,,,,,,,,,,,,,,,,,,,,,,,,,,,,,,,,,,,,,,,,,,,,,,,,,,,,,,,,,,,,,,,,,,,,,,,,,,,,,,,,,,,,,,,,,,,,,,,,,,,,,,,,,,,,,,,,,,,,,,,,,,,1,48,2,5,2,2,4,
7/25/17 21:20,7/25/17 21:24,0,75.66.172.60,100,260,1,7/25/17 21:24,R_3KrpFhAF18cyo5M,,,,,35.09109497,-89.65100098,anonymous,EN,A1KZ6I92SWIN75,"1,2",3,6,,,,,,,,,,,,,,,,,,,,,,,,,,,,,,,,,,,,,,,,,,,,,,,,,,,They are mathematical code used to figure something out.,,,,,,,,,,,,,,,,,,,,,,,,,,,,,,,,,,,,,,,,,,,,,,,,,,,,,,,,,,,,,,,,,,,,,,,,,,,,,,,,,,,,,,,,,,,,,,,,,,,,,,,,,,,,,3,"I get that it's when the algorithm knows people are needed, but it doesn't take chris's personal schedule into consideration",3,3,2,4,3,4,"Mornings are usually when people work, so I'm not sure if he'd be angry, but I feel like he wouldn't necessarily be happy either",3,"I'm sure it makes sure there are always people in the store, but I'm not sure if it takes anyones needs into consideration",1,,,,,,,,,,,,,,,,,,,,,,,,,1,,,,,,,,,,,,,,,,,,,,,,,,,,,,,,,,,,,,,,,,,,,,,,,,,1,35,1,3,1,1,2,
7/25/17 21:19,7/25/17 21:24,0,73.214.83.191,100,282,1,7/25/17 21:24,R_2qEJVReNwIZ8uT6,,,,,39.64559937,-79.94329834,anonymous,EN,A2RCYLKY072XXO,"1,2",3,6,,,,,,,,,,,,,6,If Chris is available during mornings then the computer scheduling is fair.,4,4,4,4,4,4,"There is no context given for Chris's previous schedule, so it is impossible to know how the changes would make him feel. ",3,The manager should combine the algorithm with employee preferences. ,1,,,,,,,,,,,,,,,,,,,,,,,,,3,The algorithm computed a schedule and the manager used this analysis to schedule the employees. ,An algorithm is a system of calculations. ,,,,,,,,,,,,,,,,,,,,,,,,,,,,,,,,,,,,,,,,,,,,,,,,,,,,,,,,,,,,,,,,,,,,,,,,,,,,,,,,,,,,,,,,,,,,,,,,,,,,,,,,,,,,,,,,,,,,,,,,,,,,,,,,,,,,,,,,,,,,,,,,,,,,,,,,,,,,,,,,,,,,,,,,,,,,,,,,,,,,,,,,,,,,,,,,,,2,37,2,5,4,2,2,
7/25/17 21:18,7/25/17 21:24,0,97.73.28.53,100,349,1,7/25/17 21:24,R_sGtHa5GvhCqvH8d,,,,,37.75100708,-97.8219986,anonymous,EN,A29U4ZQRLMIB61,"1,2",3,6,,,,,,,,,,,,,,,,,,,,,,,,,,,,,,,,,,,,,,,,,,,,,,,,,,,,,,,,,,,,,,,,,,,,,,,,,,,,,,,,,,,,,,,,,,,,,,,,,,,,,,,,,,,,,,,,,,,,,,,,,,,,,,,,,,,,,,,,,,,,,,,,,,,,,,,,,,,,,,,,,,,,,,,,,,,,,,,,,,,,,,,,,,,,,,,,,,,,5,,,,,,,,,,,,,,,,,,,,,,,,,,,,,,,,,,,,,7,"In a setting where you are dealing with the public, it's in a company's best interest to make sure the public is receiving high quality customer service. ",3,3,5,4,4,5,"Depending on his work performance, he might feel proud or disappointed in having his actions evaluated. No matter his performance, he will surely be stressed out from being observed so closely. That's normal. ",4,I try to have at least some trust in everyone unless I have a reason not to. ,1,2,42,1,5,1,5,4,
7/25/17 21:19,7/25/17 21:24,0,67.249.186.196,100,348,1,7/25/17 21:24,R_1E56GlpSDUE0rRf,,,,,43.07620239,-75.00610352,anonymous,EN,A250FES5PFCGK9,"1,2",3,6,,,,,,,,,,,,,,,,,,,,,,,,,,,,,,,,,,,,,,,,,,,,,,,,,,,Computational AI that are designed to develop efficient practices ,,,,,,,,,,,,,,,,,,,,,,,,,,,,,,,,,,,,,,,,,,,,,,,,,,,,,,,,,,,,,,,,,,,,,,,,,,,,,,,,,,,,,,,,,,,,,,,,,7,The algorithm is predisposed to assign the task based on optimum conditions. Chris' job entails participating in the behavior.,4,4,4,4,4,4,"Chris would not likely have much feelings towards the algorithm, but personality traits could dictate a range of emotions.",6,The algorithm has an unbiased approach with inputs designed for efficiency.,1,,,,,,,,,,,,,,,,,,,,,,,,,,,,,,,,,,,,,1,,,,,,,,,,,,,,,,,,,,,,,,,,,,,,,,,,,,,,,,,,,,,,,,,2,35,2,5,1,1,1,
7/25/17 21:20,7/25/17 21:24,0,72.188.230.149,100,266,1,7/25/17 21:24,R_1gw1RdTp9HiqoBo,,,,,28.73129272,-81.51580048,anonymous,EN,A13B76IU2R3W8U,"1,2",3,6,,,,,,,,,,,,,,,,,,,,,,,,,,,,,,,,,,,,,,,,,,,,,,,,,,,Computer systems that solve problems by using certain equations.,,,,,,,,,,,,,,,,,,,,,,,,,,,,,,,,,,,,,,,,,,,,,,,,,,,,,,,,,,,,,,,,,,,,,,,,,,,,,,,,,,,,,,,,,,,,,,,,,,,,,,,,,,,,,6,I think it is fair because they are probably busier in the mornings so they need more staffing then.  It could be a little unfair based on Chris's availability.  ,4,4,4,4,3,3,If it is within his availability he shouldn't be upset.  He might not like waking up early but it is a job and he is getting hours.,5,Computers don't have the same empathy as a person does so they could schedule you ridiculous hours without noticing.,1,,,,,,,,,,,,,,,,,,,,,,,,,1,,,,,,,,,,,,,,,,,,,,,,,,,,,,,,,,,,,,,,,,,,,,,,,,,1,25,1,4,3,1,2,
7/25/17 21:18,7/25/17 21:25,0,68.36.215.223,100,401,1,7/25/17 21:25,R_1QrXDX7zo9ETQ6d,,,,,42.65800476,-83.18430328,anonymous,EN,A77K8W55MJEKX,"1,2",3,6,,,,,,,,,,,,,,,,,,,,,,,,,,,,,,,,,,,,,,,,,,,,,,,,,3,the roles include that of a subordinate and his supervisor and the supervisor using the algorithm to monitor his performance,they are a guide or indication of certain rules and their outcomes,,,,,,,,,,,,,,,,,,,,,,,,,,,,,,,,,,,,,5,"since it evaluates employee performances, it is fair to use the algorithm to monitor Chris' progress. ",3,4,4,5,4,5,"Chris does not want his performance to be compared to an algorithm, he'd prefer if his evaluation was free of biases. ",4,sometimes certain preset ideas don't always give the best outcome,1,,,,,,,,,,,,,,,,,,,,,,,,,,,,,,,,,,,,,,,,,,,,,,,,,,,,,,,,,,,,,,,,,,,,,,,,,,,,,,,,,,,,,,,,,,,,,,,,,,,,,,,,,,,,,,,,,,,,,,,,,,,,,,,,,,,,,,,,,,,,,,,,,,1,45,1,6,4,3,4,
7/25/17 21:18,7/25/17 21:25,0,192.241.204.127,100,405,1,7/25/17 21:25,R_RzgJ0a2ysUpKJah,,,,,37.73530579,-122.3731995,anonymous,EN,A3TTY62F3MXIK0,"1,2",3,6,,,,,,,,,,,,,,,,,,,,,,,,,,,,,,,,,,,,,,,,,,,,,,,,,,,,,,,,,,,,,,,,,,,,,,,,,,,,,,,,,,,,,,,,,,,,,,,,,,,,,,,,,,,,,,,,,,,,,,,,,,,,,,,,,,,,,,,,,,,,,,,,,,,,,,,,,,,,,,,,,,,,,,,,,,,,,,,,,,,,,,,,,,,,,,,,,,,,5,,,,,,,,,,,,,,,,,,,,,,,,,7,"How is this not fair? And, was Chris selected?  It doesn't say here. Chris is one of many people, the manager is the person getting to select who he wants to interview.  He doesn't know who Chris is.",4,4,4,4,4,4,Was Chris selected? It is not clear. The answers would be different if it were known whether or not Chris was selected.,5,"Depends on if he is the person working with the people he is interviewing, as well as how much experience he has in interviewing candidates.",1,,,,,,,,,,,,,2,55,1,5,1,5,3,
7/25/17 21:18,7/25/17 21:25,0,70.127.128.230,100,380,1,7/25/17 21:25,R_33EEnR0ezxNptGy,,,,,28.08590698,-82.76249695,anonymous,EN,A29AX5O8KL48F8,"1,2",3,6,6,"The algorithm sounds correct and the component does need to be checked. This sounds like Chris's job, so of course it's fair.",4,4,4,1,1,1,"Since it's a fair assignment, and other workers presumably will be assigned to their own components, there's no reason to believe Chris should be upset.",5,It seems like a fool-proof system. I don't see how a manager can make a poor decision based on the knowledge thus far.,1,,,,,,,,,,,,,,,,,,,,,,,,,,,,,,,,,,,,,3,The algorithm predicted which components are likely to break down and the manager assigned certain worker to perform maintenance on those parts.,They use past data on how often parts break down (based on cycles) and can predict close to the day it will break down again.,,,,,,,,,,,,,,,,,,,,,,,,,,,,,,,,,,,,,,,,,,,,,,,,,,,,,,,,,,,,,,,,,,,,,,,,,,,,,,,,,,,,,,,,,,,,,,,,,,,,,,,,,,,,,,,,,,,,,,,,,,,,,,,,,,,,,,,,,,,,,,,,,,,,,,,,,,,,,,,,,,,,,,,,,,,,,,,,,,,,,,,,,,,,,,,,,,2,35,2,5,4,2,1,
7/25/17 21:18,7/25/17 21:25,0,130.18.104.96,100,402,1,7/25/17 21:25,R_2UgxAyvsijB7CcY,,,,,33.45309448,-88.79319763,anonymous,EN,AW2IJYOPX2MSE,"1,2",3,6,,,,,,,,,,,,,,,,,,,,,,,,,,,,,,,,,,,,,,,,,,,,,,,,,3,they bothe analyse components but the algorithm makes the final decision,calculation models that come up with different scenarios or predictions and chooses the right one.,,,,,,,,,,,,,,,,,,,,,,,,,,,,,,,,,,,,,,,,,,,,,,,,,4,the algorithm needs to decide to ensure aaccuracy in the decisison,3,2,3,5,6,6,people dont like to feel uselss,5,im hoping the people who designed the algorithm knew what they were doing.,1,,,,,,,,,,,,,,,,,,,,,,,,,,,,,,,,,,,,,,,,,,,,,,,,,,,,,,,,,,,,,,,,,,,,,,,,,,,,,,,,,,,,,,,,,,,,,,,,,,,,,,,,,,,,,,,,,,,,,,,,,,,,,,,,,,,,,,3,19,1,2,2,4,1,
7/25/17 21:20,7/25/17 21:25,0,71.90.191.193,100,301,1,7/25/17 21:25,R_20U4Pz8IPr14vUt,,,,,30.53349304,-92.11630249,anonymous,EN,AB774I47XHB4K,"1,2",3,6,,,,,,,,,,,,,,,,,,,,,,,,,,,,,,,,,,,,,,,,,,,,,,,,,3,the algorith does the picking but the manager adjust the small things,I think it is a good thing,,,,,,,,,,,,,,,,,,,,,,,,,6,I think it will pick fairly,5,5,5,2,2,2,he should feel as if he had a good chance,6,it should be trustful,1,,,,,,,,,,,,,,,,,,,,,,,,,,,,,,,,,,,,,,,,,,,,,,,,,,,,,,,,,,,,,,,,,,,,,,,,,,,,,,,,,,,,,,,,,,,,,,,,,,,,,,,,,,,,,,,,,,,,,,,,,,,,,,,,,,,,,,,,,,,,,,,,,,,,,,,,,,,,,,1,20,2,2,2,3,3,
7/25/17 21:17,7/25/17 21:25,0,24.118.185.45,100,475,1,7/25/17 21:25,R_RPKkcx0ap8Psjeh,,,,,44.77990723,-93.2736969,anonymous,EN,A14D9PSNENZCDT,"1,2",3,6,,,,,,,,,,,,,,,,,,,,,,,,,,,,,,,,,,,,,,,,,,,,,,,,,,,equations to determine a score for targeted information,,,,,,,,,,,,,,,,,,,,,,,,,,,,,,,,,,,,,,,,,,,,,,,,,,,,,,,,,,,,,,,,,,,,,,,,,,,,,,,,,,,,,,,,,,,,,,,,,,,,,,,,,,,,,,,,,,,,,,,,,,,,,,,,,,,,,3,I don't understand how an algorithm could analyze a social interaction fairly,4,4,4,4,4,4,There is no information regarding what the results for so I don't have any ideas about what he would feel,3,I don't understand how this could work which makes me doubt its effectiveness,1,1,,,,,,,,,,,,,,,,,,,,,,,,,,,,,,,,,,,,,,,,,,,,,,,,,1,30,1,5,1,1,4,
7/25/17 21:19,7/25/17 21:25,0,47.222.176.170,100,355,1,7/25/17 21:25,R_1jdfpxc6Cn4FjVp,,,,,31.73010254,-94.47850037,anonymous,EN,A1F3TWJXGO0URG,"1,2",3,6,,,,,,,,,,,,,6,I think it is somewhat fair because it takes into account availability and the amount of employees needed. It is not arbitrary.,5,4,2,3,4,4,"I think if Chris has already given the times he can work to his manager, he really can't complain much about when he scheduled to work.  ",6,I think the manager likes it because it takes into account the needs of the coffee shop and the employees. It is a fair process.,1,,,,,,,,,,,,,,,,,,,,,,,,,3,"The algorithm determined when people should work, and I'm assuming that the manager had to input employee availability.","Algorithms are math problems that help determine the likelihood of an event or make determinations about what should be done when. For instance, Google search uses an algorithm.",,,,,,,,,,,,,,,,,,,,,,,,,,,,,,,,,,,,,,,,,,,,,,,,,,,,,,,,,,,,,,,,,,,,,,,,,,,,,,,,,,,,,,,,,,,,,,,,,,,,,,,,,,,,,,,,,,,,,,,,,,,,,,,,,,,,,,,,,,,,,,,,,,,,,,,,,,,,,,,,,,,,,,,,,,,,,,,,,,,,,,,,,,,,,,,,,,1,41,1,6,1,2,2,
7/25/17 21:19,7/25/17 21:25,0,73.104.50.248,100,404,1,7/25/17 21:25,R_9mIP1OJGznE66RP,,,,,32.07870483,-81.05809784,anonymous,EN,AH4MHB0B0PJMU,"1,2",3,6,,,,,,,,,,,,,,,,,,,,,,,,,,,,,,,,,,,,,,,,,,,,,,,,,,,A calculation or some kind of rules to solve a problem.,,,,,,,,,,,,,,,,,,,,,,,,,,,,,,,,,,,,,,,,,,,,,,,,,,,,,,,,,,,,,,,,,,,,,,,,,,,,,,,,,,,,,,,,,,,,,,,,,,,,,,,,,,,,,,,,,,,,,,,,,5,"I think it is somewhat fair because an algorithm can analyze a resume, but I think it takes a person to truly say if someone is top quality. ",2,4,2,4,3,5,I don't think many would be to happy having an algorithm decide how qualified they are for a job. ,3,I just think that there are some qualities an algorithm cannot pick up on. Only a real person can. ,1,,,,,,,,,,,,,1,,,,,,,,,,,,,,,,,,,,,,,,,,,,,,,,,,,,,,,,,,,,,,,,,1,25,2,3,2,1,3,
7/25/17 21:17,7/25/17 21:25,0,174.130.51.228,100,514,1,7/25/17 21:25,R_2zwoxhHv6y2bgsX,,,,,41.31520081,-81.44049835,anonymous,EN,AHR1EZCJ31IKJ,"1,2",3,6,,,,,,,,,,,,,,,,,,,,,,,,,6,Algorithms can weed out people whom are not qualified and who list certain key points that are important to the company and therefore move them into top consideration. That seems fair to me. ,4,4,4,4,4,4,"If Chris is qualified, and has key points on his resume, then he has nothing to worry about. ",6,He's in a managerial position for a reason and that involves good judgement and knowing what type of candidate is a good fit for what the company is looking for in regards to the position. ,1,,,,,,,,,,,,,3,The algorithm sorts through the paperwork and presents the best candidates to choose from. They make the hiring process quicker and more efficient. ,An algorithm picks up on key words or phrases. ,,,,,,,,,,,,,,,,,,,,,,,,,,,,,,,,,,,,,,,,,,,,,,,,,,,,,,,,,,,,,,,,,,,,,,,,,,,,,,,,,,,,,,,,,,,,,,,,,,,,,,,,,,,,,,,,,,,,,,,,,,,,,,,,,,,,,,,,,,,,,,,,,,,,,,,,,,,,,,,,,,,,,,,,,,,,,,,,,,,,,,,,,,,,,,,,,,1,44,1,5,1,2,3,
7/25/17 21:19,7/25/17 21:25,0,66.177.20.60,100,410,1,7/25/17 21:25,R_3CIXJJVhOuKlo4k,,,,,30.17959595,-81.51820374,anonymous,EN,A2T2ENF8E9FX68,"1,2",3,6,,,,,,,,,,,,,,,,,,,,,,,,,,,,,,,,,,,,,,,,,,,,,,,,,3,"The algorithm sorted applications to select candidates for a personal interview, and the human manager guided the algorithm's actions.",A complex set of computer instructions and rules used by software to accomplish tasks and simulate intelligence.,,,,,,,,,,,,,,,,,,,,,,,,,6,"If that is how the company has decided to hire people, then it is a fair process. If Chris doesn't want to participate in that kind of hiring process, he can apply to a different firm that uses different interview criteria.",4,3,3,5,5,5,"I imagine he would prefer to be evaluated by a human, but the ultimate feelings on the process would be shaped by the outcome. If Chris is selected, he'd probably be very happy in the end.",3,I think there is a human element to hiring that cannot be fully explained or automated away. The best candidates aren't always obvious on paper.,1,,,,,,,,,,,,,,,,,,,,,,,,,,,,,,,,,,,,,,,,,,,,,,,,,,,,,,,,,,,,,,,,,,,,,,,,,,,,,,,,,,,,,,,,,,,,,,,,,,,,,,,,,,,,,,,,,,,,,,,,,,,,,,,,,,,,,,,,,,,,,,,,,,,,,,,,,,,,,,1,35,2,4,1,3,3,
7/25/17 21:20,7/25/17 21:26,0,68.185.39.178,100,341,1,7/25/17 21:26,R_3Ja6SIZadwodHdc,,,,,46.32820129,-119.3222046,anonymous,EN,A80PZ8RASZZJI,"1,2",3,6,,,,,,,,,,,,,,,,,,,,,,,,,,,,,,,,,,,,,,,,,,,,,,,,,3,"The manager judges the importance of the components and the algorithm chooses them base on their history of breakdowns, but the algorithm has the ""final say""",Mathematical equations that serve a specific purpose and can be programmed into machines,,,,,,,,,,,,,,,,,,,,,,,,,,,,,,,,,,,,,,,,,,,,,,,,,7,Seems like a good way to ensure efficiency in the workplace,5,5,5,1,1,1,It's his job to what's assigned and there's nothing unfair about the situation,6,An algorithm is just a tool; it isn't subject to bias or discrimination like a human might be,1,,,,,,,,,,,,,,,,,,,,,,,,,,,,,,,,,,,,,,,,,,,,,,,,,,,,,,,,,,,,,,,,,,,,,,,,,,,,,,,,,,,,,,,,,,,,,,,,,,,,,,,,,,,,,,,,,,,,,,,,,,,,,,,,,,,,,,1,25,2,5,1,4,1,
7/25/17 21:21,7/25/17 21:26,0,129.237.108.35,100,290,1,7/25/17 21:26,R_3HRm7oEJ9iXnUNh,,,,,38.97169495,-95.23519897,anonymous,EN,A3CEGI4XS8PT58,"1,2",3,6,,,,,,,,,,,,,,,,,,,,,,,,,,,,,,,,,,,,,,,,,,,,,,,,,3,"The manager picked through several applicants, but the algorithm sorted through thousands.  It was a two part process.",A computer process that looks for specific values.,,,,,,,,,,,,,,,,,,,,,,,,,,,,,,,,,,,,,,,,,,,,,,,,,,,,,,,,,,,,,,,,,,,,,,,,,3,There are people who are better suited for a job even if they don't look the greatest on paper.,3,3,2,6,6,7,It has to be frustrating that it isn't a manager making the decision for who should be hired.,3,I'm sure there are good qualities to the algorithm but the algorithm can't know everything.,1,,,,,,,,,,,,,,,,,,,,,,,,,,,,,,,,,,,,,,,,,,,,,,,,,,,,,,,,,,,,,,,,,,,,,,,,,,,,,,,,,,,,,,,,,,,,,,,,,,,,,,,,,,,,,,1,21,1,3,1,4,3,
7/25/17 21:18,7/25/17 21:26,0,208.157.173.184,100,493,1,7/25/17 21:26,R_1DYV4SLdk80r1pG,,,,,44.9763031,-92.36730194,anonymous,EN,A38Z10YT1VO5T6,"1,2",3,6,,,,,,,,,,,,,,,,,,,,,,,,,,,,,,,,,,,,,,,,,,,,,,,,,,,"Algorithms are computer programs that look for key phrases or certain layouts to pick the best possible applicants by a specific measure, and throw out anyone else",,,,,,,,,,,,,,,,,,,,,,,,,,,,,,,,,,,,,,,,,,,,,,,,,,,,,,,,,,,,,,,,,,,,,,,,,,,,,,,,,,,,,,,,,,,,,,,,,,,,,,,,,,,,,,,,,,,,,,,,,3,An algorithm that looks for keywords rather than the overall message may be passing over applicants that are better for the job than others,4,3,3,6,4,6,"In that kind of position, one would be hard pressed to be happy over a computer choosing who moves on rather than an actual person looking over their resume",2,"Keywords and structure cannot accurately select the best possible applicants, in my opinion",1,,,,,,,,,,,,,1,,,,,,,,,,,,,,,,,,,,,,,,,,,,,,,,,,,,,,,,,,,,,,,,,1,23,2,5,1,1,3,
7/25/17 21:19,7/25/17 21:26,0,173.26.102.6,100,418,1,7/25/17 21:26,R_20OTdhnyWehOGqY,,,,,37.29989624,-93.30840302,anonymous,EN,A1ZT30BGR3266K,"1,2",3,6,,,,,,,,,,,,,,,,,,,,,,,,,,,,,,,,,,,,,,,,,,,,,,,,,,,It's a program that searches for and identifies specified information.,,,,,,,,,,,,,,,,,,,,,,,,,,,,,,,,,,,,,,,,,,,,,,,,,,,,,,,,,,,,,,,,,,,,,,,,,,,,,,,,,,,,,,,,,,,,,,,,,,,,,,,,,,,,,,,,,,,,,,,,,5,If everyone is chosen in the same manner then the process is really somewhat fair.,3,2,4,4,3,5,He is probably pretty anxious that he will be judged solely by a mechanism than no human controls.,3,The algorithm is bound to identify some quality candidates based on it's programming.,1,,,,,,,,,,,,,1,,,,,,,,,,,,,,,,,,,,,,,,,,,,,,,,,,,,,,,,,,,,,,,,,1,32,1,4,1,1,3,
7/25/17 21:18,7/25/17 21:26,0,75.85.3.193,100,466,1,7/25/17 21:26,R_eh8BUfEx1EgXtRv,,,,,21.34689331,-158.0182953,anonymous,EN,A2IYFIFGMO8N0F,"1,2",3,6,,,,,,,,,,,,,,,,,,,,,,,,,,,,,,,,,,,,,,,,,,,,,,,,,,,,,,,,,,,,,,,,,,,,,,,,,,,,,,,,,,,,,,,,,,,,,,,,,,,,,,,,,,,,,,,,,,,,,,,,,,,,,,,,,,,,,,,,,,,,,,,,,,,,,,,,,,,,,,,,,,,,,,,,,,,,,,,,,,,,,,,,,,,,,,,,,,,,5,7,It is Chris' responsibility and job assignment to do the maintenance task.,4,4,6,1,1,1,If he works for this company and that is his assignment then be should be able to do it without any ill feelings. I would think he would take pride in his work.,6,"If you work for a company and must report to a manager, it is in good faith that the task is of good quality and there should be trust between managers and their employees.",1,,,,,,,,,,,,,,,,,,,,,,,,,,,,,,,,,,,,,1,52,1,5,1,5,1,
7/25/17 21:19,7/25/17 21:26,0,98.20.224.246,100,425,1,7/25/17 21:26,R_2XjSFp5n2Zk5cUf,,,,,31.95219421,-97.34590149,anonymous,EN,A359S477C2ZWER,"1,2",3,6,,,,,,,,,,,,,,,,,,,,,,,,,,,,,,,,,,,,,,,,,,,,,,,,,,,A set of criteria that is programmed into a computer that follows its predetermined process to a specific end when given variable information ,,,,,,,,,,,,,,,,,,,,,,,,,,,,,,,,,,,,,,,,,,,,,,,,,,,,,,,,,,,,,,,,,,,,,,,,,,,,,,,,,,,,,,,,,,,,,,,,,,,,,,,,,,,,,3,The algorithm can't decide in favor of Chris at any point so if he has a need for time off he can't ask for it.,5,3,2,4,2,5,Perhaps Chris is not a morning person and would do better with customer service when he is awake and fully functioning... he is happy to have a job but a little frustrated that he has to work mornings,2,It is only as good as the information it was given and may not be capable of taking into consideration anything other than availability ,1,,,,,,,,,,,,,,,,,,,,,,,,,1,,,,,,,,,,,,,,,,,,,,,,,,,,,,,,,,,,,,,,,,,,,,,,,,,1,51,1,5,1,1,2,
7/25/17 21:20,7/25/17 21:26,0,73.141.229.84,100,366,1,7/25/17 21:26,R_suTuBJ7nW4CRRWV,,,,,39.75120544,-75.52719879,anonymous,EN,A33CY9EY50SSLI,"1,2",3,6,,,,,,,,,,,,,,,,,,,,,,,,,,,,,,,,,,,,,,,,,,,,,,,,,,,,,,,,,,,,,,,,,,,,,,,,,,,,,,,,,,,,,,,,,,,,,,,,,,,,,,,,,,,,,,,,,,,,,,,,,,,,,,,,,,,,,,,,,,,,,,,,,,,,,,,,,,,,,,,,,,,,,,,,,,,,,,,,,,,,,,,,,,,,,,,,,,,,5,,,,,,,,,,,,,,,,,,,,,,,,,6,"The manager looks over every resume, giving everyone an equal chance.",5,4,5,3,2,3,"The manager is looking at every resume, which is a good thing. Because it's fair there's no reason to be angry.",6,"People make mistakes, but hopefully the manager has stayed a manager because he is a good judge of character.",1,,,,,,,,,,,,,1,29,1,3,2,5,3,
7/25/17 21:22,7/25/17 21:26,0,107.188.146.178,100,285,1,7/25/17 21:26,R_WkUO16So3lvOONH,,,,,40.22639465,-111.6969986,anonymous,EN,A2GV9WSNSPX53,"1,2",3,6,,,,,,,,,,,,,,,,,,,,,,,,,,,,,,,,,,,,,5,The fairness is OK because the algorithm has been set up to help receive proper feedback about employees and the manager also gets the final say.,3,3,2,4,5,5,I think he would like a human to receive the feedback because the emotion is better put in there. The algorithm could leave some to be desired.,4,"I believe the algorithm can make basic decisions well, and if anything extreme comes up the manager will be able to exercise judgment in proper evaluation.",1,3,The algorithm was responsible for the evaluation of employees and then the manager would have the final say on any decision the algorithm makes.,a rule set that is programmed into some sort of process to solve a problem,,,,,,,,,,,,,,,,,,,,,,,,,,,,,,,,,,,,,,,,,,,,,,,,,,,,,,,,,,,,,,,,,,,,,,,,,,,,,,,,,,,,,,,,,,,,,,,,,,,,,,,,,,,,,,,,,,,,,,,,,,,,,,,,,,,,,,,,,,,,,,,,,,,,,,,,,,,,,,,,,,,,,,,,,,,,,,,,,,,,,,,,,,,,,,,,,,2,24,2,5,1,2,4,
