7/21/17 9:33,7/21/17 9:40,0,99.116.17.237,100,368,1,7/21/17 9:40,R_3MbeiiZZmdQ8Hnt,,,,,37.53720093,-120.8487015,anonymous,EN,A3NMU6AVMQ0QDB,"1,2",3,6,,,,,,,,,,,,,,,,,,,,,,,,,,,,,,,,,,,,,1,The manager should listen to call recordings directly without relying on the algorithmic interpretation of a computer generated report,1,1,1,7,4,7,"No one wants a robot telling them how to do their job. If you humans want to remain in control, they must rely less on software and more on their own reasoning and rationality",1,"An algorithm is going to have type I and type II errors, I would rather take evaluation of a seasoned human who has experience and training",1,3,"The algorithm conduct an analysis of call recordings, the manager reviews the report generated by the algorithm to make a final evaluation of the call center employees performance.","Algorithms are both static and dynamic formulated processes that are increasing relying on neural networks, Stochastic statistics, and machine learning theory to generate artificially intelligent synthetic reasoning, interpretation, and analysis of human behavior for both predicting outcomes and manipulating behavior according to preprogrammed objectives. ",,,,,,,,,,,,,,,,,,,,,,,,,,,,,,,,,,,,,,,,,,,,,,,,,,,,,,,,,,,,,,,,,,,,,,,,,,,,,,,,,,,,,,,,,,,,,,,,,,,,,,,,,,,,,,,,,,,,,,,,,,,,,,,,,,,,,,,,,,,,,,,,,,,,,,,,,,,,,,,,,,,,,,,,,,,,,,,,,,,,,,,,,,,,,,,,,,2,32,2,4,4,2,4,
7/21/17 9:35,7/21/17 9:40,0,24.151.194.91,100,304,1,7/21/17 9:40,R_Rb5wspb4ftY5kdz,,,,,34.79820251,-84.90820313,anonymous,EN,AGVIHLR1DX7,"1,2",3,6,,,,,,,,,,,,,,,,,,,,,,,,,,,,,,,,,,,,,,,,,,,,,,,,,,,,,,,,,,,,,,,,,,,,,,,,,,,,,,,,,,,,,,,,,,,,,,,,,,,,,,,,,,,,,,,,,,,,,,,,,,,,,,,,,,,,,,,,,,,,,,,,,,,,,,,,,,,,,,,,,,,,,,,,,,,,,,,,,,,,,,,,,,,,,,,,,,,,5,7,The manager expects his employees to check and update certain components for the company. Chris is an employee and it is expected of him so it is very fair.,7,7,7,1,1,1,Chris should feel happy and proud that his manager felt he was competent to complete this special job. His manager obviously sees Chris in a positive way.,7,He makes good quality decisions because he picks those that works with the machinery the closest and would be the ones to notice when there needed to be work.,1,,,,,,,,,,,,,,,,,,,,,,,,,,,,,,,,,,,,,1,32,2,3,1,5,1,
7/21/17 9:34,7/21/17 9:40,0,68.48.224.103,100,314,1,7/21/17 9:40,R_1IRTakQUR7C5N0B,,,,,42.07460022,-83.22669983,anonymous,EN,A256CNCYJ4PUH9,"1,2",3,6,,,,,,,,,,,,,,,,,,,,,,,,,,,,,,,,,,,,,,,,,,,,,,,,,,,,,,,,,,,,,,,,,,,,,,,,,,,,,,,,,,,,,,,,,,,,,,,,,,,,,,,,,,,,,,,,,,,,,,,,,,,,,,,,,,,,,,,,,,,,,,,,,,,,,,,,,,,,,,,,,,,,,,,,,,,,,,,,,,,,,,,,,,,,,,,,,,,,5,,,,,,,,,,,,,,,,,,,,,,,,,,,,,,,,,,,,,7,It's fair to evaluate his performance to ensure quality customer service.,3,2,5,4,2,2,Chris may be a good employee but still not like the feeling of being evaluated. ,6,I trust that the managers are fair and unbiased when evaluating employees performance. ,1,1,32,1,3,1,5,4,
7/21/17 9:36,7/21/17 9:40,0,69.246.44.22,100,213,1,7/21/17 9:40,R_2uBjAPOPLuyPbgZ,,,,,35.11329651,-89.90209961,anonymous,EN,A1B6MZ6X8DX20T,"1,2",3,6,,,,,,,,,,,,,,,,,,,,,,,,,,,,,,,,,,,,,,,,,,,,,,,,,,,An algorithm is function or equation with determined variables and constants that can be used to assess and predict future data.,,,,,,,,,,,,,,,,,,,,,,,,,,,,,,,,,,,,,,,,,,,,,,,,,,,,,,,,,,,,,,,,,,,,,,,,,,,,,,,,,,,,,,,,,,,,,,,,,3,Algorithms cannot account for all gray areas.,3,3,3,5,5,5,Being judged without human sensitivity is a scary thing.,4,"I am sure that there is valid data derived from the algorithm, although there are probably inaccuracies as well.",1,,,,,,,,,,,,,,,,,,,,,,,,,,,,,,,,,,,,,1,,,,,,,,,,,,,,,,,,,,,,,,,,,,,,,,,,,,,,,,,,,,,,,,,2,29,1,5,1,1,1,
7/21/17 9:33,7/21/17 9:40,0,24.4.117.91,100,399,1,7/21/17 9:40,R_3QM3diE9IcPGEiF,,,,,37.81289673,-121.9743042,anonymous,EN,A2DUOTGJDZWUCV,"1,2",3,6,,,,,,,,,,,,,,,,,,,,,,,,,,,,,,,,,,,,,,,,,,,,,,,,,3,The manager used an algorithm to monitor performance.,basically an equation/system to measure something.,,,,,,,,,,,,,,,,,,,,,,,,,,,,,,,,,,,,,2,"It does not take into account a human, emotive, social element to work performance.  The human element is important in such a job.",4,4,4,4,4,4,"I have no idea how Chris would feel.  I don't know Chris, and I am not him.  I could remark on how I would feel.",1,"A computer is not able to evaluate human to human behavior because such behavior has ethical, psychological, and phenomenological implications and norms.  How can artificial intelligence evaluate morality and social ethics?",1,,,,,,,,,,,,,,,,,,,,,,,,,,,,,,,,,,,,,,,,,,,,,,,,,,,,,,,,,,,,,,,,,,,,,,,,,,,,,,,,,,,,,,,,,,,,,,,,,,,,,,,,,,,,,,,,,,,,,,,,,,,,,,,,,,,,,,,,,,,,,,,,,,1,39,2,6,1,3,4,
7/21/17 9:34,7/21/17 9:40,0,50.111.32.142,100,372,1,7/21/17 9:40,R_22Mrt2qKZH0JfWA,,,,,35.18330383,-83.43070221,anonymous,EN,ANZUE8VX5IMDO,"1,2",3,6,,,,,,,,,,,,,,,,,,,,,,,,,,,,,,,,,,,,,,,,,,,,,,,,,3,The algorithm analyses the information to make the scheduling decisions but it is monitored and can be adjusted by the manager.,A set of rules to determine actions by.,,,,,,,,,,,,,6,The algorithm is monitored by a real person and can be adjusted so I feel this makes it a human decision and is fair.,4,4,4,3,3,3,"I don't think Chris would feel anything in particular, nothing more then any employee might feel.",5,Since it is being monitored I feel the algorithm is likely fair or it wouldn't be used.,2,,,,,,,,,,,,,,,,,,,,,,,,,,,,,,,,,,,,,,,,,,,,,,,,,,,,,,,,,,,,,,,,,,,,,,,,,,,,,,,,,,,,,,,,,,,,,,,,,,,,,,,,,,,,,,,,,,,,,,,,,,,,,,,,,,,,,,,,,,,,,,,,,,,,,,,,,,,,,,,,,,,,,,,,,,1,50,2,2,1,3,2,
7/21/17 9:34,7/21/17 9:40,0,204.86.250.21,100,359,1,7/21/17 9:40,R_1liwOlXOyAp4QJp,,,,,40.74490356,-73.97820282,anonymous,EN,AZFON83L6QYWJ,"1,2",3,6,,,,,,,,,,,,,,,,,,,,,,,,,,,,,,,,,,,,,,,,,,,,,,,,,,,,,,,,,,,,,,,,,,,,,,,,,,,,,,,,,,,,,,,,,,,,,,,,,,,,,,,,,,,,,,,,,,,,,,,,,,,,,,,,,,,,,,,,,,,,,,,,,,,,,,,,,,,,,,,,,,,,,,,,,,,,,,,,,,,,,,,,,,,,,,,,,,,,5,,,,,,,,,,,,,,,,,,,,,,,,,7,"It is fair because the manager knows the qualifications of the job and is able to find people that suit that description, including Chris'. Chris as the same chance as all others for the job, thus it is fair.",4,4,4,5,4,5,He would feel neutral about most of these emotions because they are neither biased towards or against Chris. He may feel frustrated and disappointed because the process is long and tiring.,6,"The manager is forced to be unbiased when looking at resumes of people he doesn't know. He needs to be objective, therefore, I think he would be very trsutworthy with people he does not know.",1,,,,,,,,,,,,,1,26,1,5,3,5,3,
7/21/17 9:33,7/21/17 9:40,0,75.147.113.177,100,399,1,7/21/17 9:40,R_2scMkIRi4q9Aj6B,,,,,40.62210083,-74.24459839,anonymous,EN,A22LLCN5WBKJJI,"1,2",3,6,,,,,,,,,,,,,,,,,,,,,,,,,,,,,,,,,,,,,,,,,,,,,,,,,,,Algorithms are series of conditions met through a criteria set by the maker to derive a result or response for the end user,,,,,,,,,,,,,,,,,,,,,,,,,,,,,,,,,,,,,,,,,,,,,,,,,,,,,,,,,,,,,,,,,,,,,,,,,,,,,,,,,,,,,,,,,,,,,,,,,,,,,,,,,,,,,,,,,,,,,,,,,2,Algorithms can be exploited. I feel the lack of human element in selecting a candidate for employment is crucial,3,3,3,5,5,5,Chris would see his application is being screen by a code as opposed to the employer itself as a bit cold. ,3,"Since code and formula is man made, there can be a possibe exploit that someone under qualified can be taken over someoone qualified",1,,,,,,,,,,,,,1,,,,,,,,,,,,,,,,,,,,,,,,,,,,,,,,,,,,,,,,,,,,,,,,,2,32,2,5,3,1,3,
7/21/17 9:34,7/21/17 9:40,0,73.135.27.138,100,389,1,7/21/17 9:40,R_DNtlzYbzYHdwJrz,,,,,39.34300232,-76.68579865,anonymous,EN,A1OG2E3OUZ13D3,"1,2",3,6,,,,,,,,,,,,,,,,,,,,,,,,,,,,,,,,,,,,,,,,,,,,,,,,,3,The algorithm was monitoring the worker's performance and the manager was responsible for adjusting and fine-tuning the algorithm.,Algorithms are sets of processes that are designed to perform a particular task or tasks in a consistent manner.,,,,,,,,,,,,,,,,,,,,,,,,,,,,,,,,,,,,,6,"I would say that it is fair because the manager is responsible for fine tuning the algorithm, which would be a reflection of how the manager would evaluate.",5,5,5,2,2,2,"I think he would be okay with the algorithm. The manager is involved in adjusting it, so it is essentially an automated way of giving an evaluation. ",5,"I gave this answer because I do believe that it can be trustworthy, depending on the integrity of the manager. I would say that I would expect the manager to be fair.",1,,,,,,,,,,,,,,,,,,,,,,,,,,,,,,,,,,,,,,,,,,,,,,,,,,,,,,,,,,,,,,,,,,,,,,,,,,,,,,,,,,,,,,,,,,,,,,,,,,,,,,,,,,,,,,,,,,,,,,,,,,,,,,,,,,,,,,,,,,,,,,,,,,2,31,2,6,2,3,4,
7/21/17 9:34,7/21/17 9:40,0,73.96.102.2,100,384,1,7/21/17 9:40,R_1DzZF0lJVToGlTC,,,,,45.6678009,-123.1546021,anonymous,EN,A289TLY20GCMVU,"1,2",3,6,,,,,,,,,,,,,,,,,,,,,,,,,,,,,,,,,,,,,,,,,,,,,,,,,,,Programs that take data from multiple sources and organize it into what you need.,,,,,,,,,,,,,,,,,,,,,,,,,,,,,,,,,,,,,,,,,,,,,,,,,,,,,,,,,,,,,,,,,,,,,,,,,,,,,,,,,,,,,,,,,,,,,,,,,4,I'm not sure there is a question of fairness when a program is just creating a list for a mechanic to check.  ,5,4,4,1,1,1,There's no reason Chris should feel negatively about a computer program that is helping him be more effective in his job.  That to me seems similar to an administrative assistant being upset with spell check.,5,"Computer programs make mistakes, so they should always be used with the expectation that you need to double check.",1,,,,,,,,,,,,,,,,,,,,,,,,,,,,,,,,,,,,,1,,,,,,,,,,,,,,,,,,,,,,,,,,,,,,,,,,,,,,,,,,,,,,,,,1,33,1,3,1,1,1,
7/21/17 9:36,7/21/17 9:40,0,73.192.78.7,100,283,1,7/21/17 9:40,R_3hGSigX08bEJq6u,,,,,31.18229675,-81.49259949,anonymous,EN,AXR6R3X65V2ZG,"1,2",3,6,,,,,,,,,,,,,,,,,,,,,,,,,,,,,,,,,,,,,,,,,,,,,,,,,3,The algorithm selected top applicants by analyzing resumes and statements and the manager oversaw and adjusted the algorithm.,A program with a set way of going through data.,,,,,,,,,,,,,,,,,,,,,,,,,3,The manager by himself might pick Chris when the algorithm wouldn't.,2,3,3,5,3,5,He might feel like there's nothing he can do to influence the hiring process.,5,I trust the algorithm to pick qualified applicants but I don't think it could make good character judgements.,1,,,,,,,,,,,,,,,,,,,,,,,,,,,,,,,,,,,,,,,,,,,,,,,,,,,,,,,,,,,,,,,,,,,,,,,,,,,,,,,,,,,,,,,,,,,,,,,,,,,,,,,,,,,,,,,,,,,,,,,,,,,,,,,,,,,,,,,,,,,,,,,,,,,,,,,,,,,,,,2,22,1,3,1,3,3,
7/21/17 9:34,7/21/17 9:40,0,104.172.111.88,100,384,1,7/21/17 9:40,R_1hMd5E0V0yw1PQL,,,,,34.29420471,-118.5070953,anonymous,EN,A2Y749J0XM6TIW,"1,2",3,6,,,,,,,,,,,,,4,It could be during a period where it is not busy or a period of time when it is the busiest.  ,4,4,4,4,4,4,"Again, Chris may prefer to work when it's less busy or prefer to work when the shop is at its busiest",4,Manager is assigning staff to improve service,1,,,,,,,,,,,,,,,,,,,,,,,,,3,Manager used the algorithm to decide when and whom to schedule work shifts.,Set of rules computers/programs follow.,,,,,,,,,,,,,,,,,,,,,,,,,,,,,,,,,,,,,,,,,,,,,,,,,,,,,,,,,,,,,,,,,,,,,,,,,,,,,,,,,,,,,,,,,,,,,,,,,,,,,,,,,,,,,,,,,,,,,,,,,,,,,,,,,,,,,,,,,,,,,,,,,,,,,,,,,,,,,,,,,,,,,,,,,,,,,,,,,,,,,,,,,,,,,,,,,,2,34,2,5,4,2,2,
7/21/17 9:34,7/21/17 9:41,0,172.90.194.47,100,399,1,7/21/17 9:41,R_1myL5SO6zVV5MON,,,,,33.91290283,-118.3439026,anonymous,EN,A3OW5EFQ5QFD19,"1,2",3,6,,,,,,,,,,,,,,,,,,,,,,,,,,,,,,,,,,,,,,,,,,,,,,,,,,,Programs that analyze data and try to develop advice or output based on the data averages. ,,,,,,,,,,,,,,,,,,,,,,,,,,,,,,,,,,,,,,,,,,,,,,,,,,,,,,,,,,,,,,,,,,,,,,,,,,,,,,,,,,,,,,,,,,,,,,,,,6,There would be nothing inherently unfair about Chris being assigned to check a component. ,4,3,4,2,3,4,I think Chris would generally remain neutral about the assignment unless he was having a bad day. ,4,My trust would depend on who came up with the algorithm. ,1,,,,,,,,,,,,,,,,,,,,,,,,,,,,,,,,,,,,,1,,,,,,,,,,,,,,,,,,,,,,,,,,,,,,,,,,,,,,,,,,,,,,,,,1,29,1,5,2,1,1,
7/21/17 9:37,7/21/17 9:41,0,76.185.166.104,100,232,1,7/21/17 9:41,R_Pwh1xGAX18T45Sp,,,,,29.46220398,-98.44219971,anonymous,EN,A1YO03P3SSC7CD,"1,2",3,6,,,,,,,,,,,,,,,,,,,,,,,,,,,,,,,,,,,,,,,,,,,,,,,,,3,"The manager monitored the algorithm, which scheduled the employees for their shifts.",They're a computer program that uses a set of rules to make decisions.,,,,,,,,,,,,,6,"Computers are just machines following rules that they are told to. It's unbiased, and it's a good way to make the decisions.",4,4,2,1,3,3,"I don't think he would be too happy, but I don't think that he would be really angry about it, either.",5,"The algorithm is probably pretty good, but with most computer programs it more than likely has room for improvement.",1,,,,,,,,,,,,,,,,,,,,,,,,,,,,,,,,,,,,,,,,,,,,,,,,,,,,,,,,,,,,,,,,,,,,,,,,,,,,,,,,,,,,,,,,,,,,,,,,,,,,,,,,,,,,,,,,,,,,,,,,,,,,,,,,,,,,,,,,,,,,,,,,,,,,,,,,,,,,,,,,,,,,,,,,,,2,34,1,5,1,3,2,
7/21/17 9:33,7/21/17 9:41,0,74.143.50.180,100,457,1,7/21/17 9:41,R_10vgl53quSWVCji,,,,,38.18409729,-86.15229797,anonymous,EN,ATUY1BTU5BQDE,"1,2",3,6,,,,,,,,,,,,,,,,,,,,,,,,,,,,,,,,,,,,,,,,,,,,,,,,,3,The manage analyzes the employee and the algorithm analyzed the number of customers and it chooses the best time for an employee to work. ,Compute based calculations.,,,,,,,,,,,,,,,,,,,,,,,,,,,,,,,,,,,,,,,,,,,,,,,,,,,,,,,,,,,,,5,"It's fair because it's the best time for him to work. Also, a little unfair because he might not want to work mornings.",3,2,1,1,2,5,He would be frustrated because he has to change shifts and start working at a different time.,6,The algorithm has no bias or emotion so it chooses the best outcome.,1,,,,,,,,,,,,,,,,,,,,,,,,,,,,,,,,,,,,,,,,,,,,,,,,,,,,,,,,,,,,,,,,,,,,,,,,,,,,,,,,,,,,,,,,,,,,,,,,,,,,,,,,,,,,,,,,,,,,,,,,,,2,22,2,2,1,4,2,
7/21/17 9:34,7/21/17 9:41,0,24.123.94.218,100,426,1,7/21/17 9:41,R_qRvYQZwQ01rQlW1,,,,,44.18429565,-88.53050232,anonymous,EN,AWE9A4ZOP9LNU,"1,2",3,6,7,Chris must obey his manager. His manager determined what Chris should do based off the algorithm so Chris is obligated to do what he is told.,4,3,4,3,2,4,Chris would feel that he is being bossed around but feels obligated to follow instructions.,6,Assuming that the algorithm is based on the correct data I would put a lot of trust in it.,1,,,,,,,,,,,,,,,,,,,,,,,,,,,,,,,,,,,,,3,The manager determine what Chris should work on based off of the algorithm. His decision was based off of the algorithm so they worked hand in hand.,They are sets of information that are plugged into a formula to determine things.,,,,,,,,,,,,,,,,,,,,,,,,,,,,,,,,,,,,,,,,,,,,,,,,,,,,,,,,,,,,,,,,,,,,,,,,,,,,,,,,,,,,,,,,,,,,,,,,,,,,,,,,,,,,,,,,,,,,,,,,,,,,,,,,,,,,,,,,,,,,,,,,,,,,,,,,,,,,,,,,,,,,,,,,,,,,,,,,,,,,,,,,,,,,,,,,,,1,35,2,5,1,2,1,
7/21/17 9:34,7/21/17 9:41,0,104.32.37.92,100,419,1,7/21/17 9:41,R_NUvAgsVqMkUB6i5,,,,,33.88720703,-118.3547974,anonymous,EN,A1Z0O5MC9DAE8C,"1,2",3,6,,,,,,,,,,,,,,,,,,,,,,,,,,,,,,,,,,,,,,,,,,,,,,,,,3,"The manager uses the call recordings, and the algorithm looks at customer comments. The algorithm then makes a final decision based on both of those factors.",Something that comes to a decision based on logic and procedures that are predetermined.,,,,,,,,,,,,,,,,,,,,,,,,,,,,,,,,,,,,,,,,,,,,,,,,,,,,,,,,,,,,,,,,,,,,,,,,,,,,,,,,,,,,,5,"The manager is there to give a human analysis of his past call recordings, in case the algorithm gives an inaccurate decision.",3,4,3,4,5,5,"I think he would feel that the algorithm could make an inaccurate decision, and the manager don't have enough influence to fix that.",3,I think there are too many small details and nuances to customer comments and call recordings for an algorithm to make an accurate decision.,1,,,,,,,,,,,,,,,,,,,,,,,,,,,,,,,,,,,,,,,,,,,,,,,,,,,,,,,,,,,,,,,,,,,,,,,,,,,,,,,,,,,,,,,,,,,,,,,,,,3,31,1,5,4,4,4,
7/21/17 9:37,7/21/17 9:41,0,24.20.181.160,100,225,1,7/21/17 9:41,R_SV8an8rmKin6FSp,,,,,45.58479309,-122.9116974,anonymous,EN,A3SGNSLG6DNY7B,"1,2",3,6,,,,,,,,,,,,,,,,,,,,,,,,,,,,,,,,,,,,,,,,,,,,,,,,,,,"Algorithms are programmed to make decisions. It's basically a formula that tries to make the best decision based on the information it has, typically it's computerized.",,,,,,,,,,,,,,,,,,,,,,,,,,,,,,,,,,,,,,,,,,,,,,,,,,,,,,,,,,,,,,,,,,,,,,,,,,,,,,,,,,,,,,,,,,,,,,,,,,,,,,,,,,,,,6,"It's an algorithm, it doesn't make biased judgments so it's fair that it scheduled him that way.",2,2,1,4,2,2,"It's unclear if Chris wants to work mornings or not, so I don't think he'd really feel any of these things strongly.",6,"It likely does a better job than a person could, people usually forget when you are available and schedule you at times you aren't able to work.",1,,,,,,,,,,,,,,,,,,,,,,,,,1,,,,,,,,,,,,,,,,,,,,,,,,,,,,,,,,,,,,,,,,,,,,,,,,,1,34,1,5,1,1,2,
7/21/17 9:38,7/21/17 9:41,0,98.160.177.125,100,187,1,7/21/17 9:41,R_3iIqEUB64xdgd5o,,,,,36.03120422,-115.0738983,anonymous,EN,AQORJW4W8U9YU,"1,2",3,6,,,,,,,,,,,,,,,,,,,,,,,,,,,,,,,,,,,,,,,,,,,,,,,,,,,Algorithm is a formula that is used to calculate certain data points.,,,,,,,,,,,,,,,,,,,,,,,,,,,,,,,,,,,,,,,,,,,,,,,,,,,,,,,,,,,,,,,,,,,,,,,,,,,,,,,,,,,,,,,,,,,,,,,,,,,,,,,,,,,,,,,,,,,,,,,,,5,It is fair because they are looking for certain criteria and Chris fits that.,5,5,6,4,1,1,I believe chris would be happy and elated that he gets an interview,6,Trust is something that is imperative.,1,,,,,,,,,,,,,1,,,,,,,,,,,,,,,,,,,,,,,,,,,,,,,,,,,,,,,,,,,,,,,,,2,30,2,5,1,1,3,
7/21/17 9:33,7/21/17 9:41,0,192.110.200.44,100,474,1,7/21/17 9:41,R_2TT2EUOf0eXjXSs,,,,,41.48669434,-90.57250214,anonymous,EN,AHX8CAANIM62U,"1,2",3,6,,,,,,,,,,,,,5,I think it is somewhat fair to schedule a worker when work is available.  Medical staff is often staffed according to peak times.,4,4,4,4,3,3,"Depending on Chris's expectations for scheduling, his reactions would be effected.   Assuming he knows this is how it's done, he shouldn't be too upset.",4,"Because it is a standardized method, I have some trust in the manager.",1,,,,,,,,,,,,,,,,,,,,,,,,,3,The manager scheduled his employee based on the results of the algorithm.  The algorithm results gave suggestions as to who and when people should be scheduled.,Computer calculations based on data.,,,,,,,,,,,,,,,,,,,,,,,,,,,,,,,,,,,,,,,,,,,,,,,,,,,,,,,,,,,,,,,,,,,,,,,,,,,,,,,,,,,,,,,,,,,,,,,,,,,,,,,,,,,,,,,,,,,,,,,,,,,,,,,,,,,,,,,,,,,,,,,,,,,,,,,,,,,,,,,,,,,,,,,,,,,,,,,,,,,,,,,,,,,,,,,,,,1,39,1,5,1,2,2,
7/21/17 9:34,7/21/17 9:42,0,68.206.79.214,100,434,1,7/21/17 9:42,R_115f7zeP9k3vcvt,,,,,25.98249817,-97.47250366,anonymous,EN,AR4UI9K92BUT3,"1,2",3,6,,,,,,,,,,,,,,,,,,,,,,,,,,,,,,,,,,,,,,,,,,,,,,,,,3,The information is input into the machine and the machine assesses the candidates and that output is again assessed by the manager.,"Formulas. As in if x is equivalent to either and/or all of A,B,C, then x is to be selected/not selected.",,,,,,,,,,,,,,,,,,,,,,,,,,,,,,,,,,,,,,,,,,,,,,,,,,,,,,,,,,,,,,,,,,,,,,,,,6,It would seem that the machine selects factors and makes judgment calls on those qualifiers only. The machine doesn't mindlessly not select someone.,2,2,4,5,4,5,"Without knowing Chris, I assume that he would definitely be disappointed but doubt if he would blame a machine for not being considered.",5,"Machines are only as good as the information that is input.  If certain characteristics are wanted in an applicant, the machine selects those who have the characteristics.",1,,,,,,,,,,,,,,,,,,,,,,,,,,,,,,,,,,,,,,,,,,,,,,,,,,,,,,,,,,,,,,,,,,,,,,,,,,,,,,,,,,,,,,,,,,,,,,,,,,,,,,,,,,,,,,2,67,1,5,1,4,3,
7/21/17 9:40,7/21/17 9:42,0,138.254.99.50,100,98,1,7/21/17 9:42,R_2TAWrGycNpuIjKm,,,,,32.77870178,-96.82170105,anonymous,EN,A2WVH84QT97HX2,"1,2",3,6,,,,,,,,,,,,,,,,,,,,,,,,,,,,,,,,,,,,,,,,,,,,,,,,,,,,,,,,,,,,,,,,,,,,,,,,,,,,,,,,,,,,,,,,,,,,,,,,,,,,,,,,,,,,,,,,,,,,,,,,,,,,,,,,,,,,,,,,,,,,,,,,,,,,,,,,,,,,,,,,,,,,,,,,,,,,,,,,,,,,,,,,,,,,,,,,,,,,5,,,,,,,,,,,,,,,,,,,,,,,,,6,Well that's a fair way to pick your interviewees,7,7,7,1,1,1,Well he can't be upset. He got a fair deal,6,Well it seems like the manager is a fair guy which means he should be trustworthy as well.,1,,,,,,,,,,,,,3,29,2,4,1,5,3,
7/21/17 9:36,7/21/17 9:42,0,172.249.177.213,100,328,1,7/21/17 9:42,R_2cvkl03826M1GlA,,,,,34.11250305,-118.1907959,anonymous,EN,A21753FQKCM5DQ,"1,2",3,6,,,,,,,,,,,,,,,,,,,,,,,,,,,,,,,,,,,,,3,I feel like the algorithm is good for somethings but the program might miss something important and human about the employees performance. ,3,3,2,5,3,6,He would feel like he has no control over the outcome and that most of his fate is in the hands of a computer program. ,5,The manager is the manager for a reason I hope he makes good decisions. ,1,3,The manager would review what the altorithm told him about the employee chris. ,They are computer programs that processes and anylizes aspects of human interest. ,,,,,,,,,,,,,,,,,,,,,,,,,,,,,,,,,,,,,,,,,,,,,,,,,,,,,,,,,,,,,,,,,,,,,,,,,,,,,,,,,,,,,,,,,,,,,,,,,,,,,,,,,,,,,,,,,,,,,,,,,,,,,,,,,,,,,,,,,,,,,,,,,,,,,,,,,,,,,,,,,,,,,,,,,,,,,,,,,,,,,,,,,,,,,,,,,,2,32,2,3,1,2,4,
7/21/17 9:38,7/21/17 9:42,0,173.216.4.203,100,233,1,7/21/17 9:42,R_3MN0YpkqySh0Q7m,,,,,34.94610596,-92.08580017,anonymous,EN,A2V4PRG5UBNIX0,"1,2",3,6,,,,,,,,,,,,,,,,,,,,,,,,,,,,,,,,,,,,,,,,,,,,,,,,,3,The manager would oversee the algorthm,There computer input objective input flow processes,6,The human will oversee the process,5,4,3,3,2,4,chris might feel like he is not valued and being replaced by a machine,5,Algorithms are constantly upgrading themselves,1,,,,,,,,,,,,,,,,,,,,,,,,,,,,,,,,,,,,,,,,,,,,,,,,,,,,,,,,,,,,,,,,,,,,,,,,,,,,,,,,,,,,,,,,,,,,,,,,,,,,,,,,,,,,,,,,,,,,,,,,,,,,,,,,,,,,,,,,,,,,,,,,,,,,,,,,,,,,,,,,,,,,,,,,,,,,,,,,,,,,,,1,43,1,6,1,3,1,
7/21/17 9:33,7/21/17 9:42,0,71.74.5.246,100,502,1,7/21/17 9:42,R_qyIRjlHl5svTa6Z,,,,,34.75950623,-77.50189972,anonymous,EN,A1GUPBAMVB6C03,"1,2",3,6,,,,,,,,,,,,,,,,,,,,,,,,,,,,,,,,,,,,,,,,,,,,,,,,,1,the manager and the algorithm work together actually to figure out the role of someone in the history it shows back who is right for what,a way of seeing maybe someones brain waves of knowledge to point you in the direction they need to be in,,,,,,,,,,,,,,,,,,,,,,,,,,,,,,,,,,,,,,,,,,,,,,,,,7,based on the algorithm he is the perfect candidate to do it,6,1,5,1,1,1,although it lacks enough information to possibly say but i would think he would be in a state of happiness to do this,5,i don't really know i trust the outcome honestly but i guess i could give it moderate  trust. to me at the end it could be all wrong as well.,1,,,,,,,,,,,,,,,,,,,,,,,,,,,,,,,,,,,,,,,,,,,,,,,,,,,,,,,,,,,,,,,,,,,,,,,,,,,,,,,,,,,,,,,,,,,,,,,,,,,,,,,,,,,,,,,,,,,,,,,,,,,,,,,,,,,,,,1,35,1,1,5,4,1,
7/21/17 9:34,7/21/17 9:42,0,73.149.4.141,100,491,1,7/21/17 9:42,R_1InpczyR2kE7MHj,,,,,41.86480713,-72.68190002,anonymous,EN,A3USP1ZP069KCK,"1,2",3,6,,,,,,,,,,,,,,,,,,,,,,,,,,,,,,,,,,,,,,,,,,,,,,,,,,,Mathematical functions that analyze data and produce a result.,,,,,,,,,,,,,,,,,,,,,,,,,,,,,,,,,,,,,,,,,,,,,,,,,,,,,,,,,,,,,,,,,,,,,,,,,,,,,,,,,,,,,,,,,,,,,,,,,,,,,,,,,,,,,,,,,,,,,,,,,5,"I think the algorithm will not have the same amount of bias as a human reviewer, but it will likely have a degree of bias from the programmer.",4,2,3,6,6,5,"I think Chris will distrust the algorithm and feel it's too impersonal, that he's up against a system that has no way of creating exceptions to the rule.",4,I believe the algorithm will find the candidates who meet the job specs in theory...though it might not be best for the department in actuality,1,,,,,,,,,,,,,1,,,,,,,,,,,,,,,,,,,,,,,,,,,,,,,,,,,,,,,,,,,,,,,,,2,31,1,4,2,1,3,
7/21/17 9:40,7/21/17 9:42,0,68.5.223.62,100,160,1,7/21/17 9:42,R_2q9FVNJ1Q38P9Cg,,,,,33.6053009,-117.7173004,anonymous,EN,A3FAURB3U6YND5,"1,2",3,6,,,,,,,,,,,,,,,,,,,,,,,,,,,,,,,,,,,,,,,,,,,,,,,,,,,,,,,,,,,,,,,,,,,,,,,,,,,,,,,,,,,,,,,,,,,,,,,,,,,,,,,,,,,,,,,,,,,,,,,,,,,,,,,,,,,,,,,,,,,,,,,,,,,,,,,,,,,,,,,,,,,,,,,,,,,,,,,,,,,,,,,,,,,,,,,,,,,,5,,,,,,,,,,,,,,,,,,,,,,,,,7,Why wouldn't you select top applicants?,7,7,7,1,1,1,"If Chris is a top applicant and his resume was chosen, he should be very pleased.",5,"I mean, I assume he knows what he's doing.",1,,,,,,,,,,,,,1,29,1,4,1,5,3,
7/21/17 9:34,7/21/17 9:42,0,104.152.104.33,100,524,1,7/21/17 9:42,R_2VOav196u3FWV6n,,,,,47.61450195,-122.3479996,anonymous,EN,A10GJ2FOR16B2I,"1,2",3,6,,,,,,,,,,,,,,,,,,,,,,,,,,,,,,,,,,,,,,,,,,,,,,,,,3,Algorithm reviews resumes while manager reviews personal statements.,Algorithms are sets of computer code designed to carry out an analysis-based task whose end result is not known.,,,,,,,,,,,,,,,,,,,,,,,,,,,,,,,,,,,,,,,,,,,,,,,,,,,,,,,,,,,,,,,,,,,,,,,,,4,I would need to see how the algorithm works.,1,1,1,7,7,7,The average person would feel less safe if the application process is not fully handled by a human.,4,As I said before I would need to see how the algorithm works.,1,,,,,,,,,,,,,,,,,,,,,,,,,,,,,,,,,,,,,,,,,,,,,,,,,,,,,,,,,,,,,,,,,,,,,,,,,,,,,,,,,,,,,,,,,,,,,,,,,,,,,,,,,,,,,,4,30,1,7,1,4,3,
7/21/17 9:34,7/21/17 9:42,0,174.50.196.157,100,497,1,7/21/17 9:42,R_qDa5ER59QDEutMd,,,,,37.01539612,-88.58049774,anonymous,EN,A1DT0H2EO194VS,"1,2",3,6,,,,,,,,,,,,,,,,,,,,,,,,,,,,,,,,,,,,,,,,,,,,,,,,,3,provide employee evaluation with input from both the manager and the algorithm,algorithms are evaluations based on computer data,,,,,,,,,,,,,,,,,,,,,,,,,,,,,,,,,,,,,,,,,,,,,,,,,,,,,,,,,,,,,,,,,,,,,,,,,,,,,,,,,,,,,3,"somewhat unfair to be evaluated by an unfeeling entity, especially if you don't know what the algorithm is based on",2,2,4,4,5,6,probably relies more on the results than the methods,3,would have to know a little more about the basis of the algorithm and the weight of each,1,,,,,,,,,,,,,,,,,,,,,,,,,,,,,,,,,,,,,,,,,,,,,,,,,,,,,,,,,,,,,,,,,,,,,,,,,,,,,,,,,,,,,,,,,,,,,,,,,,2,43,2,4,1,4,4,
