7/21/17 9:54,7/21/17 10:01,0,184.99.242.16,100,424,1,7/21/17 10:01,R_3j3erk8wiPOJPEk,,,,,39.73199463,-104.983902,anonymous,EN,A2W46GI83TICBR,"1,2",3,6,,,,,,,,,,,,,,,,,,,,,,,,,,,,,,,,,,,,,,,,,,,,,,,,,,,"Programs designed by humans to analyze data input and create a response in result. Essentially: If A --&gt; B, if B--&gt;C etc. ",,,,,,,,,,,,,,,,,,,,,,,,,,,,,,,,,,,,,,,,,,,,,,,,,,,,,,,,,,,,,,,,,,,,,,,,,,,,,,,,,,,,,,,,,,,,,,,,,7,The algorithm is assigning the task based on past data. It has no personal input to the matter.,2,2,2,2,2,2,I don't think Chris would have any strong feelings about this. Getting the assignment is part of his job. ,6,It is a program designed by humans with data from the past. It is likely fairly accurate and should be checked in the event of consistent accuracy.  ,1,,,,,,,,,,,,,,,,,,,,,,,,,,,,,,,,,,,,,1,,,,,,,,,,,,,,,,,,,,,,,,,,,,,,,,,,,,,,,,,,,,,,,,,1,34,1,5,7,1,1,
7/21/17 9:59,7/21/17 10:01,0,107.77.219.32,100,142,1,7/21/17 10:01,R_1LIGD2dgTwigREW,,,,,32.29879761,-90.18479919,anonymous,EN,A1LJGU5YKVCRYK,"1,2",3,6,,,,,,,,,,,,,,,,,,,,,,,,,,,,,,,,,,,,,,,,,,,,,,,,,,,,,,,,,,,,,,,,,,,,,,,,,,,,,,,,,,,,,,,,,,,,,,,,,,,,,,,,,,,,,,,,,,,,,,,,,,,,,,,,,,,,,,,,,,,,,,,,,,,,,,,,,,,,,,,,,,,,,,,,,,,,,,,,,,,,,,,,,,,,,,,,,,,,5,6,The manager is supposed to delegate tasks. ,4,4,5,2,1,2,"It's Chris's job to do the assigned task, he shouldn't be mad about it. ",7,He seems to be doing his job. ,1,,,,,,,,,,,,,,,,,,,,,,,,,,,,,,,,,,,,,1,31,2,3,1,5,1,
7/21/17 9:56,7/21/17 10:01,0,72.168.145.249,100,324,1,7/21/17 10:01,R_1nVEA9VcVGLsm2F,,,,,34.74650574,-92.28959656,anonymous,EN,A1DQFIS6LDBR4S,"1,2",3,6,,,,,,,,,,,,,,,,,,,,,,,,,,,,,,,,,,,,,,,,,,,,,,,,,,,,,,,,,,,,,,,,,,,,,,,,,,,,,,,,,,,,,,,,,,,,,,,,,,,,,,,,,,,,,,,,,,,,,,,,,,,,,,,,,,,,,,,,,,,,,,,,,,,,,,,,,,,,,,,,,,,,,,,,,,,,,,,,,,,,,,,,,,,,,,,,,,,,5,,,,,,,,,,,,,,,,,,,,,,,,,,,,,,,,,,,,,7,It was stated that it was the managers job to evaluate her employees.,4,4,4,1,1,1,Chris should be compliant.,4,I would have to know more about the manager.,1,1,41,1,3,1,5,4,
7/21/17 9:49,7/21/17 10:02,0,174.97.245.118,100,818,1,7/21/17 10:02,R_3ndEbE3VkHXwEmE,,,,,39.3578949,-87.42449951,anonymous,EN,A36MOV8E6SYHCR,"1,2",3,6,,,,,,,,,,,,,,,,,,,,,,,,,,,,,,,,,,,,,,,,,,,,,,,,,,,,,,,,,,,,,,,,,,,,,,,,,,,,,,,,,,,,,,,,,,,,,,,,,,,,,,,,,,,,,,,,,,,,,,,,,,,,,,,,,,,,,,,,,,,,,,,,,,,,,,,,,,,,,,,,,,,,,,,,,,,,,,,,,,,,,,,,,,,,,,,,,,,,5,6,the manager trusts chris,5,5,6,4,2,4,"chris likely wants to be the manager someday, so this is a test at his skillset",6,the manager sees something good in chris,1,,,,,,,,,,,,,,,,,,,,,,,,,,,,,,,,,,,,,2,34,2,2,1,5,1,
7/21/17 9:56,7/21/17 10:03,0,71.200.44.54,100,400,1,7/21/17 10:03,R_3Dj250TkjlmIlR5,,,,,39.18170166,-75.5970993,anonymous,EN,A1MMXVKCYK6QCH,"1,2",3,6,,,,,,,,,,,,,,,,,,,,,,,,,,,,,,,,,,,,,,,,,,,,,,,,,3,"The manager and algorithm both analyze the situation, but the algorithm makes the final decision.",Algorithms are rules usually created by logic and math,,,,,,,,,,,,,,,,,,,,,,,,,,,,,,,,,,,,,,,,,,,,,,,,,5,It's pretty fair because there's human and algorithm factors involved,4,4,4,4,4,4,I feel like Chris would feel indifferent,5,I trust the assessment pretty well because I have no reason not to,1,,,,,,,,,,,,,,,,,,,,,,,,,,,,,,,,,,,,,,,,,,,,,,,,,,,,,,,,,,,,,,,,,,,,,,,,,,,,,,,,,,,,,,,,,,,,,,,,,,,,,,,,,,,,,,,,,,,,,,,,,,,,,,,,,,,,,,3,19,2,3,1,4,1,
7/21/17 9:54,7/21/17 10:04,0,47.18.19.206,100,617,1,7/21/17 10:04,R_0TKfggDaDqcSXV7,,,,,40.61000061,-73.91079712,anonymous,EN,A3W4MAKNDI1SXM,"1,2",3,6,,,,,,,,,,,,,,,,,,,,,,,,,,,,,,,,,,,,,,,,,,,,,,,,,3,The algorithm assigns the job based on what they think needs to be worked on.  The manager wil monitior this and can change things based on work conditions. ,"Formulas or calculations put into a program and based on this, it will tell you when repairs or services need to be completed.",5,"It seems fair to me, since the algorithm should know what needs to be done. ",5,4,4,2,3,2,"He should be happy, he is doing his job and getting paid to do it. ",5,I would think the algorithm has been tested and is accurate. so why not trust it. ,1,,,,,,,,,,,,,,,,,,,,,,,,,,,,,,,,,,,,,,,,,,,,,,,,,,,,,,,,,,,,,,,,,,,,,,,,,,,,,,,,,,,,,,,,,,,,,,,,,,,,,,,,,,,,,,,,,,,,,,,,,,,,,,,,,,,,,,,,,,,,,,,,,,,,,,,,,,,,,,,,,,,,,,,,,,,,,,,,,,,,,,1,50,1,5,1,3,1,
7/21/17 9:56,7/21/17 10:05,0,107.185.100.246,100,572,1,7/21/17 10:05,R_2BeW2VV26H64hwt,,,,,33.79699707,-118.0624008,anonymous,EN,A1CUDBHABW56JO,"1,2",3,6,,,,,,,,,,,,,,,,,,,,,,,,,,,,,,,,,,,,,,,,,,,,,,,,,3, Algorithm was choose the best person and it was in managers to override it ,equations in the computer to make the best choice ,,,,,,,,,,,,,,,,,,,,,,,,,4,It's a program that's how it works,4,4,4,4,4,4,Unwarranted ,6,How it's supposed to work ,1,,,,,,,,,,,,,,,,,,,,,,,,,,,,,,,,,,,,,,,,,,,,,,,,,,,,,,,,,,,,,,,,,,,,,,,,,,,,,,,,,,,,,,,,,,,,,,,,,,,,,,,,,,,,,,,,,,,,,,,,,,,,,,,,,,,,,,,,,,,,,,,,,,,,,,,,,,,,,,1,38,1,5,1,3,3,
7/21/17 10:02,7/21/17 10:06,0,45.27.232.55,100,234,1,7/21/17 10:06,R_DTu7p5UA3hHZZZL,,,,,30.353302,-81.49900055,anonymous,EN,A1AHYAWHM0ML7H,"1,2",3,6,7,"Chris is assigned to fix or check a part that is most likely to need maintenance based on the algorithm, rather than guessing.",5,4,2,2,2,2,I think Chris would appreciate the algorithm's predictions about what parts to service rather than blindly checking everything constantly.,6,The algorithm provides the most full proof predictions.,1,,,,,,,,,,,,,,,,,,,,,,,,,,,,,,,,,,,,,3,The algorithm determines what parts to service and the manager takes this information to assign a worker to maintain these parts on the machine.,Algorithms are a functioning set of rules that help to determine an outcome.,,,,,,,,,,,,,,,,,,,,,,,,,,,,,,,,,,,,,,,,,,,,,,,,,,,,,,,,,,,,,,,,,,,,,,,,,,,,,,,,,,,,,,,,,,,,,,,,,,,,,,,,,,,,,,,,,,,,,,,,,,,,,,,,,,,,,,,,,,,,,,,,,,,,,,,,,,,,,,,,,,,,,,,,,,,,,,,,,,,,,,,,,,,,,,,,,,1,29,1,5,1,2,1,
7/21/17 10:26,7/21/17 10:29,0,47.145.114.50,100,166,1,7/21/17 10:29,R_2ZVMJywtWAfeNen,,,,,33.86610413,-118.0527954,anonymous,EN,AJZZOD77TYA2X,"1,2",3,6,,,,,,,,,,,,,,,,,,,,,,,,,,,,,,,,,,,,,,,,,,,,,,,,,,,It's some type of robot that analyzes situations.,,,,,,,,,,,,,,,,,,,,,,,,,,,,,,,,,,,,,,,,,,,,,,,,,,,,,,,,,,,,,,,,,,,,,,,,,,,,,,,,,,,,,,,,,,,,,,,,,,,,,,,,,,,,,,,,,,,,,,,,,,,,,,,,,,,,,6,The algorithm is not biased so it's fair. ,5,5,4,3,3,3,He probably wouldn't really care,5,It is unbiased but it may be inaccurate at times. ,1,1,,,,,,,,,,,,,,,,,,,,,,,,,,,,,,,,,,,,,,,,,,,,,,,,,1,20,1,4,4,1,4,