StartDate,EndDate,Status,IPAddress,Progress,Duration (in seconds),Finished,RecordedDate,ResponseId,RecipientLastName,RecipientFirstName,RecipientEmail,ExternalReference,LocationLatitude,LocationLongitude,DistributionChannel,UserLanguage,Q112,Q72,Q92_1,Q96_1,Q1724,Q1725,Q1726_1,Q1726_2,Q1726_3,Q1726_4,Q1726_5,Q1726_6,Q1727,Q1728,Q1729,Q1730,Q1757,Q1758,Q1759_1,Q1759_2,Q1759_3,Q1759_4,Q1759_5,Q1759_6,Q1760,Q1761,Q1762,Q1763,Q1787,Q1788,Q1789_1,Q1789_2,Q1789_3,Q1789_4,Q1789_5,Q1789_6,Q1790,Q1791,Q1792,Q1793,Q1817,Q1818,Q1819_1,Q1819_2,Q1819_3,Q1819_4,Q1819_5,Q1819_6,Q1820,Q1821,Q1822,Q1823,Q1861,Q1862,Q867,Q1734,Q1735,Q1736_1,Q1736_2,Q1736_3,Q1736_4,Q1736_5,Q1736_6,Q1737,Q1738,Q1739,Q1740,Q1767,Q1768,Q1769_1,Q1769_2,Q1769_3,Q1769_4,Q1769_5,Q1769_6,Q1770,Q1771,Q1772,Q1773,Q1797,Q1798,Q1799_1,Q1799_2,Q1799_3,Q1799_4,Q1799_5,Q1799_6,Q1800,Q1801,Q1802,Q1803,Q1827,Q1828,Q1829_1,Q1829_2,Q1829_3,Q1829_4,Q1829_5,Q1829_6,Q1830,Q1831,Q1832,Q1833,Q1744,Q1745,Q1746_1,Q1746_2,Q1746_3,Q1746_4,Q1746_5,Q1746_6,Q1747,Q1748,Q1749,Q1750,Q1777,Q1778,Q1779_1,Q1779_2,Q1779_3,Q1779_4,Q1779_5,Q1779_6,Q1780,Q1781,Q1782,Q1783,Q1807,Q1808,Q1809_1,Q1809_2,Q1809_3,Q1809_4,Q1809_5,Q1809_6,Q1810,Q1811,Q1812,Q1813,Q1837,Q1838,Q1839_1,Q1839_2,Q1839_3,Q1839_4,Q1839_5,Q1839_6,Q1840,Q1841,Q1842,Q1843,Q1684,Q1685,Q1686_1,Q1686_2,Q1686_3,Q1686_4,Q1686_5,Q1686_6,Q1687,Q1688,Q1689,Q1690,Q1694,Q1695,Q1696_1,Q1696_2,Q1696_3,Q1696_4,Q1696_5,Q1696_6,Q1697,Q1698,Q1699,Q1700,Q1704,Q1705,Q1706_1,Q1706_2,Q1706_3,Q1706_4,Q1706_5,Q1706_6,Q1707,Q1708,Q1709,Q1710,Q1714,Q1715,Q1716_1,Q1716_2,Q1716_3,Q1716_4,Q1716_5,Q1716_6,Q1717,Q1718,Q1719,Q1720,Q98,Q1644,Q1645,Q1646_1,Q1646_2,Q1646_3,Q1646_4,Q1646_5,Q1646_6,Q1647,Q1648,Q1649,Q1650,Q1654,Q1655,Q1656_1,Q1656_2,Q1656_3,Q1656_4,Q1656_5,Q1656_6,Q1657,Q1658,Q1659,Q1660,Q1664,Q1665,Q1666_1,Q1666_2,Q1666_3,Q1666_4,Q1666_5,Q1666_6,Q1667,Q1668,Q1669,Q1670,Q1674,Q1675,Q1676_1,Q1676_2,Q1676_3,Q1676_4,Q1676_5,Q1676_6,Q1677,Q1678,Q1679,Q1680,Q69,Q67,Q64,Q69 2,Q73,type,task,Enter Embedded Data Field Name Here...
7/21/17 14:10,7/21/17 14:12,0,100.40.102.29,100,113,1,7/21/17 14:12,R_33ycCIUO90Ceuf5,,,,,41.70500183,-71.46040344,anonymous,EN,AD1ILDUXZHASF,"1,2",3,6,,,,,,,,,,,,,,,,,,,,,,,,,,,,,,,,,,,,,,,,,,,,,,,,,,,,,,,,,,,,,,,,,,,,,,,,,,,,,,,,,,,,,,,,,,,,,,,,,,,,,,,,,,,,,,,,,,,,,,,,,,,,,,,,,,,,,,,,,,,,,,,,,,,,,,,,,,,,,,,,,,,,,,,,,,,,,,,,,,,,,,,,,,,,,,,,,,,,5,,,,,,,,,,,,,,,,,,,,,,,,,7,If they're the best they deserve to be picked.,4,4,4,4,4,4,It's how it should go.,4,People are bias,1,,,,,,,,,,,,,3,30,2,4,1,5,3,
7/21/17 14:10,7/21/17 14:12,0,23.145.0.126,100,153,1,7/21/17 14:12,R_6nGomHnX2MlXZIZ,,,,,37.98869324,-84.48799896,anonymous,EN,A1MFK7TMLRJPDA,"1,2",3,6,,,,,,,,,,,,,,,,,,,,,,,,,,,,,,,,,,,,,,,,,,,,,,,,,,,,,,,,,,,,,,,,,,,,,,,,,,,,,,,,,,,,,,,,,,,,,,,,,,,,,,,,,,,,,,,,,,,,,,,,,,,,,,,,,,,,,,,,,,,,,,,,,,,,,,,,,,,,,,,,,,,,,,,,,,,,,,,,,,,,,,,,,,,,,,,,,,,,5,,,,,,,,,,,,,,,,,,,,,,,,,,,,,,,,,,,,,6,The only way to know how someone is doing is to evaluate past performance,5,5,4,2,2,2,No reason for him to feel bad,6,Manager's should perform honorably,1,1,59,1,3,1,5,4,
7/21/17 14:10,7/21/17 14:12,0,73.114.21.171,100,164,1,7/21/17 14:13,R_3M0eddgfMSeN8UI,,,,,42.22380066,-72.64089966,anonymous,EN,AB66CTVQ90RCV,"1,2",3,6,,,,,,,,,,,,,,,,,,,,,,,,,,,,,,,,,,,,,,,,,,,,,,,,,,,i dont really know the answer,,,,,,,,,,,,,,,,,,,,,,,,,,,,,,,,,,,,,,,,,,,,,,,,,,,,,,,,,,,,,,,,,,,,,,,,,,,,,,,,,,,,,,,,,,,,,,,,,,,,,,,,,,,,,6,mornings are busy,6,4,5,3,3,4,more money,4,neutral choice,1,,,,,,,,,,,,,,,,,,,,,,,,,1,,,,,,,,,,,,,,,,,,,,,,,,,,,,,,,,,,,,,,,,,,,,,,,,,1,27,1,6,2,1,2,
7/21/17 14:10,7/21/17 14:13,0,162.198.44.182,100,141,1,7/21/17 14:13,R_1OBsjOeEOT0x71Y,,,,,26.62030029,-80.05919647,anonymous,EN,A3VDFWL4MI3KPA,"1,2",3,6,,,,,,,,,,,,,,,,,,,,,,,,,,,,,,,,,,,,,,,,,,,,,,,,,3,"The manager chooses an applicant, but the algorithm selects the top applicant.",Lottery systems that evaluate based on statistics.,,,,,,,,,,,,,,,,,,,,,,,,,5,Sometimes there needs to be a mediator in making decisions.,4,4,4,4,4,4,I don't think he'd really care.,5,Computers generally work well.,1,,,,,,,,,,,,,,,,,,,,,,,,,,,,,,,,,,,,,,,,,,,,,,,,,,,,,,,,,,,,,,,,,,,,,,,,,,,,,,,,,,,,,,,,,,,,,,,,,,,,,,,,,,,,,,,,,,,,,,,,,,,,,,,,,,,,,,,,,,,,,,,,,,,,,,,,,,,,,,1,26,1,4,1,3,3,
7/21/17 14:10,7/21/17 14:13,0,199.36.83.129,100,178,1,7/21/17 14:13,R_2th5FbJWng6d2zS,,,,,39.8052063,-93.0428009,anonymous,EN,A06711361DP1JL158BWS8,"1,2",3,6,,,,,,,,,,,,,,,,,,,,,,,,,,,,,,,,,,,,,,,,,,,,,,,,,,,A set of rules followed by a computer to solve problems,,,,,,,,,,,,,,,,,,,,,,,,,,,,,,,,,,,,,,,,,,,,,,,,,,,,,,,,,,,,,,,,,,,,,,,,,,,,,,,,,,,,,,,,,,,,,,,,,,,,,,,,,,,,,6,"As long as they are normal length shifts, and not doubles.. I don't see an issue with it.",5,2,3,2,3,5,"Hard to tell without knowing if he normally works those shifts, if he is a morning person, if he has to get his kids ready for school/etc",3,Not enough knowledge to really know how well the algorithm is working well or not.,1,,,,,,,,,,,,,,,,,,,,,,,,,1,,,,,,,,,,,,,,,,,,,,,,,,,,,,,,,,,,,,,,,,,,,,,,,,,1,29,2,3,1,1,2,
7/21/17 14:12,7/21/17 14:13,0,70.165.119.24,100,76,1,7/21/17 14:13,R_2dzjMR94PTKWrfM,,,,,30.38380432,-91.05979919,anonymous,EN,A383U9YJIBG4IA,"1,2",3,6,,,,,,,,,,,,,,,,,,,,,,,,,,,,,,,,,,,,,,,,,,,,,,,,,,,,,,,,,,,,,,,,,,,,,,,,,,,,,,,,,,,,,,,,,,,,,,,,,,,,,,,,,,,,,,,,,,,,,,,,,,,,,,,,,,,,,,,,,,,,,,,,,,,,,,,,,,,,,,,,,,,,,,,,,,,,,,,,,,,,,,,,,,,,,,,,,,,,5,7,it seems reasonable to me,6,6,6,6,5,4,He'd probably feel okay with it.,5,It's their job.,1,,,,,,,,,,,,,,,,,,,,,,,,,,,,,,,,,,,,,4,28,2,5,1,5,1,
7/21/17 14:10,7/21/17 14:13,0,68.188.99.137,100,204,1,7/21/17 14:13,R_vJDxJbQlbvIWCCR,,,,,38.56469727,-90.53569794,anonymous,EN,AHPOOKYE7V04D,"1,2",3,6,,,,,,,,,,,,,,,,,,,,,,,,,,,,,,,,,,,,,,,,,,,,,,,,,,,formulas or heuristics designed by people but used by a computer to judge something based on calculations,,,,,,,,,,,,,,,,,,,,,,,,,,,,,,,,,,,,,,,,,,,,,,,,,,,,,,,,,,,,,,,,,,,,,,,,,,,,,,,,,,,,,,,,,,,,,,,,,,,,,,,,,,,,,,,,,,,,,,,,,,,,,,,,,,,,,2,I don't think an algorithm can accurately rate tone and speech. It needs a human.,2,2,4,4,6,6,"Proud/disappointed would depend on the rating. However I think most people would be unhappy and frustrated that they were being rated on such a qualitative, subjective thing by a computer.",2,"I don't think computers can accurately rate a subjective, qualitative thing like open end human speech response to customer service questions.",1,1,,,,,,,,,,,,,,,,,,,,,,,,,,,,,,,,,,,,,,,,,,,,,,,,,2,41,2,6,1,1,4,
7/21/17 14:10,7/21/17 14:13,0,72.198.74.135,100,183,1,7/21/17 14:13,R_1IFoAcTEuR0N8tZ,,,,,35.5151062,-97.57409668,anonymous,EN,A3OB6REG5CGHK1,"1,2",3,6,,,,,,,,,,,,,,,,,,,,,,,,,,,,,,,,,,,,,,,,,,,,,,,,,3,the process would make recommendations and the manager would choose to implement or not.,a primitive form and basis of AI,,,,,,,,,,,,,6,It only considers what improves productivity. ,4,5,4,3,2,1,He has to work some time.,6,I trust in processes.,1,,,,,,,,,,,,,,,,,,,,,,,,,,,,,,,,,,,,,,,,,,,,,,,,,,,,,,,,,,,,,,,,,,,,,,,,,,,,,,,,,,,,,,,,,,,,,,,,,,,,,,,,,,,,,,,,,,,,,,,,,,,,,,,,,,,,,,,,,,,,,,,,,,,,,,,,,,,,,,,,,,,,,,,,,,4,55,2,4,1,3,2,
7/21/17 14:10,7/21/17 14:13,0,63.152.114.167,100,201,1,7/21/17 14:13,R_1PTbvVEISyzWKSB,,,,,42.02450562,-91.66200256,anonymous,EN,A1VAFA14AUEZXG,"1,2",3,6,,,,,,,,,,,,,,,,,,,,,,,,,,,,,,,,,,,,,,,,,,,,,,,,,,,,,,,,,,,,,,,,,,,,,,,,,,,,,,,,,,,,,,,,,,,,,,,,,,,,,,,,,,,,,,,,,,,,,,,,,,,,,,,,,,,,,,,,,,,,,,,,,,,,,,,,,,,,,,,,,,,,,,,,,,,,,,,,,,,,,,,,,,,,,,,,,,,,5,,,,,,,,,,,,,,,,,,,,,,,,,,,,,,,,,,,,,6,Seems like pretty standard employee evaluation,2,1,2,2,2,3,"I think he would mostly feel neutral about it, maybe a little nervous",3,"Employee evaluations are notoriously frustrating for many reasons, and one reason is that managers tend to get a little high off their power",1,2,25,1,5,1,5,4,
7/21/17 14:09,7/21/17 14:13,0,68.45.51.224,100,233,1,7/21/17 14:13,R_NXU5mE1s7rfvFdL,,,,,39.07899475,-86.61750031,anonymous,EN,A2UNSF09FWX9S8,"1,2",3,6,,,,,,,,,,,,,,,,,,,,,,,,,,,,,,,,,,,,,,,,,,,,,,,,,3,The manager creates schedules with the assistance of the algorithm,a formula for making decisions ,,,,,,,,,,,,,,,,,,,,,,,,,,,,,,,,,,,,,,,,,,,,,,,,,,,,,,,,,,,,,4,Chris is scheduled when he is needed according to his availability,4,4,2,2,2,2,I don't think Chris will be emotional over his schedule,5,It is a useful aid if it is well designed,1,,,,,,,,,,,,,,,,,,,,,,,,,,,,,,,,,,,,,,,,,,,,,,,,,,,,,,,,,,,,,,,,,,,,,,,,,,,,,,,,,,,,,,,,,,,,,,,,,,,,,,,,,,,,,,,,,,,,,,,,,,2,54,2,5,1,4,2,
7/21/17 14:10,7/21/17 14:14,0,151.202.179.195,100,187,1,7/21/17 14:14,R_r86woJyZ3ws1rRn,,,,,40.66870117,-74.11430359,anonymous,EN,A1LPFEIDLT8Q22,"1,2",3,6,,,,,,,,,,,,,,,,,,,,,,,,,,,,,,,,,,,,,,,,,,,,,,,,,,,,,,,,,,,,,,,,,,,,,,,,,,,,,,,,,,,,,,,,,,,,,,,,,,,,,,,,,,,,,,,,,,,,,,,,,,,,,,,,,,,,,,,,,,,,,,,,,,,,,,,,,,,,,,,,,,,,,,,,,,,,,,,,,,,,,,,,,,,,,,,,,,,,5,,,,,,,,,,,,,6,If Chris is available to work mornings then it's fair that he is scheduled.,5,4,5,2,2,2,Chris should be happy to work since he will be making money.,5,He considers the employees' availability and how many of them may need to come in depending on how busy they are at that time. ,1,,,,,,,,,,,,,,,,,,,,,,,,,3,19,2,3,4,5,2,
7/21/17 14:10,7/21/17 14:14,0,184.178.113.110,100,192,1,7/21/17 14:14,R_3J8jVBahl5XPpqS,,,,,32.90789795,-116.6244049,anonymous,EN,A667L63P4M8NO,"1,2",3,6,,,,,,,,,,,,,,,,,,,,,,,,,,,,,,,,,,,,,,,,,,,,,,,,,,,THey are formulas that use data to make prediction.,,,,,,,,,,,,,,,,,,,,,,,,,,,,,,,,,,,,,,,,,,,,,,,,,,,,,,,,,,,,,,,,,,,,,,,,,,,,,,,,,,,,,,,,,,,,,,,,,6,Because the algorithm relies on previous data it makes sense to check those components of the machinery because it tells you when it tends to break down.,4,1,2,2,2,2,I think he wouldn't care much either way it does take the burden of making these decisions off of him.,5,I would trust it but feel like it would need some human oversight.,1,,,,,,,,,,,,,,,,,,,,,,,,,,,,,,,,,,,,,1,,,,,,,,,,,,,,,,,,,,,,,,,,,,,,,,,,,,,,,,,,,,,,,,,2,35,1,6,4,1,1,
7/21/17 14:11,7/21/17 14:14,0,107.146.214.180,100,180,1,7/21/17 14:14,R_3n31NPzYqf1W2Wx,,,,,35.20440674,-118.8647995,anonymous,EN,A1PTX4IB9R34LI,"1,2",3,6,2,I think it is unwise to rely on algorithims,3,4,4,5,5,5,its how i would feel,2,i do not trust algorithims,1,,,,,,,,,,,,,,,,,,,,,,,,,,,,,,,,,,,,,3,the manager observes the algorithim and lets it decide,A program that people think are accurate at predicting,,,,,,,,,,,,,,,,,,,,,,,,,,,,,,,,,,,,,,,,,,,,,,,,,,,,,,,,,,,,,,,,,,,,,,,,,,,,,,,,,,,,,,,,,,,,,,,,,,,,,,,,,,,,,,,,,,,,,,,,,,,,,,,,,,,,,,,,,,,,,,,,,,,,,,,,,,,,,,,,,,,,,,,,,,,,,,,,,,,,,,,,,,,,,,,,,,1,36,2,4,1,2,1,
7/21/17 14:10,7/21/17 14:14,0,172.72.42.234,100,221,1,7/21/17 14:14,R_CdxuOIL7fwl03Ml,,,,,35.17070007,-80.79199982,anonymous,EN,A2KDYSLV030FVX,"1,2",3,6,,,,,,,,,,,,,,,,,,,,,,,,,,,,,,,,,,,,,,,,,,,,,,,,,1,The manager would be able to evaluate much better than a computer algorithm.,Different patterns picked up by a computer to determine a final analysis.  ,,,,,,,,,,,,,,,,,,,,,,,,,,,,,,,,,,,,,,,,,,,,,,,,,,,,,,,,,,,,,,,,,,,,,,,,,,,,,,,,,,,,,1,A computer can't do this well.,2,2,1,7,6,7,He would be very upset if a real human were not used to evaluate his performance.,1,It is not possible for a machine to do the job of a human so trust is not possible.,1,,,,,,,,,,,,,,,,,,,,,,,,,,,,,,,,,,,,,,,,,,,,,,,,,,,,,,,,,,,,,,,,,,,,,,,,,,,,,,,,,,,,,,,,,,,,,,,,,,1,45,1,5,1,4,4,
7/21/17 14:09,7/21/17 14:14,0,146.6.61.13,100,268,1,7/21/17 14:14,R_2abIRoYYedQ8bah,,,,,30.2960968,-97.73690033,anonymous,EN,A2H2LO1OOF8R5N,"1,2",3,6,,,,,,,,,,,,,,,,,,,,,,,,,,,,,,,,,,,,,,,,,,,,,,,,,,,"Algorithms draw connections between superficial pieces of information, such as level of education, preferred hobbies, age, and data that can only be quantified.",,,,,,,,,,,,,,,,,,,,,,,,,,,,,,,,,,,,,,,,,,,,,,,,,,,,,,,,,,,,,,,,,,,,,,,,,,,,,,,,,,,,,,,,,,,,,,,,,,,,,,,,,,,,,,,,,,,,,,,,,2,"Algorithms may predict aptitude, but they cannot predict nuanced things like job loyalty, personality fit, fit with corporate culture and so on. ",2,2,2,6,4,6,"Chris would sort of get that sinking feeling you get from online dating -- you never get the right match, and the algorithm would set you up with inapproprate prospects.",1,"As mentioned, technology cannot predict if someone is a good fit for a corporate culture. It cannot predict enthusiasm, loyalty, and overall a good fit for a position. ",1,,,,,,,,,,,,,1,,,,,,,,,,,,,,,,,,,,,,,,,,,,,,,,,,,,,,,,,,,,,,,,,2,51,1,6,1,1,3,
7/21/17 14:10,7/21/17 14:14,0,65.24.79.170,100,266,1,7/21/17 14:14,R_2E3FnrVBZcXZrN6,,,,,41.3927002,-83.31970215,anonymous,EN,AL5HBAJ3ZCNSD,"1,2",3,6,,,,,,,,,,,,,,,,,,,,,,,,,,,,,,,,,,,,,,,,,,,,,,,,,,,,,,,,,,,,,,,,,,,,,,,,,,,,,,,,,,,,,,,,,,,,,,,,,,,,,,,,,,,,,,,,,,,,,,,,,,,,,,,,,,,,,,,,,,,,,,,,,,,,,,,,,,,,,,,,,,,,,,,,,,,,,,,,,,,,,,,,,,,,,,,,,,,,5,,,,,,,,,,,,,4,Chris chose to work there and the manager reasons.,4,4,4,4,4,4,I don't have enough information about Chris,4,The manager has experience doing it.,1,,,,,,,,,,,,,,,,,,,,,,,,,3,33,2,5,1,5,2,
7/21/17 14:10,7/21/17 14:14,0,4.15.196.146,100,224,1,7/21/17 14:14,R_bk0DrCxvSWrtr1v,,,,,40.45309448,-79.92939758,anonymous,EN,A2317PCB2IGHUC,"1,2",3,6,,,,,,,,,,,,,,,,,,,,,,,,,,,,,,,,,,,,,,,,,,,,,,,,,3,Manager would check Chris's work as part of the process,Procedures for doing something,6,"That is where he works, and its normal to be managed.",4,4,5,3,3,4,He is going about his work,5,Manager checks workers' work to ensure quality,1,,,,,,,,,,,,,,,,,,,,,,,,,,,,,,,,,,,,,,,,,,,,,,,,,,,,,,,,,,,,,,,,,,,,,,,,,,,,,,,,,,,,,,,,,,,,,,,,,,,,,,,,,,,,,,,,,,,,,,,,,,,,,,,,,,,,,,,,,,,,,,,,,,,,,,,,,,,,,,,,,,,,,,,,,,,,,,,,,,,,,,2,29,2,5,1,3,1,
7/21/17 14:10,7/21/17 14:14,0,12.166.46.254,100,280,1,7/21/17 14:14,R_bpx8izPY3jy3jeV,,,,,40.85969543,-74.40260315,anonymous,EN,A2JZUSRBP6H5S,"1,2",3,6,,,,,,,,,,,,,,,,,,,,,,,,,5,It's somewhat fair.  The algorithm can successfully vet options down to the most qualified applicants.  The manager should still conduct interviews in order to judge character.,4,4,3,4,3,4,Chris might feel that it's unfair for a computer to select top applicants.,5,The algorithm will select the most qualified based on information presented.,1,,,,,,,,,,,,,3,The algorithm selects the best job candidates based on their information.  The manager then schedules interviews based off that information. ,The algorithm is a computer program that recommends candidates based on information,,,,,,,,,,,,,,,,,,,,,,,,,,,,,,,,,,,,,,,,,,,,,,,,,,,,,,,,,,,,,,,,,,,,,,,,,,,,,,,,,,,,,,,,,,,,,,,,,,,,,,,,,,,,,,,,,,,,,,,,,,,,,,,,,,,,,,,,,,,,,,,,,,,,,,,,,,,,,,,,,,,,,,,,,,,,,,,,,,,,,,,,,,,,,,,,,,2,33,2,3,1,2,3,
7/21/17 14:11,7/21/17 14:14,0,69.85.236.5,100,206,1,7/21/17 14:14,R_1IckzQU1RMpxmmO,,,,,30.65750122,-88.15859985,anonymous,EN,A241PV6A122I5X,"1,2",3,6,,,,,,,,,,,,,,,,,,,,,,,,,,,,,,,,,,,,,,,,,,,,,,,,,3,The manage managed the algorithm,a program that monitors people's tone,,,,,,,,,,,,,,,,,,,,,,,,,,,,,,,,,,,,,6,It evaluates everyone else.,2,2,2,6,6,6,No one wants to be monitored.,4,They hopefully wouldn't implement it if it didn't work.,1,,,,,,,,,,,,,,,,,,,,,,,,,,,,,,,,,,,,,,,,,,,,,,,,,,,,,,,,,,,,,,,,,,,,,,,,,,,,,,,,,,,,,,,,,,,,,,,,,,,,,,,,,,,,,,,,,,,,,,,,,,,,,,,,,,,,,,,,,,,,,,,,,,1,31,1,5,1,3,4,
7/21/17 14:12,7/21/17 14:14,0,66.56.27.184,100,163,1,7/21/17 14:14,R_1CK52v8DuRSrybs,,,,,34.49429321,-84.91120148,anonymous,EN,A14UV8XLRVGXAY,"1,2",3,6,,,,,,,,,,,,,,,,,,,,,,,,,,,,,,,,,,,,,,,,,,,,,,,,,,,,,,,,,,,,,,,,,,,,,,,,,,,,,,,,,,,,,,,,,,,,,,,,,,,,,,,,,,,,,,,,,,,,,,,,,,,,,,,,,,,,,,,,,,,,,,,,,,,,,,,,,,,,,,,,,,,,,,,,,,,,,,,,,,,,,,,,,,,,,,,,,,,,5,,,,,,,,,,,,,,,,,,,,,,,,,,,,,,,,,,,,,7,It is the managers job to listen and make sure his employees are doing their work. ,7,7,7,1,1,1,Chris should be happy to be evaluated especially if he is doing his job good. ,7,He is doing his job and being honest. ,1,2,23,2,4,1,5,4,
7/21/17 14:10,7/21/17 14:14,0,174.103.167.92,100,263,1,7/21/17 14:14,R_1GZf9WuOgN0sHsS,,,,,43.08459473,-87.88800049,anonymous,EN,A2AAY4VT9L71SY,"1,2",3,6,,,,,,,,,,,,,,,,,,,,,,,,,,,,,,,,,,,,,5,"The algorithm is designed to be blind, so to speak, so using that information prevents the manager from using emotional judgements. However, he may miss some of the nuance of the recordings by only using the algorithm with no comparison.",4,4,3,1,1,3,"He may not be thrilled with the usage of the algorithm, as it does miss nuance, but he can be assured that the judgement of the algorithm is impartial, which should give him some measure of peace.",5,"It depends on the manager, I suppose. If he takes the information only at face value and makes no other judgements, it could be hard to trust him overall. However, a manager should use that information in a way that allows it to help him make a more informed opinion.",1,3,"The algorithm recorded and analyzed the calls, and the manager used that information to review and make a judgement.","They are processes done by a computer, using pre-programmed data to draw conclusions.",,,,,,,,,,,,,,,,,,,,,,,,,,,,,,,,,,,,,,,,,,,,,,,,,,,,,,,,,,,,,,,,,,,,,,,,,,,,,,,,,,,,,,,,,,,,,,,,,,,,,,,,,,,,,,,,,,,,,,,,,,,,,,,,,,,,,,,,,,,,,,,,,,,,,,,,,,,,,,,,,,,,,,,,,,,,,,,,,,,,,,,,,,,,,,,,,,2,31,2,2,1,2,4,
7/21/17 14:13,7/21/17 14:14,0,97.80.216.204,100,66,1,7/21/17 14:14,R_0pHpqQ99eZ3YOwp,,,,,34.53889465,-86.87329865,anonymous,EN,A2UIGDOLX5RV95,"1,2",3,6,,,,,,,,,,,,,,,,,,,,,,,,,,,,,,,,,,,,,,,,,,,,,,,,,,,,,,,,,,,,,,,,,,,,,,,,,,,,,,,,,,,,,,,,,,,,,,,,,,,,,,,,,,,,,,,,,,,,,,,,,,,,,,,,,,,,,,,,,,,,,,,,,,,,,,,,,,,,,,,,,,,,,,,,,,,,,,,,,,,,,,,,,,,,,,,,,,,,5,,,,,,,,,,,,,,,,,,,,,,,,,5,It's how I felt in my heart,5,3,3,5,6,2,It's how  I read it ,5,It makes sense ,1,,,,,,,,,,,,,2,22,1,3,1,5,3,
7/21/17 14:10,7/21/17 14:14,0,66.87.121.58,100,242,1,7/21/17 14:14,R_vJsONL4PL2FStJn,,,,,29.7973938,-95.2417984,anonymous,EN,A2K74NVS3GNOXW,"1,2",3,6,,,,,,,,,,,,,,,,,,,,,,,,,,,,,,,,,,,,,,,,,,,,,,,,,,,I think that they are software code that takes data and make a pattern out of it.,,,,,,,,,,,,,,,,,,,,,,,,,,,,,,,,,,,,,,,,,,,,,,,,,,,,,,,,,,,,,,,,,,,,,,,,,,,,,,,,,,,,,,,,,,,,,,,,,6,It's his job.,5,5,7,2,1,1,"He probably doesn't want to do at first, but overall likes fixing things.",6,It's uses data and is very accurate.,1,,,,,,,,,,,,,,,,,,,,,,,,,,,,,,,,,,,,,1,,,,,,,,,,,,,,,,,,,,,,,,,,,,,,,,,,,,,,,,,,,,,,,,,1,22,1,3,2,1,1,
7/21/17 14:10,7/21/17 14:14,0,98.245.66.27,100,283,1,7/21/17 14:14,R_33g06WFnIyfIbuV,,,,,39.7427063,-105.1186981,anonymous,EN,A2M6TJIR21BN2W,"1,2",3,6,,,,,,,,,,,,,,,,,,,,,,,,,,,,,,,,,,,,,,,,,,,,,,,,,,,processes created by calculations by a computer.,,,,,,,,,,,,,,,,,,,,,,,,,,,,,,,,,,,,,,,,,,,,,,,,,,,,,,,,,,,,,,,,,,,,,,,,,,,,,,,,,,,,,,,,,,,,,,,,,,,,,,,,,,,,,2,Because a person's schedule should not be decided by something that is not human.,3,3,3,5,5,5,Since I thought he would think it was unfair this is how I imagined he would react.,2,"Because it is not a human doing this. Algorithms are suitable for many things, but not making a person's schedule. It would not understand anything they may be going through that could affect their schedule.",1,,,,,,,,,,,,,,,,,,,,,,,,,1,,,,,,,,,,,,,,,,,,,,,,,,,,,,,,,,,,,,,,,,,,,,,,,,,1,30,2,3,1,1,2,
7/21/17 14:13,7/21/17 14:15,0,162.198.44.182,100,114,1,7/21/17 14:15,R_OwZMUMsRVd9CAlH,,,,,26.62030029,-80.05919647,anonymous,EN,A3CPZZNZDLFL6Z,"1,2",3,6,,,,,,,,,,,,,,,,,,,,,,,,,,,,,,,,,,,,,,,,,,,,,,,,,,,Computers.,,,,,,,,,,,,,,,,,,,,,,,,,,,,,,,,,,,,,,,,,,,,,,,,,,,,,,,,,,,,,,,,,,,,,,,,,,,,,,,,,,,,,,,,,,,,,,,,,,,,,,,,,,,,,,,,,,,,,,,,,3,An algorithm is just a computer. It can't truly evaluate Chris.,2,2,2,6,4,5,Nobody would want a sole computer to evaluate them.,3,It's not a human.,1,,,,,,,,,,,,,1,,,,,,,,,,,,,,,,,,,,,,,,,,,,,,,,,,,,,,,,,,,,,,,,,1,24,1,5,1,1,3,
7/21/17 14:11,7/21/17 14:15,0,23.112.114.15,100,258,1,7/21/17 14:15,R_3NJRQRCXO1aWMBY,,,,,28.53109741,-80.85230255,anonymous,EN,A1QEQOI98976S0,"1,2",3,6,,,,,,,,,,,,,,,,,,,,,,,,,,,,,,,,,,,,,,,,,,,,,,,,,,,,,,,,,,,,,,,,,,,,,,,,,,,,,,,,,,,,,,,,,,,,,,,,,,,,,,,,,,,,,,,,,,,,,,,,,,,,,,,,,,,,,,,,,,,,,,,,,,,,,,,,,,,,,,,,,,,,,,,,,,,,,,,,,,,,,,,,,,,,,,,,,,,,5,7,IT IS FAIR BECAUSE THE MANAGER IS A SUPERIOR OF CHRIS AND HE IS INTERESTED IN PREVENTING BREAKDOWNS AND FAILURES.,2,2,3,5,5,6,I BELIEVE CHRIS WOULD NOT BE HAPPY WITH THIS ASSIGNMENT BECAUSE HE WOULD RATHER BE COMPLETING OTHER TASKS.,6,I WOULD TRUST THE MANAGER BECAUSE HE OBVIOUSLY HAS A GREAT DEAL OF EXPERIENCE. ,1,,,,,,,,,,,,,,,,,,,,,,,,,,,,,,,,,,,,,2,33,2,5,2,5,1,
7/21/17 14:10,7/21/17 14:15,0,168.150.100.10,100,321,1,7/21/17 14:15,R_2EmE0puQQsbjd5Z,,,,,38.4828949,-121.639801,anonymous,EN,A3PP2MN7BY9PLP,"1,2",3,6,,,,,,,,,,,,,6,The algorithm looks at when employees are available and schedules them then. ,5,4,4,3,3,3,Chris should be happy that he has a job and was scheduled to work. No reason to be unhappy. ,6,The algorithm should be sound. ,1,,,,,,,,,,,,,,,,,,,,,,,,,3,The algorithm determined work hours based on availability and # customers and the manager implemented,Computer generated analysis ,,,,,,,,,,,,,,,,,,,,,,,,,,,,,,,,,,,,,,,,,,,,,,,,,,,,,,,,,,,,,,,,,,,,,,,,,,,,,,,,,,,,,,,,,,,,,,,,,,,,,,,,,,,,,,,,,,,,,,,,,,,,,,,,,,,,,,,,,,,,,,,,,,,,,,,,,,,,,,,,,,,,,,,,,,,,,,,,,,,,,,,,,,,,,,,,,,2,33,1,6,1,2,2,
7/21/17 14:10,7/21/17 14:15,0,75.128.183.238,100,320,1,7/21/17 14:15,R_1K88X60xTmgNIFZ,,,,,43.61470032,-84.79270172,anonymous,EN,A11QDNT3W7DT7K,"1,2",3,6,,,,,,,,,,,,,6,It takes the emotion/grudges/favoritism out of it.,6,4,4,2,2,2,S/He should be satisfied and nothing more.,5,"""based on"" means they can still do whatever they want, and then they'll mess things up.",1,,,,,,,,,,,,,,,,,,,,,,,,,3,"The manager looks at the algorithm then makes the decision based on that, but we don't know if it's literal or not.",Computer analyses run on data.,,,,,,,,,,,,,,,,,,,,,,,,,,,,,,,,,,,,,,,,,,,,,,,,,,,,,,,,,,,,,,,,,,,,,,,,,,,,,,,,,,,,,,,,,,,,,,,,,,,,,,,,,,,,,,,,,,,,,,,,,,,,,,,,,,,,,,,,,,,,,,,,,,,,,,,,,,,,,,,,,,,,,,,,,,,,,,,,,,,,,,,,,,,,,,,,,,1,33,2,6,1,2,2,
7/21/17 14:10,7/21/17 14:15,0,107.77.173.1,100,307,1,7/21/17 14:15,R_1ltMUcABDJd14ED,,,,,32.77870178,-96.82170105,anonymous,EN,A3RWJHQ66X0A4I,"1,2",3,6,,,,,,,,,,,,,,,,,,,,,,,,,,,,,,,,,,,,,,,,,,,,,,,,,1,Manager was the posotion that the algorithm picked canidites for.,Math equations using data ,,,,,,,,,,,,,,,,,,,,,,,,,3,Because it doesnt truly know Chris.,4,2,2,5,5,3,Because the right person cant be picked by computer algarythm,1,Cant understand other varibles.,2,,,,,,,,,,,,,,,,,,,,,,,,,,,,,,,,,,,,,,,,,,,,,,,,,,,,,,,,,,,,,,,,,,,,,,,,,,,,,,,,,,,,,,,,,,,,,,,,,,,,,,,,,,,,,,,,,,,,,,,,,,,,,,,,,,,,,,,,,,,,,,,,,,,,,,,,,,,,,,2,25,2,3,1,3,3,
7/21/17 14:13,7/21/17 14:15,0,68.44.237.33,100,148,1,7/21/17 14:15,R_10TrFhq8fpMp3HP,,,,,39.67799377,-86.20050049,anonymous,EN,A3GPPNKEAT48D8,"1,2",3,6,,,,,,,,,,,,,,,,,,,,,,,,,,,,,,,,,,,,,,,,,,,,,,,,,3,Algorithm determines manager oversees,a process figured out by using calculations,6,Seems like a good way to determine who does what ,5,6,5,2,2,1,I don't think it would bother him. It's just job.,6,A lot of trust to go with it. ,1,,,,,,,,,,,,,,,,,,,,,,,,,,,,,,,,,,,,,,,,,,,,,,,,,,,,,,,,,,,,,,,,,,,,,,,,,,,,,,,,,,,,,,,,,,,,,,,,,,,,,,,,,,,,,,,,,,,,,,,,,,,,,,,,,,,,,,,,,,,,,,,,,,,,,,,,,,,,,,,,,,,,,,,,,,,,,,,,,,,,,,2,25,2,5,1,3,1,
7/21/17 14:12,7/21/17 14:15,0,68.224.128.126,100,184,1,7/21/17 14:15,R_3KHrqsgG9Z31tKN,,,,,36.27290344,-115.1333008,anonymous,EN,A1VCIMAAY6GUD3,"1,2",3,6,,,,,,,,,,,,,,,,,,,,,,,,,,,,,,,,,,,,,,,,,,,,,,,,,,,,,,,,,,,,,,,,,,,,,,,,,,,,,,,,,,,,,,,,,,,,,,,,,,,,,,,,,,,,,,,,,,,,,,,,,,,,,,,,,,,,,,,,,,,,,,,,,,,,,,,,,,,,,,,,,,,,,,,,,,,,,,,,,,,,,,,,,,,,,,,,,,,,5,6,The manager does the analysis thus they know which components need maintenance.,4,4,4,4,4,4,I don't think he would feel any of those things strongly either way.,4,I don't know much about the manager but I would guess he's at least competent.,1,,,,,,,,,,,,,,,,,,,,,,,,,,,,,,,,,,,,,3,27,1,3,4,5,1,
7/21/17 14:12,7/21/17 14:16,0,73.153.127.24,100,227,1,7/21/17 14:16,R_1mJJtqe49t3BDW8,,,,,38.85209656,-104.7777023,anonymous,EN,A2OWVYIPSQB0QP,"1,2",3,6,,,,,,,,,,,,,,,,,,,,,,,,,,,,,,,,,,,,,,,,,,,,,,,,,3,algorithm selected the top candidates and the manager was able to review the algorithm,complicated math processes that analyze data to select the best options,,,,,,,,,,,,,,,,,,,,,,,,,5,The algorithm removes biases.,5,3,3,3,4,5,"I think he would be happy, but slightly frustrated because it removes the human element from the process.",5,Hopefully it's programmed well.,2,,,,,,,,,,,,,,,,,,,,,,,,,,,,,,,,,,,,,,,,,,,,,,,,,,,,,,,,,,,,,,,,,,,,,,,,,,,,,,,,,,,,,,,,,,,,,,,,,,,,,,,,,,,,,,,,,,,,,,,,,,,,,,,,,,,,,,,,,,,,,,,,,,,,,,,,,,,,,,1,30,1,5,1,3,3,
7/21/17 14:10,7/21/17 14:16,0,132.235.154.223,100,342,1,7/21/17 14:16,R_1hG7vN9Rp1z9BiW,,,,,39.30310059,-82.08280182,anonymous,EN,A1RWJ5O7X0N147,"1,2",3,6,,,,,,,,,,,,,,,,,,,,,,,,,,,,,,,,,,,,,,,,,,,,,,,,,,,algorithms are programs in a machine that analyze data and make decisions. ,,,,,,,,,,,,,,,,,,,,,,,,,,,,,,,,,,,,,,,,,,,,,,,,,,,,,,,,,,,,,,,,,,,,,,,,,,,,,,,,,,,,,,,,,,,,,,,,,6,"The machine is doing a lot of the work for him.  Without the machine, he would have to check all of the parts manually on a rotating schedule. The machine is calculating that for him so that all he has to do is the maintenance work.",6,6,4,1,1,1,I think he'd be grateful for the machine.  He doesn't have to do as much work.,7,"The machine analyzes everything, so there is less of a chance of error.  Human error is more common than machine error.",1,,,,,,,,,,,,,,,,,,,,,,,,,,,,,,,,,,,,,1,,,,,,,,,,,,,,,,,,,,,,,,,,,,,,,,,,,,,,,,,,,,,,,,,1,27,1,5,1,1,1,
